español	quechua
ROBIN HOOD	ROBIN HOOD
Anónimo	 Mana riqsisqa
CAPÍTULO UNO	 HUQ CAPÍTULO
NORMANDOS Y SAJONES	 NORMANOS Y SAJONES
Hace cientos de años, los vikingos realizaron continuas campañas de conquista por toda Europa.	 Pachaknintin watakuna ñawpaqtam Vikingo runakunaqa Europantinpi atipanankupaq campañakunata ruwarqaku.
Estos audaces guerreros daneses, noruegos o suecos, tuvieron atemorizado a medio mundo durante tres siglos.	 Kay mana manchakuq Danes, Noruega utaq Suecia maqanakuqkuna kimsa pachak watakuna kuskan pachata mancharisqa karqanku.
Sus aventuras parecían no tener límites geográficos: Alemania, Francia, España, Portugal o Rusia fueron visitados por los feroces vikingos.	 Aventurankuqa manas geográfico limiteyuq hinam karqa: Alemania, Francia, España, Portugal utaq Rusia nacionqa millay vikingokunam watukurqaku.
Su ansia de expansión, apoyada en una gran preparación militar, les llevó a emprender arriesgadas expediciones por mares y ríos.	 Mastarikuyta munasqanku, hatun awqaq pusaq wakichiywan yanapasqa, mama quchapi, mayukunapipas peligroso puriykunata ruwanankupaq pusarqan.
Las poderosas embarcaciones con las que contaban, únicas en la época, y su extraordinaria pericia como navegantes les permitían arribar a cualquier costa y penetrar por cualquier río.	 Chay tiempopi mana tupaq kallpasapa botekunayoq kasqanku, hinallataq barcopi puriq hina mana hayk’aq rikusqanku barcokuna ima costamanpas chayayta atirqanku, mayqen mayumanpas haykuyta atirqanku.
Su superioridad naval se hizo incontestable.	 Lamar qochapi aswan allin kayninmi mana atipanapaq hina kapurqan.
Adquirieron una gran experiencia en los ataques por sorpresa, y sus terribles y sangrientos saqueos llegaron a sertristemente célebres en toda Europa.	 Paykunaqa admirakuypaq ataquekunapim ancha experienciata tarirqaku, chaymi manchakuypaq hinaspa yawarllaña suwasqankuqa enteron Europa lawpi mana allin reqsisqa karqa.
Uno de estos pueblos vikingos, asentado desde hacía años en Normandía, emprendió la invasión de la vecina Inglaterra.	Chay Vikingo llaqtamanta hukninmi, Normandía nacionpi watakuna tiyaq, vecino Inglaterra nacionman haykuyta qallarirqan.
Este país, no muy lejano de las costas normandas, resultaba muy vulnerable por mar.	 Kay suyuqa, Normand mama quchap patanmanta mana karuchu, lamar quchapi ancha llakisqa karqa.
La longitud de su litoral no permitía ni una vigilancia completa, ni una concentración rápida de las tropas para rechazar un desembarco.	 Lamar qochapa patanpa suni kayninqa manam tukuy imata qawayta atirqachu nitaq chaylla tropakuna huñunakurqakuchu huk aterrizajeta qarqunankupaq.
Todo esto no pasó inadvertido a los ojos del duque normando Guillermo que, movido por su ambición y deseo de gloria, decidió preparar a conciencia el ataque a la isla.	 Tukuy chaykunaqa manan mana reparasqachu karqan Norman duque Williampa ñawinpi, payqa hatun munayninwan, hatunchasqa kayta munasqanwan ima, conciencianwan preparananpaqmi yuyaykurqan chay islapi ataqueta ruwanankupaq.
¡Venceremos a los sajones!	 ¡Sajón runakunata atipasun!
arengaba Guillermo a sus tropas.	 Guillermoqa tropankunatam haranguarqa.
Con la conquista de Inglaterra, nuestro poder se extenderá a otros reinos.	 Inglaterra nacionta atipaqtinkun atiyninchis mast’arikunqa huk reinokunamanpas.
¡Viva el duque Guillermo!	 ¡Kawsachun Duque William!
gritaban exaltados los caballeros normandos.	 altochasqa qaparirqanku Norman caballerokuna.
Guillermo de Normandía, animado por el apoyo de los suyos, continuó diciendo:	 Normandía llaqtamanta Guillermoqa llaqtanpa yanapayninwan kallpachasqa, nillarqantaq:
Los sajones vencieron a nuestros antepasados muchas veces.	 Sajón runakunaqa achka kutitam ñawpa taytanchikkunata maqarqaku.
Fueron más fuertes, más decididos, más inteligentes.	 Paykunaqa aswan kallpasapa, aswan decidisqa, aswan yuyaysapa karqanku.
Pero ahora no lo serán.	 Kunanmi ichaqa manaña chaynachu kanqa.
Ha llegado por fin nuestro momento y. .	Tiemponchismi tukukuypi chayamun hinaspa... .
¡ha llegado su hora!	 ¡tiempoykiqa chayarunñam!
Los aplausos y los vivas al duque Guillermo cesaron al acabar aquella multitudinaria reunión.	 Chay hatun huñunakuy tukukuptinqa manañam karqachu Duque Williampaq t’aqllakuypas kusikuypas.
Pero el fervor y la entrega de su ejército lo acompañarían de forma permanente durante toda la expedición.	 Ichaqa ejercitonpa tukuy sunqunwan tukuy sunqunwan tukuy sunqunwan tukuy sunqunwan tukuy sunqunwanmi wiñaypaq pusanman karqa.
Meses después, las naves capitaneadas por el duque Guillermo eran avistadas en las costas inglesas.	 Killakuna qhepamanmi Inglaterra nacionpa lamar-qochanpi rikurqanku duque Williampa umallisqan barcokunata.
Señor, se acercan barcos normandos comunicó un vigía al monarca sajón.	 Señor, Norman barcokunan asuykamushanku, chaytan huk qhawaq runa willarqan Sajón reyman.
Los sajones no estaban preparados para competir contra un peligro que procedía del mar.	 Sajón runakunaqa manan preparasqachu karqanku lamar-qochamanta peligrowan atipanakunankupaq.
¡Disponed todas las fuerzas posibles en tierra!	 ¡Allpapi tukuy atikuq kallpakunata allichay!
ordenó el rey inglés.	 nispas Inglaterra reyqa kamachirqan.
Debemos evitar el desembarco.	 Chay aterrizaje nisqataqa hark’ananchismi.
Una pequeña guarnición intentó impedir que los normandos tomaran tierra.	 Huk huch'uy guarnición nisqa normando runakuna allpa hap'inankupaq hark'ayta munarqan.
Pero no lo consiguió.	 Ichaqa manan chayta chaskirqanchu.
Así, Guillermo de Normandía desembarcó en las costas inglesas, y con sus valerosos guerreros avanzó hacia el interior.	 Chhaynapin Normandía llaqtamanta Guillermoqa Inglaterra nacionpa qochankunaman chayarqan, chaymi valorniyoq maqanakuqninkunawan kuska suyu ukhuman ñawparirqan.
Los sajones, en clara inferioridad numérica, se habían visto obligados a improvisar la decisiva batalla en Hastings.	Sajón runakunaqa, sut’imanta aswan askha kasqankurayku, Hastings llaqtapi decidiq maqanakuyta allinta ruwanankupaq obligasqa karqanku.
Poco duró el combate.	 Chay maqanakuyqa manan unaychu karqan.
El soberano inglés cayó mortalmente herido y el ejército sajón se rindió incondicionalmente.	 Inglaterra kamachiq wañuypaq k'irisqa karqan, Sajón awqaq suyutaq mana imamanta hark'asqalla qukurqan.
Las tropas del duque Guillermo siguieron avanzando hasta Londres, donde se libró una última batalla con la que desapareció la débil resistencia sajona.	 Duque Williampa tropankunaqa Londres llaqtamanmi ñawparirqaku, chaypim huk qipa maqanakuy karqa, chaymi Sajón runakunapa pisi kallpa harkakuyninta chinkachirqaku.
La expedición normanda había sido un rotundo éxito.	 Normandokunapa expedición nisqanqa ancha allinmi karqa.
En recuerdo de su victoria, el ya nuevo rey de Inglaterra, Guillermo I el Conquistador, tras ser coronado, mandó construir la célebre torre de Londres.	 Chay atipasqanmanta yuyarispan, kunan Inglaterra nacionpi mosoq rey, Guillermo I el Conquistador, coronasqa kasqan qhepaman, Londres llaqtapi reqsisqa Torreta ruwanankupaq kamachirqan.
Esta torre serviría de cárcel para numerosos y destacados personajes a lo largo de muchos años de la historia inglesa.	 Kay torreqa askha allin reqsisqa runakunapaqmi carcel hina kanman karqan Inglaterra nacionpa askha watakuna historianpi.
Guillermo I, tras su victoria, dedicó sus esfuerzos a pacificar el país, y tomó algunas medidas para proteger a los sajones.	 Guillermo I, atipasqan qhepamanmi, suyuta thasnunanpaq kallpachakuyninta qorqan, wakin ruwaykunatapas ruwarqan Sajón runakunata amachananpaq.
Os aconsejo prudencia recomendaba el rey a sus nobles.	 Yuyaymanaykichismi allin yuyaywan, chaytan reyqa umalliqninkunaman yuyaycharqan.
Debemos ser respetuosos con los vencidos.	 Respetasqa kananchismi atipasqakunata.
Sólo así conseguiremos la prosperidad en todas nuestras tierras.	Chayraqmi llapa allpanchikkunapi allin kawsayta aypasunchik.
Sólo así lograremos una pacífica convivencia.	 Chayraqmi hawkalla kawsakuyman chayasunchik.
Desgraciadamente, no todos los seguidores del rey Guillermo pensaban como él.	 Llakikuypaqmi, rey Guillermopa qatiqninkunaqa manam lliwchu pay hina piensarqaku.
Aprovechando una larga estancia del rey Guillermo en sus posesiones de Francia, los nobles normandos, Ilevados por su soberbia y ambición, no cesaron de causar humillaciones a los derrotados.	 Rey Guillermo Francia nacionpa kaqninkunapi unay tiempo kasqanmanta aprovechaspankum, Normano noble runakunaqa hatunchakusqankuwan hinaspa hatun munayninkuwan apasqa kaspanku, atipasqa runakunata pinqayman churayta saqirqaku.
Las cargas tributarias se hicieron cada vez más angustiosas, insoportables para los pobres súbditos.	 Impuesto pagasqankuqa aswan llakikuypaqmi karqa, wakcha kamachisqa runakunapaqqa mana aguantay atina.
Los sajones se sublevaron en masa contra los opresores.	 Sajón runakunaqa achkallañam hatarirqaku sarunchaqninkunapa contranpi.
Campesinos, artesanos y nobles unieron sus esfuerzos contra el enemigo común: los normandos.	 Chakra llamk'aqkuna, artesanokuna, noblekuna ima kallpachakuyninkuta hukllacharqanku, huklla awqap kuntranpi: normandokuna.
¡Ya está bien!	 Kunanqa allinmi!
decía indignado un caballero sajón.	 nispas huk sajón wiraqocha phiñasqa nisqa.
No podemos seguir tolerando las injusticias de los normandos.	 Manañan aguantayta atisunmanchu normando runakunaq mana chanin ruwasqankuta.
Quieren hacer de nosotros sus esclavos.	 Paykunaqa esclavonkuman tukuchiyta munanku.
¡Debemos combatirlos y ser capaces de librarnos de ellos para siempre!	 ¡Paykunawan maqanakunanchismi, wiñaypaqtaqmi chinkachinanchis!
¡Hay que quitarles el poder!	 ¡Atiyninkuta qechunanchismi!
¡Tenemos que ser gobernados por un rey sajón!	¡Huk sajón reypa kamachisqan kananchis!
El rey Guillermo, que había estado ausente de Inglaterra, encontró a su vuelta un país levantado en armas.	 Inglaterra nacionmanta mana kashaq rey Guillermoqa kutimushaspan huk nacionta tarirqan armasqa.
Los sajones se mostraban más rebeldes de lo que en un principio se podía suponer.	 Sajón runakunaqa aswan rebelde karqanku, qallariypi yuyaykusqanmantapas.
Los nobles normandos decían a su rey:	 Normando noblekuna reyninkuta nirqanku:
Señor, Ilevado por vuestra bondad y magnanimidad, habéis tratado demasiado bien a los sajones.	 Señor, sumaq sonqo kasqaykiwan, hatun sonqo kasqaykiwan apasqa, sajón runakunata nishuta allinta tratarqanki.
Mirad cómo os lo agradecen.	 Qhawariy imaynatachus gracias nisunki chayta.
Majestad, habéis respetado a vuestros súbditos, no les habéis expropiado sus tierras y, en cambio, ellos se sublevan contra vos.	 Majestadniyki, kamachisqaykikunata respetarqanki, manan allpankutapas qechurqanki, aswanpas qan contra hatarinku.
Son unos desagradecidos.	 Paykunaqa mana agradecekuqmi kanku.
El rey Guillermo, ajeno a los desmanes de sus nobles y desconociendo las razones por las que sus súbditos sajones se rebelaban contra él, creyó las acusaciones de sus barones.	 Rey Guillermoqa manan yacharqanchu noblekunaq nishuta ruwasqankuta, manataqmi yacharqanchu imarayku sajón kamachisqan runakuna pay contra hatarisqankuta, chaymi creerqan barononkunaq tumpasqankuta.
Caballeros, creí que los ánimos se apaciguarían.	 Señores, piensarqanim piñakuykuna chiriyananta.
Creí que, poco a poco, los sajones olvidarían la derrota de Hastings y acabarían aceptándonos.	 Pisi pisimantan yuyaykurqani Sajón runakuna Hastingspi atipasqankuta qonqaspa chaskiwanankupaq hamunankuta.
Ahora creo que no lo harán nunca dijo el rey en tono de lamento.	Kunanqa yuyaykuni mana hayk’aqpas ruwanankuta, nispas reyqa llakisqa nisqa.
Así, tomó la decisión de actuar de inmediato y con contundencia contra los sajones.	 Chay hinapin decidirqan chaylla, kallpawan sajón runakunaq contranpi ruwananpaq.
Despojó a muchos nobles de sus posesiones bajo acusación de haber promovido o respaldado la rebelión, y aplastó cruelmente a los rebeldes.	 Achka hatun kamachiqkunatam kapuqninkunata qichurqa chay hatariyta kallpanchasqanmanta utaq yanapasqanmanta tumpakuspa, hinaspam millayllaña rebeldekunata ñuturqa.
Pese a todo, los sajones continuaron organizándose.	 Tukuy imapas kaptinpas, Sajón runakunaqa hinallam organizakurqaku.
Crearon un verdadero ejército clandestino que, en forma de guerrilla, hostigaba sin tregua a los normandos.	 Paykunaqa chiqap pakasqa ejercitotam paqarichirqaku, chaymi guerrilla hina, mana samaspa Normanokunata ñakarichirqaku.
Los focos de resistencia contra los colonizadores se hicieron constantes.	 Colonizadorkunapa contranpi harkakuypa bolsillosninqa sapa kutim rikurirurqa.
La anhelada paz en Inglaterra se veía cada vez más lejana, y los normandos, aun ricos y poderosos, no podían vivir tranquilos a causa de las frecuentes insurrecciones de los sajones.	 Inglaterra nacionpi unayña suyasqanku thak kawsayqa aswan karumanmi rikch’akurqan, normando runakunaqa qhapaqpas atiyniyoqpas kashaspapas manan thak kawsayta atirqankuchu sajón runakuna sapa kutilla hatarisqankurayku.
Murió Guillermo I el Conquistador en guerra contra Francia y sus inmediatos sucesores, durante años y años, tampoco conseguirían apaciguar Inglaterra.	 Guillermo I Conquistador wañurqan Franciawan maqanakuypi, chaylla qatiqninkunapas, watakuna, watakuna, Inglaterratapas mana thasnuyta atirqankuchu.
La desconfianza de los sajones hacia los normandos estaba ya tan arraigada que se había convertido en un obstáculo insalvable entre los dos pueblos.	Sajón runakunaq Normando runakunaman mana confiasqankuqa sinchi saphichasqañan karqan, chaymi iskaynin llaqtakunaq mana atipay atina hark’ayninman tukupurqan.
Los planes de pacificación de los distintos reyes fallaban estrepitosamente y las revueltas continuaban.	 Huk rikchaq reykunapa pacificación nisqa planninkunaqa sinchitam mana allintachu ruwarqa, chaymi hatariykuna hinalla karqa.
Éstas eran contestadas con absoluta represión.	 Chaykunatan kutichirqanku absoluta represión nisqawan.
Lo que daba lugar a nuevos enfrentamientos, cada vez más sangrientos.	 Chaytaq musuq ch’aqwaykunata paqarichirqa, astawan yawarchasqa.
La espiral de violencia parecía no tener fin.	 Maqanakuypa espiralninqa mana tukukuq hinam karqa.
El rey Enrique de Plantagenet, nieto de Guillermo I, subió al trono y se propuso, como principal objetivo de su reinado, acabar con aquellas luchas sin sentido.	 Plantagenetmanta rey Enrique, Guillermo Ipa willkan, kamachikuq tiyanaman seqarqan, kamachiyninpi aswan hatun munaynin hina, chay mana yuyayniyuq maqanakuykunata tukuchinanpaq.
Para este propósito, pensó que debía atraerse, en primer lugar, a algunos influyentes nobles sajones.	 Chaypaqmi yuyaykurqan wakin atiyniyoq sajón noblekunata ñawpaqta aysasqa kanankuta.
Para conseguirlo,, no escatimó tiempo y esfuerzo el ilusionado rey.	 Chayta ruwananpaqqa kusisqa reyqa manan tiemponta nitaq kallpachakurqanchu.
CAPÍTULO DOS	 ISKAY RAKI
DOS NOBLES FAMILIAS SAJONAS	 ISKAY NOBLE SAJON AYLLUKUNA
En un majestuoso castillo cercano a la bulliciosa ciudad de Nottingham vivía Edward Fitzwalter, conde de Sherwood, y su esposa Alicia de Nhoridon.	 Nottingham llaqtaq qayllanpi huk hatun kastillopin tiyarqanku Edward Fitzwalter, Sherwood llaqtamanta conde, esposan Alice de Nhoridon ima.
Los dos eran sajones.	Iskayninkum sajón runakuna karqaku.
El matrimonio mantenía escasas relaciones sociales y permanecía alejado de las intrigas de la época.	 Chay casarasqakunaqa pisillatan runakunawan apanakurqanku, chay tiempopi imapas ruwasqankumantan karunchakurqanku.
El conde de Sherwood no había participado en ninguna sublevación contra los normandos y éstos, aun de mala gana, se habían visto obligados a respetar al conde y sus posesiones.	 Sherwood llaqtapi condeqa manan normandokunaq contranpi ima hatariypipas yanapakurqanchu, chaymi Normando runakunaqa mana munaspalla condeta kapuqninkunatapas respetanankupaq obligasqa karqanku.
Aunque no fue atacado nunca frontalmente, Edward Fitzwalter tampoco era mirado con buenos ojos por la nobleza normanda, en la que existía cierto recelo.	 Manaña hayk'aqpas ñawpaqpi atacasqachu karqan chaypas, Edward Fitzwaltertaqa manan allintachu qhawarirqanku Norman nobleza nisqakunaq, chaypin wakin iskayrayay karqan.
Dentro de los planes apaciguadores que llevaba acariciando durante largo tiempo el rey Enrique de Plantagenet, entraba precisamente ganarse la confianza del noble sajón Edward Fitzwalter	 Plantagenet llaqtamanta rey Enrique sutiyoq runaq unayña valorasqan thasnuchiq plankunamanta hukninmi karqan sajón nacionmanta Edward Fitzwalter sutiyoq noble runaq confiasqan.
Hablaré con Edward Fitzwalter comunicó el rey Enrique a uno de sus más estrechos colaboradores.	 Edward Fitzwalterwanmi rimasaq, nispan rey Enrique huknin aswan qaylla masinman willarqan.
Si consigo la adhesión del conde, tal vez otros nobles sajones lo secunden y poco a poco logremos el respaldo de todos.	 Sichus condeq yanapayninta ganasaq chayqa, ichapas huk sajón noblekuna paywan kuskachakunqaku, pisi pisimantataq llapa runaq yanapayninta ganasun.
¿Qué pensáis?	 ¿Ima niwaqtaq?
Es una buena idea, señor contestó el barón normando a su rey.	 Allinmi, wiraqocha, nispas kutichisqa baron normandoqa reyninman.
El conde de Sherwood goza de gran respeto entre la nobleza sajona.	Sherwood llaqtapi condeqa ancha respetasqam Sajón noblezakuna ukhupi.
Respeto sin duda merecido, ya que es todo un caballero.	 Mana iskayrayaspa respetayqa merecena, chiqap wiraqucha kasqanrayku.
La mayoría de los normandos comparten también esta opinión.	 Yaqa llapan normando runakunapas chaynatam piensanku.
El rey Enrique de Plantagenet deseaba con sinceridad que finalizaran los enfrentamientos entre sajones y normandos, y centró sus esfuerzos en conseguirlo.	 Plantagenets nisqamanta rey Enriqueqa tukuy sonqonwanmi munarqan sajón runakunaq normandokunaq maqanakuynin tukukunanta, chaymi kallpachakuyninta hunt’arqan.
Así, pocos días después de esta conversación, fue a reunirse con el conde de Sherwood.	 Chayhinam, kay rimanakuymanta pisi punchawkuna qipata, Sherwoodpa condewan tupananpaq rirqa.
Le tendió su mano y de sus labios salieron algunas promesas impensables en años anteriores.	 Makinta haywarispanmi siminmanta lloqsimurqan ñawpaq watakunapi mana yuyaykuy atina wakin promesakuna.
Señor, os agradezco la confianza que habéis depositado en mí contestó el conde,	 Wiraqocha, agradecekuyki noqapi confiasqaykimanta, nispas kutichisqa yupayqa, nispa.
Entonces, conde de Sherwood, ¿puedo contar de verdad con vos ?	 Chhaynaqa, conde de Sherwood, ¿cheqaqtachu qanpi yupayta atiyman?
preguntó el rey con impaciencia,	 nispas reyqa mana pacienciayoq hina tapusqa.
Majestad, no dudo de que os guían buenos deseos y de que sois sensible al sufrimiento del pueblo sajón comenzó a decir el conde.	 Majestad, manan iskayrayanichu allin munaykunawan pusasqa kasqaykimanta, Sajón runakunaq ñak’ariyninmantapas sensitivo kasqaykimanta, nispan condeqa niyta qallarirqan.
Pero vuestras promesas no son suficientes para paliar los daños que vuestro pueblo ha causado al mío.	 Ichaqa manan promesaykikunaqa aypanchu llaqtaykikunaq daño ruwasqankuta pisiyachinaykipaqqa.
Pero es necesario que todos hagamos el esfuerzo de salvar nuestras diferencias, conde de Sherwood.	Ichaqa llapanchismi kallpachakunanchis mana kaqlla kasqanchista allichananchispaq, conde de Sherwood.
La batalla de Hastings pertenece ya al pasado.	 Hastings maqanakuyqa kunanqa ñawpaqmantaraqmi.
Es cierto, señor Pero es pronto aún para confiar en vos.	 Chiqapmi, wiraqocha, ichaqa manaraqmi tempranoraq confianaykipaq.
Es posible que sean nuestros hijos los que vivan la reconciliación entre nuestros pueblos, los que puedan vivir en paz.	 Ichapas warmanchikkuna llaqtanchikkunapura allinyanakuyta rikuqkuna, hawka kawsayta atiqkuna.
¿Tenéis hijos, conde?	 Wawayuqchu kanki, Conde?
preguntó el rey asintiendo.	 nispas reyqa umanwan tapusqa.
Espero uno, majestad.	 Huknintam suyachkani, Majestad.
Conde de Sherwood, os prometo que haré cuanto pueda por acabar con los problemas del pueblo sajón, que intentaré borrar los errores de mis antepasados y que me esforzaré por apaciguar esta tierra.	 Conde de Sherwood, prometeyki, tukuy atisqayta ruwasaq Sajón runakunaq sasachakuyninkunata tukuchinaypaq, ñawpaq taytaykunaq pantasqankuta chinkachinaypaq kallpachakusaq, tukuy atisqayta ruwasaq kay hallp’ata thakchanaypaq.
Por mi parte, majestad contestó el conde, os aseguro que no participaré en ningún levantamiento contra vos.	 Ñoqamantaqa, Majestad, kutichisqa condeqa, segurayki, manan ima hatariypipas participasaqchu qan contra.
Actuaré como he venido haciéndolo hasta ahora.	 Kunankama ruwasqayman hinam ruwasaq.
Pero tampoco conseguiréis mi adhesión hasta que no exista una completa igualdad entre sajones y normandos.	 Ichaqa manan yanapaytapas ganankichischu sajón runakunaq normandokunaq hunt’asqa kaqlla kanankukama.
El rey Enrique y el conde de Sherwood estrecharon sus manos y se despidieron amistosamente.	Rey Enriquewan Sherwood condewanqa makinkuta hap’inakuspan allinta t’aqanakurqanku.
No mucho tiempo después, Edward Fitzwalter tuvo ocasión de comprobar que los buenos propósitos del rey Enrique quedaban olvidados ante una nueva revuelta sajona.	 Mana unaymanta, Edward Fitzwalterqa, manaraq musuq sajón hatarichkaptin, rey Enriquepa allin yuyaykusqan qunqasqa kasqanmanta chiqapchananpaq oportunidadta tarirqa.
La sublevación fue castigada con terrible dureza.	 Chay hatariyqa manchay k’arak simiwanmi muchuchisqa karqan.
Sajones y normandos seguían siendo enemigos irreconciliables.	 Sajón runakunapas normandokunapas mana allipunachinakuq awqa hinallam karqaku.
En esta triste situación vino al mundo el heredero del conde de Sherwood.	 Kay llakikuypaq situacionpin Sherwood condeq herederon kay pachaman hamurqan.
La alegría reinaba en todos los rincones del castillo del conde.	 Kusikuymi kamachikurqa condepa castillonpa sapa esquinanpi.
Amigos y vecinos acudieron a conocer al pequeño recién nacido.	 Amigukuna, vecinokuna ima chayraq naceq huch’uy wawawan tupanankupaq hamurqanku.
Un precioso niño había venido al mundo para felicidad de Alicia de Nhoridon y Edward Fitzwalter, sus padres.	 Huk ancha chaniyoq wawa kay pachaman hamusqa Alicia de Nhoridonpa, Edward Fitzwalterpa kusikuypaq, tayta-maman.
Se llamará Robert dijo el conde a todos los presentes sin disimular su alegría.	 Sutinqa Roberto kanqa, nispan condeqa llapa chaypi kaqkunata willarqan mana kusikuyninta pakaspa.
Será un valeroso sajón y confío en que le toque vivir tiempos mejores.	 Payqa kanqa valorniyoq sajón hinaspan confiani aswan allin p’unchaykunata rikunanta.
¡Ojalá pueda ser más feliz que nosotros!	 ¡Ñoqaykumanta aswan kusisqa kanman!
dijo levantando su copa uno de los allí reunidos.	 nispas chaypi huñunasqakunamanta huknin vasonta hoqarispa nisqa.
Y todos brindaron porque así fuera.	Hinaspa llapallanku tostarqaku chayna kasqanrayku.
El conde de Sherwood era íntimo amigo del también noble sajón Richard At Lea, conde de Sulrey.	 Sherwood llaqtapi condeqa Sajón llaqtamanta wiraqucha runamasin Richard At Lea sutiyuq Sulreypa conde sutiyuq runap allin amigunmi karqan.
Y éste y su esposa tuvieron, no mucho tiempo después, una preciosa niña, a la que pusieron por nombre Mariana.	 Hinaspa mana unaymantachu, warminwan huk sumaq sipasta tarirqanku, paytataq suticharqanku Mariana nispa.
Los dos nobles sajones se reunían con frecuencia y mantenían interminables conversaciones sobre la compleja situación del reino.	 Chay iskay sajón noblekunaqa sapa kutillanmi tuparqanku, mana tukukuqmi rimanakurqanku chay reinoq sasachakuyninmanta.
Las sublevaciones no cesan, querido amigo dijo Richard At Lea.	 Chay hatariykuna manan sayanchu, munasqa amigoy, nispas Richard At Lea nisqa.
Pero el poder normando permanece inalterable a lo largo de los años.	 Ichaqa Normanpa atiyninqa manan cambianchu watakunaq pasasqanman hina.
Sí, Richard, nuestro pueblo está extenuado por las luchas y por las humillaciones de los barones normandos.	 Arí, Richard, llaqtanchisqa sayk’usqañan kashan normando baronkunaq maqanakuyninkuwan, k’umuchisqa kasqankuwan ima.
Los reyes intentan apaciguar esta tierra, pero fracasan.	 Reykunan kay hallp’ata thasnuyta munanku, ichaqa manan atinkuchu.
No son capaces de contrarrestar el poder de sus nobles.	 Paykunaqa manan atinkuchu allin qhawarisqa runakunaq atiyninta atipayta.
Y mientras tanto, ¿por qué luchamos ya los sajones, después de tanto tiempo?	 Hinaspa chaykama, ¿imapaqtaq sajón maqanakuchkanchik, chayna unaymanta?
Todo parece ser una locura colectiva que no tiene fin.	 Tukuy imapas mana tukukuq huñusqa locuramanmi rikchakun.
Ojalá Inglaterra tenga pronto un rey poderoso y justo que haga posible la igualdad entre sajones y normandos contestó con tristeza Edward Fitzwalter	Suyachkani Inglaterra pisi tiempollamanta huk atiyniyuq chanin rey kananta, paymi sajón runakunawan normandokunawan kaqlla kayta ruwan, nispan Edward Fitzwalter llakisqa kutichirqan.
Pero los dos nobles sajones también aprovechaban su compañía para sonar, al calor de la chimenea de uno a otro castillo.	 Ichaqa chay iskay sajón noblekunapas compañiankuta aprovecharqankun mosqonankupaq, hukninmanta huknin castilloman nina rawraypa q’oñiyninpi.
El sueño que compartían era que Robert y Mariana, Ilegado el momento, se unieran en matrimonio.	 Chay musqukusqankuqa karqan Robertwan Marianawan, tiempo chayamuqtin, casarakunanku.
Nuestra amistad, conde de Sulrey, quedaría coronada por la unión de nuestros hijos.	 Amistadniyku, conde de Sulrey, coronasqa kanman karqan wawayku hukllanakusqankuwan.
Nada me agradaría más, Edward, que emparentar con vos.	 Edward, manan imapas aswan kusichiwanmanchu, qanwan ayllu kaymantaqa.
