español	quechua
A veces la hermana preguntaba al padre si quería tomar una cerveza, y se ofrecía amablemente a ir ella misma a buscarla, y como el padre permanecía en silencio, añadía para que él no tuviese reparos, que también podía mandar a la portera, pero entonces el padre respondía, por fin, con un poderoso «no», y ya no se hablaba más del asunto.	" Wakin kutipiqa hermanaqa taytata tapuq cerveza munasqanmanta, hinaspa sumaq sonqowan niq kikin rinanpaq apananpaq, taytataq ch’inlla kasqanrayku yapaykuq mana ima iskayrayananpaq, conserjetapas kachananpaq, ichaqa chaymanta taytaqa kutichisqa, tukukuypiqa, atiyniyoq ""manan"" nispa, manañataqmi chay asuntomanta rimarqankuñachu."
Ya en el transcurso del primer día el padre explicó tanto a la madre como a la hermana toda la situación económica y las perspectivas.	 Ñam punta punchawpi taytaqa mamamanpas ñañanmanpas sut’incharqa tukuy qullqimanta hinaspa ima suyakuykunamantapas.
De vez en cuando se levantaba de la mesa y recogía de la pequeña caja marca Wertheim, que había salvado de la quiebra de su negocio ocurrida hacía cinco años, algún documento o libro de anotaciones.	 Sapa kutinmi mesamanta hatarispa Wertheim marcaq huch’uy cajachanmanta, phisqa wata ñawpaqta negocionpa bancarrota kasqanmanta qespichisqanmanta, ima documentotapas otaq cuadernotapas hoqariq.
Se oía cómo abría el complicado cerrojo y lo volvía a cerrar después de sacar lo que buscaba.	Uyariwaqmi chay sasachakuyniyuq pestillota kichaspa maskasqanmanta hurquruspan kaqmanta wichqasqanmanta.
Estas explicaciones del padre eran, en parte, la primera cosa grata que Gregorio oía desde su encierro.	 Taytanpa kay sut’inchayninkunaqa, huk chikanpiqa, Gregorpa ñawpaq kusikuy uyarisqanmi karqan, wisq’asqa kasqanmantapacha.
Gregorio había creído que al padre no le había quedado nada de aquel negocio, al menos el padre no le había dicho nada en sentido contrario, y, por otra parte, tampoco Gregorio le había preguntado.	 Gregorioqa yuyaykusqañan chay negociomanta taytaqa manaña ima puchusqanmanta, aswanpas taytaqa manan contranpi imatapas rimasqachu, huk ladomantaq Gregoriopas mana tapusqachu.
En aquel entonces la preocupación de Gregorio había sido hacer todo lo posible para que la familia olvidase rápidamente el desastre comercial que les había sumido a todos en la más completa desesperación, y así había empezado entonces a trabajar con un ardor muy especial y, casi de la noche a la mañana, había pasado a ser de un simple dependiente a un viajante que, naturalmente, tenía otras muchas posibilidades de ganar dinero, y cuyos éxitos profesionales, en forma de comisiones, se convierten inmediatamente en dinero constante y sonante, que se podía poner sobre la mesa en casa ante la familia asombrada y feliz.	Chay tiempopiqa Gregorpa llakikuyninqa karqan tukuy atisqanman hina ruwaymi, chhaynapi chay familia usqhaylla qonqapunanpaq chay negociopi desgraciata, chaymi llapankuta sinchita hukmanyachirqan, chaymi payqa ancha especial k’arak sonqowan llank’ayta qallarisqa, yaqa huk tutallapitaqmi llank’ayta qallarisqa ripusqa huk sanu rantiq kasqanmanta huk rantiqman, payqa, chiqapmi, achka huk oportunidadkunayuq qullqita ganananpaq, hinaspa piqpa profesional allin ruwayninkuna, comisiones nisqapi, chaylla tikrakun sapa kuti sinchi qullqiman, chaymi wasipi mesapi churasqa kanman ñawpaqta admirasqa kusisqa ayllu.
Habían sido buenos tiempos y después nunca se habían repetido, al menos con ese esplendor, a pesar de que Gregorio, después, ganaba tanto dinero, que estaba en situación de cargar con todos los gastos de la familia y así lo hacía.	 Allin tiempokunan karqan manataqmi hayk’aqpas chay qhepaman yapamanta ruwasqachu karqan, chay sumaq kaywanllapas, Gregorio qhepaman askha qolqeta ganashaqtinpas, chaymi familianpa llapa gastonkunata apananpaq hinaña kasharqan, chaytan ruwarqan.
Se habían acostumbrado a esto tanto la familia como Gregorio, se aceptaba el dinero con agradecimiento, él lo entregaba con gusto, pero ya no emanaba de ello un calor especial.	Familiapas Gregorpas kaymanmi yachasqaña karqanku, qolqetaqa agradecekuspan chaskirqanku, payqa kusikuywanmi qorqan, ichaqa manañan chaymantaqa lloqsimurqanñachu huk especial q’oñikuyqa.
Solamente la hermana había permanecido unida a Gregorio, y su intención secreta consistía en mandarla el año próximo al conservatorio sin tener en cuenta los grandes gastos que e ello traería consigo y que se compensarían de alguna otra forma, porque ella, al contrario que Gregorio, sentía un gran amor por la música y tocaba el violín de una forma conmovedora Con frecuencia, durante las breves estancias de Gregorio en la ciudad, se mencionaba el conservatorio en las conversaciones con la hermana, pero sólo como un hermoso sueño en cuya realización no podía ni pensarse, y a los padres ni siquiera les gustaba escuchar estas inocentes alusiones; pero Gregorio pensaba decididamente en ello y tenía la intención de darlo a conocer solemnemente en Nochebuena.	 Ñañanllan Gregorioman k’askasqa qhepasqa, pakallapi yuyaykusqanqa karqan hamuq wata conservatorioman kachananpaq, mana qhawarispa hatun gastokunata chaywan apamunanta, chaytaq huk hinamanta pagasqa kananmanta, imaraykuchus pay, mana Gregorio hinachu, pay ancha munakuqmi karqan takikunata, violintapas tocaqmi kuyuchiq hina Sapa kuti, Gregorio llaqtapi pisi tiempolla kasqanpi, chay conservatoriomanta rimaqku ñañanwan rimanakuykunapi, ichaqa sumaq musquy hinallan, chaypa hunt’akuyninqa manan hunt’akunmanchu.mana yuyaymanay, tayta mamakunapas manan munarqankuchu kay mana huchayoq alusionkunata uyariyta; ichaqa Gregorqa decidispan chayta yuyaykurqan, hinaspan yuyaykurqan Navidad p’unchaypi solemnemente chayta reqsichiyta.
Este tipo de pensamientos, completamente inútiles en su estado actual, eran los que se le pasaban por la cabeza mientras permanecía allí pegado a la puerta y escuchaba.	Kay hina yuyaykuna, kunan kayninpi mana imapaqpas valeq, chaykunan yuyayninta chimparqan, punkuman pegasqa sayashaspa uyarishaqtin.
A veces ya no podía escuchar más de puro cansando y, en un descuido, se golpeaba la cabeza contra la puerta, pero inmediatamente volvía a levantarla, porque incluso el pequeño ruido que había producido con ello había sido escuchado al lado y había hecho enmudecer a todos.	 A veces ya no podía escuchar más de puro cansando y, en un descuido, se golpeaba la cabeza contra la puerta, pero inmediatamente volvía a levantarla, porque incluso el pequeño ruido que había producido con ello había sido escuchado al lado y había hecho enmudecer a llapan.
¿Qué es lo que hará?	 ¿Imatan ruwanqa?
decía el padre pasados unos momentos y dirigiéndose a todas luces hacia la puerta; después se reanudaba poco a poco la conversación que había sido interrumpida.	 taytaqa pisi ratumanta sut’ita punkuman rispa niq; chaymantataqmi chay rimanakuyqa pisi pisimanta yapamanta qallariq.
De esta forma Gregorio se enteró muy bien  —  el padre solía repetir con frecuencia sus explicaciones, en parte porque él mismo ya hacía tiempo que no se ocupaba de estas cosas, y, en parte también, porque la madre no entendía todo a la primera —  de que, a pesar de la desgracia, todavía quedaba una pequeña fortuna, que los intereses, aún intactos, habían hecho aumentar un poco más durante todo este tiempo.	Chay hinapin Gregorqa ancha allinta yacharqan — taytanqa sapa kutillanmi sut’inchayninkunata yapamanta rimaq, hukninpiqa pay kikin unayña kaykunata mana allichasqanrayku, hukninpitaq qallariypiqa maman mana tukuy imata entiendesqanrayku — chayta, chaywanpas chay desgraciaqa, huk huch’uy fortunaraqmi puchusqa, chaytan interesqa, mana imapas pasashaqtin, aswan pisita yapakurqan tukuy kay tiempopi.
Además, el dinero que Gregorio había traído todos los meses a casa  — él sólo había guardado para si unos pocos florines —  no se había gastado del todo y se había convertido en un pequeño capital.	 Chaymantapas, Gregorqa sapa killa wasinman apamusqan qullqiqa -paypaqmi iskay kimsa guilderkunallata waqaycharqa- mana hunt'asqatachu gastasqa, chaymi huch'uy capitalman tukusqa.
Gregorio, detrás de su puerta, asentía entusiasmado, contento por la inesperada previsión y ahorro.	 Gregorio, punkunpa qipanpi, kusisqa umanwan nirqa, mana suyasqanchikmanta ñawpaqmantaraq qawasqanmanta hinaspa qullqi waqaychasqanmanta kusisqa.
La verdad es que con ese dinero sobrante Gregorio podía haber ido liquidando la deuda que tenía el padre con el jefe y el día en que, por fin, hubiese podido abandonar ese trabajo habría estado más cercano; pero ahora era sin duda mucho mejor así, tal y como lo había organizado el padre.	Chiqapqa, chay puchuq qullqiwanmi Gregorioqa taytanpa jefenwan manukuyninta allichanman karqa, chay llamkayta saqinanpaq punchawqa aswan hichpallapim kanman karqa; ichaqa kunanqa cheqaqtapunin kay hinaqa aswan allin karqan, imaynan taytaq yuyaykusqanman hina.
Sin embargo, este dinero no era del todo suficiente como para que la familia pudiese vivir de los intereses; bastaba quizá para mantener a la familia uno, como mucho dos años, más era imposible.	 Ichaqa manan chay qolqeqa allinchu karqan chay familiaq interesninwan kawsanankupaq; Ichapas huk watalla ayllu uywanapaqlla karqa, aswan achkaqa iskay wata, aswan achkaqa mana atikuqmi karqa.
Así pues, se trataba de una suma de dinero que, en realidad, no podía tocarse, y que debía ser reservada para un caso de necesidad, pero el dinero para vivir había que ganarlo.	 Chhaynapin, cheqaqpiqa mana llamiy atikuq qolqen karqan, chaytaqa huk caso necesidadpaqmi waqaychasqa kanan karqan, ichaqa kawsanapaq qolqetan ganana karqan.
Ahora bien, el padre era ciertamente un hombre sano, pero ya viejo, que desde hacía cinco años no trabajaba y que, en todo caso, no debía confiar mucho en sus fuerzas; durante estos cinco años, que habían sido las primeras vacaciones de su esforzada y, sin embargo, infructuosa existencia, había engordado mucho, y por ello se había vuelto muy torpe.	Kunanqa, taytaqa cheqaqtapunin qhali runa karqan, ichaqa machuñan karqan, phisqa watañan mana llank’arqanchu, imaynaña kaqtinpas manan kallpanpi anchatachu confianan karqan; Kay pichqa watakunapi, llamkaq, chaywanpas mana ruruyuq kawsakuyninpa punta kaq vacacionnin, achka llasayta churarqa, chayraykum ancha torpeman tikrakururqa.
¿Y la anciana madre?	 Hinaspa machu mama?
¿Tenía ahora que ganar dinero, ella que padecía de asma, a quien un paseo por el piso producía fatiga, y que pasaba uno de cada dos días con dificultades respiratorias, tumbada en el sofá con la ventana abierta?	 ¿Kunanqa qolqetachu gananan karqan, asma onqoywan onqoq, chay wasipi purispa sayk’usqa, iskay p’unchaymanta huk p’unchaytaq samay sasachakuspa sofápi siriykusqa, ventana kichasqa?
¿Y la hermana también tenía que ganar.	 Hinaspapas chay hermanapas ganananmi karqan.
dinero, ella que todavía era una criatura de diecisiete años, a quien uno se alegraba de poder proporcionar la forma de vida que había llevado hasta ahora, y que consistía en vestirse bien, dormir mucho, ayudar en la casa, participar en algunas diversiones modestas y, sobre todo, tocar el violín?	 qullqi, payqa chunka qanchisniyuq watayuqraqraqmi karqa, paymanmi huknin kusisqa karqa kunankama pusasqan kawsayta quyta atisqanmanta, chaymi karqa allin pachakuy, achka puñuy, wasi muyuriqpi yanapakuy , wakin modesto kusirikuykunapi participaspa, llapanmanta aswantaqa violinta tocaspa?
Cuando se empezaba hablar de la necesidad de ganar dinero, Gregorio acababa por abandonar la puerta y arrojarse sobre el fresco sofá de cuero, que estaba junto a la puerta, porque se ponía al rojo vivo de vergüenza y tristeza.	Qullqita gananankumanta rimayta qallariptinkuqa, Gregorqa punkumanta lluqsispa, punkupa waqtanpi kaq q’uñi qara sofáman wischuykuyta tukuq, p’inqaywan llakikuywan ima puka rupayman tukuq.
A veces permanecía allí tumbado durante toda la noche, no dormía ni un momento, y se restregaba durante horas sobre el cuero.	 Mayninpiqa tutantinmi chaypi puñuq, manataqmi huk ratullapas puñuqchu, hinaspan askha horakuna qarapi maqchikuq.
O bien no retrocedía ante el gran esfuerzo de empujar una silla hasta la ventana, trepar a continuación hasta el antepecho y, subido en la silla, apoyarse en la ventana y mirar a través de la misma, sin duda como recuerdo de lo libre que se había sentido siempre que anteriormente había estado apoyado aquí.	 Otaq mana kuyuriqchu huk sillata ventanaman tanqaspa, chaymantataq sillaman wichaspa, silla patapi sayaspa, ventanaman k’umuykuspa hawata qhawarispa, mana iskayrayaspa yuyarichinanpaq hina libre kasqanmanta. payqa ñawpaqmantaraqmi kaypi yanapasqa kasqanmanta piensarqa.
Porque, efectivamente, de día en día, veía cada vez con menos claridad las cosas que ni siquiera estaban muy alejadas: ya no podía ver el hospital de enfrente, cuya visión constante había antes maldecido, y si no hubiese sabido muy bien que vivía en la tranquila pero central Charlottenstrasse, podría haber creído que veía desde su ventana un desierto en el que el cielo gris y la gris tierra se unían sin poder distinguirse uno de otra.	Imaraykuchus, chiqamanta, p’unchawmanta p’unchaw, mana ancha karuchu kaqkunata pisi pisimanta pisi sut’ita rikurqani: manaña chimpanpi kaq hospitalta rikurqanichu, piqpa sapa kuti rikuyninta ñawpaqta ñakarqani, chaytataq mana allintachu yacharqani chayqa Charlottenstrasse ch’in ichaqa chawpi llaqtapi tiyarqani, payqa yuyaykunman karqan ventananta qhawashasqanmanta huk ch’inneqpi maypichus gris hanaq pachawan gris allpawan mana t’aqay atina tupanakunku.
Sólo dos veces había sido necesario que su atenta hermana viese que la silla estaba bajo la ventana para que, a partir de entonces, después de haber recogido la habitación, la colocase siempre bajo aquélla, e incluso dejase abierta la contraventana interior.	 Iskay kutillatan necesitarqan allinta qhawariq ñañan chay silla ventanaq uranpi kashaqta rikunanpaq, chhaynapin, chaymantapacha, cuartota allichaspa, sapa kutilla chay cuartoq uranpi churananpaq, hinallataq ukhupi persianatapas kichasqata saqenanpaq.
Si Gregorio hubiese podido hablar con la hermana y darle las gracias por todo lo que tenía que hacer por él, hubiese soportado mejor sus servicios, pero de esta forma sufría con ellos.	 Sichus Gregorio pananwan rimaspa agradecekunman karqan tukuy ima ruwasqanmanta chayqa, aswan allintan aguantanman karqan servicionkuta, ichaqa chhaynapin paykunawan ñak’arirqan.
Ciertamente, la hermana intentaba hacer más llevadero lo desagradable de la situación, y, naturalmente, cuanto más tiempo pasaba, tanto más fácil le resultaba conseguirlo, pero también Gregorio adquirió con el tiempo una visión de conjunto más exacta.	Chiqamanta hermanaqa kallpachakuchkarqa chay mana allin kaqta astawan aguantananpaq, chiqamantataq aswan tiempo pasasqanmanjina aswan facil karqa chayta ruwananpaq, ichaqa Gregorqataq tiempowanqa aswan chiqanmanta qhawariyta jap’irqa.
Ya el solo hecho de que la hermana entrase le parecía terrible.	 Ñam chay hermana yaykusqanllaqa manchakuypaq hina rikchakurqa.
Apenas había entrado, sin tomarse el tiempo necesario para cerrar la puerta, y eso que siempre ponía mucha atención en ahorrar a todos el espectáculo que ofrecía la habitación de Gregorio, corría derecha hacia la ventana y la abría de par en par, con manos presurosas, como si se asfixiase y, aunque hiciese mucho frío, permanecía durante algunos momentos ante ella, y respiraba profundamente.	 Yaykusqan qhepallamanmi, mana tiempota hap’ispa punkuta wisq’ananpaq, Gregorioq cuartonpa rikusqan espectáculo nisqamanta llapa runakunata qespichinanpaq sapa kutilla allintaña qhawarirqan chaypas, derechota phawaylla ventanaman phawaykuspa usqhaylla makinwan kicharirqan. , asfixiasqa hina, ancha chiriña karqan chaypas, iskay kinsa ratulla ñawpaqenpi qhepakurqan, hinaspan sinchita samaykurqan.
Estas carreras y ruidos asustaban a Gregorio dos veces al día; durante todo ese tiempo temblaba bajo el canapé y sabía muy bien que ella le hubiese evitado con gusto todo esto, si es que le hubiese sido posible permanecer con la ventana cerrada en la habitación en la que se encontraba Gregorio.	Kay phawaylla, qapariykunan Gregorta manchachirqan iskay kutita p’unchaypi; Payqa tukuy kay tiempo sofá urapi khatatatasqa, allintataqmi yacharqan kusisqallaña tukuy kaykunata qespichinman karqan, Gregorpa kasqan cuartopi ventanata wisq’asqa qhepakuyta atispaqa.
Una vez, hacía aproximadamente un mes de la transformación de Gregorio, y el aspecto de éste ya no era para la hermana motivo especial de asombro, llegó un poco antes de lo previsto y encontró a Gregorio cuándo miraba por la ventana, inmóvil y realmente colocado para asustar.	 Huk kutinmi, yaqa huk killa Gregorpa t’ikrakusqanmanta, hinallataq rikch’ayninpas manaña huk especial causachu karqan admirakuypaq ñañanpaq, chayamusqa aswan ñawpaqtaraq, hinaspan tarirqan Gregorta ventanamanta qhawashaqta, mana kuyurispa hinallataq cheqaqtapuni rumiwan ch’aqesqa.manchachinanpaq
Para Gregorio no hubiese sido inesperado si ella no hubiese entrado, ya que él, con su posición, impedía que ella pudiese abrir de inmediato la ventana, pero ella no solamente no entró, sino que retrocedió y cerró la puerta; un extraño habría podido pensar que Gregorio la había acechado y había querido morderla.	 Gregoriopaqqa manan mana suyasqachu kanman karqan mana haykuqtinqa, payqa, posiciónninwanmi, hark’arqan chaylla ventanata kicharinanta, ichaqa manan mana haykuspallachu, aswanpas kutispa punkuta wisq’arqan; mana reqsisqan runaqa yuyaykunman karqan Gregor qatiykachaspa kaniyta munasqanmanta.
Gregorio, naturalmente, se escondió enseguida bajo el canapé, pero tuvo que esperar hasta mediodía antes de que la hermana volviese de nuevo, y además parecía mucho más intranquila que de costumbre.	Gregorqa chayllam sofá urapi pakakurqa, ichaqa chawpi punchawkamam suyanan karqa ñañan hukmanta kutimunanpaq, chaymantapas aswan mana hawkallaraqmi rikchakurqa sapa kutimantaqa.
Gregorio sacó la conclusión de que su aspecto todavía le resultaba insoportable y continuaría pareciéndoselo, y que ella tenía que dominarse a sí misma para no salir corriendo al ver incluso la pequeña parte de su cuerpo que sobresalía del canapé.	 Gregorqa yuyaykurqanmi rikch’ayninqa mana aguantay atinaraq kasqanmanta, hinallataqmi chhayna rikch’akunanta, hinallataqmi controlakunan karqan mana ayqekunanpaq, sofámanta lloqsimuq cuerponpa huch’uy partentapas rikuspa.
Para ahorrarle también ese espectáculo, transportó un día sobre la espalda  —  para ello necesitó cuatro horas —  la sábana encima del canapé, y la colocó de tal forma que él quedaba tapado del todo, y la hermana, incluso si se agachaba, no podía verlo.	 Paytapas kay espectáculo nisqamanta qespichinanpaqmi, huk punchaw wasanpi sofá hawaman chay sábanata aparqa —chaypaqqa tawa horatam necesitarqa— hinaspam allicharqa tukuyninpi tapasqa kananpaq, panantapas, qunqurakuspapas urayman, mana payta rikuyta atisqachu.
Si, en opinión de la hermana, esa sábana no hubiese sido necesaria, podría haberla retirado, porque estaba suficientemente claro que Gregorio no se aislaba por gusto, pero dejó la sábana tal como estaba, e incluso Gregorio creyó adivinar una mirada de gratitud cuando, con cuidado, levantó la cabeza un Poco para ver cómo acogía la hermana la nueva disposición.	Sichus, pananpa yuyaykusqanman hina, chay hoja mana necesariochu kanman karqan chayqa, horqonmanmi karqan, imaraykuchus sut’inmi karqan Gregorqa mana munaspallachu t’aqakusqan, ichaqa chay raphitaqa imayna kasqanman hinan saqerqan, Gregorpas yuyaykurqanmi adivinasqa agradecido qhawariyta, Cuidadowan, umantapas huk chhikanta hoqarispa imaynatas chay hermana mosoq arreglota hap’inqa chayta qhawananpaq.
Durante los primeros catorce días, los padres no consiguieron decidirse a entrar en su habitación, y Gregorio escuchaba con frecuencia cómo ahora reconocían el trabajo de la hermana, a pesar de que anteriormente ,se habían enfadado muchas veces con ella, porque les parecía una chica un poco inútil.	 Ñawpaq chunka tawayuq p’unchawkunapiqa, tayta mamakunaqa manan yuyaykuyta atirqankuchu cuartonkuman haykunankupaq, Gregoriotaq sapa kutilla uyarisqa imaynatas kunanqa ñañanpa llank’ayninta reqsirqanku, ñawpaqtaqa askha kutitaña phiñakurqanku chaypas, yuyaykusqankurayku payqa sipasmi karqan.un poco inútil.
Pero ahora, a veces, ambos, el padre y la madre, esperaban ante la habitación de Gregorio mientras la hermana la recogía y, apenas había salido, tenía que contar con todo detalle qué aspecto tenía la habitación lo que había comido Gregorio, cómo se había comportado esta vez y si, quizá, se advertía una pequeña mejoría.	Ichaqa kunanqa, mayninpiqa, taytapas mamapas Gregorpa cuartonpa hawanpin suyaqku ñañan hoqarishaqtin, lloqsimuqtin hinataqmi sut’ita willanan karqan imaynachus chay cuarto kasqanmanta, imatachus Gregor mikhusqanmanta, imaynatas payta mikhusqanmantawan kay kutipi comportakusqa hinaspa sichus, ichapas, huk huch’uy allinchakuy reparasqa karqan.
Por cierto, que la madre quiso entrar a ver a Gregorio relativamente pronto, pero el padre y la hermana se lo impidieron, al principio con argumentos racionales, que Gregorio escuchaba con mucha atención, y con los que estaba muy de acuerdo, pero más tarde hubo que impedírselo por la fuerza, y si entonces gritaba:.	 De paso, mamaqa pisi tiempollamantan Gregoriota qhawaq haykuyta munarqan, ichaqa taytan pananwanmi hark’arqanku, qallariypiqa allin yuyaywan discutiykunawan, chaytan Gregorioqa ancha allinta uyarirqan, chaywantaqmi tukuy sonqowan acuerdopi karqan, ichaqa qhepamanmi chay hina kanan karqan hark’asqa kallpawan chayta ruwananpaq, chaymantataq qapariqtin:.
Dejadme entrar a ver a Gregorio, pobre hijo mío!	 ¡Haykumuway Gregorio wakcha churiyta qhawanaypaq!
¿Es que no comprendéis que tengo que entrar a verle?» Entonces Gregorio pensaba que quizá sería bueno que la madre entrase, naturalmente no todos los días, pero sí una vez a la semana; ella comprendía todo mucho mejor que la hermana, que, a pesar de todo su valor, no era más que una niña, y, en última instancia, quizá sólo se había hecho cargo de una tarea tan difícil por irreflexión infantil.	¿Manachu entiendenki payta rikuspay haykuspay? Hinaptinmi Gregorqa piensarqa ichapas allin kanman maman yaykumuptinqa, naturalmente manam sapa punchawchu, aswanqa semanapi huk kutita; payqa tukuy imatan aswan allinta entienderqan hermanamantaqa, payqa, tukuy valorninwanpas, wawallaraqmi karqan, yaqapaschá qhepa t’aqwiypi ancha sasa ruwayta hap’irqan wawa hina mana yuyayniyoq kasqanwan.
El deseo de Gregorio de ver a la madre pronto se convirtió en realidad.	 Gregorioq mamanta rikuyta munasqanqa pisi tiempollamantan hunt’akurqan.
Durante el día Gregorio no quería mostrarse por la ventana, por consideración a sus padres, pero tampoco podía arrastrarse demasiado por los pocos metros cuadrados del suelo; ya soportaba con dificultad estar tumbado tranquilamente durante la noche, pronto ya ni siquiera la comida le producía alegría alguna y así, para distraerse, adoptó la costumbre de arrastrarse en todas direcciones por las paredes y el techo.	 P’unchaypiqa Gregorioqa manan ventanamanta rikuchikuyta munarqanchu, tayta-mamanta qhawarispa, ichaqa manan anchatachu qasqoyta atirqan chay pisi metro cuadrado allpapipas; tutapi ch’inlla puñuytaqa manañan aguantayta atirqanchu, pisi tiempollapin mikhuypas manaña kusikuyta qorqanchu chaymi, distraekunanpaq, perqakunapi, techopi ima tukuy ladoman qasqoyta qallarirqan.
Le gustaba especialmente permanecer colgado del techo; era algo muy distinto a estar tumbado en el suelo; se respiraba con más libertad; un ligero balanceo atravesaba el cuerpo; y sumido en la casi feliz distracción en la que se encontraba allí arriba, podía ocurrir que, para su sorpresa, se dejase caer y se golpease contra el suelo.	Paymanqa astawanmi gustarqa techomanta warkusqa kayqa; pampapi siriymantaqa ancha hukniraymi karqan; hukninmi aswan libreta samaykurqa; huk pisi kuyuriymi cuerponta pasarqa; hinaspataq chay pataman tarikusqan yaqa kusisqa distracción nisqaman chinkaykurqan, chaymi pasanman, admirakuyninpaq, urmaykuspa pampaman tupaykusqan.
Pero ahora, naturalmente, dominaba su cuerpo de una forma muy distinta a como lo había hecho antes y no se hacía daño, incluso después de semejante caída.	 Ichaqa kunanqa, cheqaqtapunin cuerponta controlarqan ñawpaqmantaqa huknirayta, manataqmi k’irikurqanchu, chhayna urmaykuspapas.
