español	quechua
LA METAMORFOSIS	METAMORFOSIS nisqa
Franz Kafka	 Franz Kafka sutiyuq runa
Una mañana, tras un sueño intranquilo, Gregorio Samsa se despertó convertido en un monstruoso insecto.	 Huk punchawmi paqarin, mana samayniyuq musqukusqan qipata, Gregor Samsa rikcharirqa huk manchakuypaq kuruman tikrasqa.
Estaba echado de espaldas sobre un duro caparazón y, al alzar la cabeza, vio su vientre convexo y oscuro, surcado por curvadas callosidades, sobre el cual casi no se aguantaba la colcha, que estaba a punto de escurrirse hasta el suelo.	 Payqa sinchi k’aspipin wasanpi siriykusqa, umantapas hoqarispataq rikurqan yana, k’uyusqa wiksanta, k’uyusqa calloswan surcoyoq, chay patapin edredónqa pisillata sayashasqa, chaymi pampaman llimp’inanpaqña kashasqa.
Numerosas patas, penosamente delgadas en comparación al grosor normal de sus piernas, se agitaban sin concierto.	 Askha chakikuna, khuyapayakuq llañu chakikuna normal rakhu kayninwan tupachisqa, mana ima munaytapas kuyuchirqanku.
¿Qué me ha ocurrido?	 ¿Imataq ñuqawan pasarqa?
No estaba soñando.	 Manam musqukuchkarqanichu.
Su habitación, una habitación normal, aunque muy pequeña, tenía el aspecto habitual.	 Cuartonqa, normal cuarto, ancha huch’uyña karqan chaypas, costumbreman hina rikch’ayniyoqmi karqan.
Sobre la mesa había desparramado un muestrario de paños  — Samsa era viajante de comercio — , y de la pared colgaba una estampa recientemente recortada de una revista ilustrada y puesta en un marco dorado.	 Mesa patapin mast’arisqa kashasqa huk muestreador de tela-Samsaqa viajaq vendeqmi kasqa- perqapitaqmi warkusqa huk dibujo chayllaraq kuchusqa huk dibujasqa revistamanta, hinaspa qorimanta marcopi churasqa.
La estampa mostraba a una mujer tocada con un gorro de pieles, envuelta en una estola también de pieles, y que, muy erguida, esgrimía un amplio manguito, asimismo de piel, que ocultaba todo su antebrazo.	Chay impresopin rikukurqan huk warmi millwamanta gorrayoq, millwa suwawan p’istuykusqa, hinaspan ancha sayaq kashaspa ancho muff nisqawan kuyurichisqa, chaypas millmamanta ruwasqa, chaymi llapa ñawpaq makinta pakasqa.
Gregorio miró hacia la ventana; estaba nublado, y sobre el cinc del alféizar repiqueteaban las gotas de lluvia, lo que le hizo sentir una gran melancolía.	 Gregorioqa ventanaman qhawarisqa; puyuyuqmi karqan, paraq sut’uyninkunapas sillp’aq zinc nisqapi kuyurirqan, chaymi anchata llakisqa sientekurqan.
«Bueno  — pensó — ; ¿y si siguiese durmiendo un rato y me olvidase de todas estas locuras?» Pero no era posible, pues Gregorio tenía la costumbre de dormir sobre el lado derecho, y su actual estado no permitía adoptar tal postura.	 Bueno, nispas yuyaykusqa. ¿Imataq kanman huk rato puñuspalla kay tukuy loco kaqkunata qunqaruspayqa?» Ichaqa manan atikurqanchu, Gregorioqa paña ladonpi puñuy costumbreyoqmi karqan, kunan imayna kasqanpas manan permitirqanchu chhayna posiciónta hap’iyta.
Por más que se esforzara, volvía a quedar de espaldas.	 Maytaña kallpachakurqan chaypas, hukmantan wasanpi kasharqan.
Intentó en vano esta operación numerosas veces; cerró los ojos para no tener que ver aquella confusa agitación de patas, pero no cesó hasta que notó en el costado un dolor leve y punzante, un dolor jamás sentido hasta entonces.	 Payqa askha kutitan kay operacionta ruwarqan yanqapaq; Ñawinta wisq’aykusqa mana chay ch’aqwasqa chaki ch’aqwayta rikunanpaq, ichaqa manan sayarirqanchu ladonpi pisilla, k’iriq nanayta sientenankama, mana hayk’aqpas sientesqan nanayta.
¡Qué cansada es la profesión que he elegido!	 ¡Mayna sayk’usqañan kashan akllasqay profesionqa!
se dijo — .	 nisqa -.
Siempre de viaje.	 Sapa kuti purispa.
Las preocupaciones son mucho mayores cuando se trabaja fuera, por no hablar de las molestias propias de los viajes: estar pendiente de los enlaces de los trenes; la comida mala, irregular; relaciones que cambian constantemente, que nunca llegan a ser en verdad cordiales, y en las que no tienen cabida los sentimientos.	Llakikuykunaqa aswan hatunmi hawapi llamkaspaqa, mana rimanachu puriypa mana allin kayninmanta: trenpa puriyninta qawaspa; mana allin, mana sapa kuti mikhuy; sapa kutilla cambiaq, mana hayk’aqpas cheqaq sonqowan munakuq, manataqmi sientekuykunapas kanchu.
¡Al diablo con todo!	 ¡Chay infiernowanqa!
Sintió sobre el vientre un leve picor, con la espalda se deslizó lentamente más cerca de la cabecera de la cama para poder levantar mejor la cabeza; se encontró con que la parte que le picaba estaba totalmente cubierta por unos pequeños puntos blancos, que no sabía a qué se debían, y quiso palpar esa parte con una pata, pero inmediatamente la retiró, porque el roce le producía escalofríos.	 Wiksachanpi pisilla picazón nisqa sientesqa, wasanwanmi pisi pisimanta puñuna umaman asuykuspa umantapas aswan allinta hoqarinanpaq; tarisqa chay picakuq parteqa llapanta tapasqa kashaqta huch’uy yuraq ch’ikukunawan, chaykunan mana yacharqanchu imamantachus kashasqanmanta, chaymi chay parteta chakinwan sienteyta munarqan, ichaqa chay ratolla horqorqan, llamiykusqanwan chiriyachisqanrayku.
Se deslizó de nuevo a su posición inicial.	 Hukmantam qallariypi kasqanman lliwchakururqa.
«Esto de levantarse pronto  — pensó —  le hace a uno desvariar.	 -Kay temprano hatariyqa, nispas yuyaykusqa, —huktaqa deliriotan ruwan.
El hombre tiene que dormir.	 Qharikunaqa puñunanku tiyan.
Otros viajantes viven como pachás.	 Huk puriqkunapas pashas hinam kawsanku.
Si yo, por ejemplo, a lo largo de la mañana vuelvo a la pensión para pasar a limpio los pedidos que he conseguido, estos señores todavía están sentados tomando el desayuno.	Sichus ñoqa, ejemplopaq, tutamantan pensionman kutisaq pedidokuna chaskisqayta pichanaypaq chayqa, kay wiraqochakunaqa tiyashankuraqmi desayunaspa.
Eso podría intentar yo con mi jefe, en ese momento iría a parar a la calle.	 Chaytaqa jefeywan pruebayta atiyman, chay ratopin callepi tukuq kani.
Quién sabe, por lo demás, si no sería lo mejor para mí.	 Pi yachan, wakinpaq, sichus mana aswan allinchu kanman ñoqapaq.
Si no tuviera que dominarme por mis padres, ya me habría despedido hace tiempo, me habría presentado ante el jefe y le habría dicho mi opinión con toda mi alma.	 Mana tayta-mamaypa kamachisqan kaspayqa unayñam despedikuyman karqa, jefemanmi presentakuyman karqa hinaspam tukuy almaywan piensasqayta willayman karqa.
¡Se habría caído de la mesa!	 ¡Mesamanta urmaykunman karqan!
Sí que es una extraña costumbre la de sentarse sobre la mesa y, desde esa altura, hablar hacia abajo con el empleado que, además, por culpa de la sordera del jefe, tiene que acercarse mucho.	 Arí, huk admirakuypaq costumbrem mesapi tiyaykuspa, chay altomanta urayman rimay chay llamkaqwan, payqa, aswanqa, jefepa mana uyariq kasqanraykum, anchata asuykunan.
Bueno, la esperanza todavía no está perdida del todo; si alguna vez tengo el dinero suficiente para pagar las deudas que mis padres tienen con él  — puedo tardar todavía entre cinco y seis años lo hago con toda seguridad.	 Bueno, suyakuyqa manaraqmi allintachu chinkapun; sichus hayk’aqllapas qolqey kanqa tayta-mamaypa payman manukuyninta paganaypaq — phisqa otaq soqta wataraqmi kanman chayqa, seguron ruwasaq.
Entonces habrá llegado el gran momento, ahora, por lo pronto, tengo que levantarme porque el tren sale a las cinco», y miró hacia el despertador que hacía tictaqueaba sobre el armario.	Hinaptinqa hatun rato chayamunqaña, kunanqa, kunankamaqa, hatarinaymi tren pichqa horata lluqsisqanrayku’, nispas qawarqa despertadorta, chaymi guardarropapi llachpachkaqta.
«¡Dios del cielo!», pensó.	 ¡Dios hanaq pachapi!, nispas yuyaykusqa.
Eran las seis y media y las manecillas seguían tranquilamente hacia delante, ya había pasado incluso la media, eran ya casi las menos cuarto.	 Soqta horas kuskanña kashaqtin makikunapas thaklla ñawpaqman puririrqanku, kuskan pasasqaraqmi karqan, yaqa huk cuartoñañan kasharqan.
«¿Es que no habría sonado el despertador?» Desde la cama se veía que estaba correctamente puesto a las cuatro, seguro que también había sonado.	 -Manachu despertadorqa waqanman karqa? Puñunamantaqa rikukuqmi tawa horapi allinta churasqa kashasqanmanta, cheqaqtapunin uyarikullarqantaq.
Sí, pero.  ¿era posible seguir durmiendo tan tranquilo con ese ruido que hacía temblar los muebles?	 Arí, ichaqa. ¿Atikurqachu chayna hawkalla puñuyta hinalla chay qapariywan, chaymi mueblekunata kuyuchirqa?
Bueno, tampoco había dormido tranquilo, pero quizá tanto más profundamente.	 Bueno, payqa manan thakchu puñusqapas, ichaqa yaqapaschá aswan allinta puñusqa.
¿Qué iba a hacer ahora?	 ¿Imatan kunan ruwanan karqan?
El siguiente tren salía a las siete, para cogerlo tendría que haberse dado una prisa loca, el muestrario todavía no estaba empaquetado, y él mismo no se encontraba especialmente espabilado y ágil; e incluso si, consiguiese coger el tren, no se podía evitar una reprimenda del jefe, porque el mozo de los recados habría esperado en el tren de las cinco y ya hacía tiempo que habría dado parte de su descuido.	Qatiqnin trenqa qanchis horasta ripurqan, payqa loco hina usqhayllan kanan karqan hap’inanpaq, muestrakunaqa manaraqmi hunt’asqachu karqan, pay kikinpas manan ancha alertachu nitaq ágilchu karqan; hinaspapas trenta hap’iyta atispapas manan jefeq k’amiynintaqa hark’ayta atikunmanchu, imaraykuchus chay entregaq waynaqa phisqa horas trenta suyanman karqan, unayñataqmi willanman karqan mana qhawarisqa kasqanmanta.
Era un esclavo del jefe, sin agallas ni juicio.	 Payqa jefeq esclavonmi karqan, mana tripasniyoq nitaq juzgaq.
¿Qué pasaría si dijese que estaba enfermo?	 ¿Imatan ruwawaq onqosqayta niqtiy?
Pero esto sería sumamente desagradable y sospechoso, porque Gregorio no había estado enfermo ni una sola vez durante los cinco años de servicio.	 Ichaqa kayqa sinchi mana allinmi kanman, iskayrayanapaqtaqmi kanman, Gregorioqa manan huk kutillatapas onqosqachu phisqa wata llank’asqanpi.
Seguramente aparecería el jefe con el médico del seguro, haría reproches a sus padres por tener un hijo tan vago y se salvaría de todas las objeciones remitiéndose al médico del seguro, para el que sólo existen hombres totalmente sanos, pero con aversión al trabajo.	 Chiqamanta jefeqa seguro doctorwan rikhurinman, tayta-mamanta k’aminman chhayna qhella churiyoq kasqanmanta hinaspan llapa hark’akuykunamanta qespikunman seguro doctorman rimaspa, paypaqqa kanmi totalmente qhali qharikunalla, ichaqa llank’ayta millakuspa .
¿Y es que en este caso no tendría un poco de razón?	 Hinaspa, ¿manachu chay kay casopi huk chikan allin kanman?
Gregorio, a excepción de una modorra realmente superflua después del largo sueño, se encontraba bastante bien e incluso tenía mucha hambre.	Unay puñusqan qhepaman cheqaqtapuni mana imapaq valeq puñuymantaqa, Gregorqa allintan sientekurqan, sinchi yarqasqaraqmi karqan.
Mientras reflexionaba sobre todo esto con gran rapidez, sin poderse decidir a abandonar la cama  — en este mismo instante el despertador daba las siete menos cuarto — , llamaron cautelosamente a la puerta que estaba a la cabecera de su cama.	 Tukuy kaykunata ancha utqaylla yuyaymanachkaptin, mana yuyayninta ruwayta atispan puñunanmanta lluqsinanpaq —kay ratollapim despertadorqa huk cuartomanta qanchiskama — huk cuidadowan punkuta takarqaku puñunanpa umanpi.
Gregorio  — dijo la voz de su madre — , son las siete menos cuarto.	 Gregorio —nisqa mamanpa kunkan—, tawamanta qanchiskamaña.
¿No ibas a salir de viaje?	 ¿Manachu huk viajeman rirqanki?
¡Qué voz tan dulce!	 ¡Ima misk’i kunkataq!
Gregorio se hororizó al oír en cambio la suya propia, que era la de siempre, pero mezclada con un penoso y estridente silvido, que en el primer momento dejaba salir las palabras con claridad para, al prolongarse el sonido, destrozarlas de tal forma que no se sabía si se había oído bien.	 Aswanpas Gregorqa mancharisqallañam karqa kikinpa silbasqan uyarispan, chayqa sapa kuti hinam karqa, ichaqa nanaywan, qapariq silbaywan chaqrusqa, chaymi qallariypiqa sutillata lluqsichirqa, chaymi uyarikusqanman hina, atisqankuman hina chinkachirqa mana uyarisqa kayta yacharqanki allintachu uyarirqanki.
Gregorio querría haber contestado detalladamente y explicarlo todo, pero en estas circunstancias se limitó a decir:	 Gregorioqa munanmanmi karqan sut’ita kutichiyta, tukuy imata sut’inchayta, ichaqa kay hina kaqtinqa kayllatan niyta munarqan:
Sí, sí, gracias madre.	 Arí, arí, gracias mamay.
Ya me levanto.	 Hatarichkani.
Probablemente a causa de la puerta de madera no se notaba desde fuera el cambio en la voz de Gregorio, porque la madre se tranquilizó con esta respuesta y se marchó de allí.	Yaqapaschá chay k’aspi punkurayku, Gregorpa kunkanpa t’ikrakuyninqa mana hawamanta reparasqachu, imaraykuchus mamaqa kay kutichiywan thasnukuspa chaypi ripurqan.
Pero merced a la breve conversación, los otros miembros de la familia se habían dado cuenta de que Gregorio, en contra de todo lo esperado, estaba todavía en casa, y ya el padre llamaba suavemente, pero con el puño, a una de las puertas laterales.	 Ichaqa pisi rimayllapi rimasqankuraykun, chay familiapi wakin runakunaqa reparasqaku Gregorioqa, llapa yuyaykusqankuman hina, wasinpiraq kashasqanmanta, taytataq llamp’ullata takkashasqaña, ichaqa puñunanwan, huknin punkuta.
¡Gregorio, Gregorio!	 ¡Gregorio, Gregorio!
gritó — .	 qapariy - .
¿Qué ocurre?	 ¿Imataq pasakun?
tras unos instantes insistió de nuevo con voz más grave — .	 Iskay kimsa ratumanta aswan serio kunkawan yapamanta insistirqa.
¡Gregorio, Gregorio!	 ¡Gregorio, Gregorio!
Desde la otra puerta lateral se lamentaba en voz baja la hermana.	 Huk lado punkumantam hermanaqa pisi kunkawan waqaykusqa.
Gregorio, ¿no te encuentras bien?, ¿necesitas algo?	 Gregorio, ¿manachu allin sientekunki, ¿imatapas necesitankichu?
Gregorio contestó hacia ambos lados:	 Gregorioqa iskaynin ladomanmi kutichirqan:
Ya estoy preparado —  y con una pronunciación lo más cuidadosa posible, y haciendo largas pausas entre las palabras, se esforzó por despojar a su voz de todo lo que pudiese llamar la atención.	" Listoñan kashani."" Hinaspapas atisqanman hina cuidadowan rimaspa, simikunaq chawpinpi unayta samarispa, kallpachakurqan kunkanmanta imapas runakunaq yuyayninta aysananpaq."
El padre volvió a su desayuno, pero la hermana susurró:	 Taytaqa desayunanman kutirqa, ichaqa hermanaqa susuykurqa:
Gregorio, abre, te lo suplico  —  pero Gregorio no tenía ni la menor intención de abrir, más bien elogió la precaución de cerrar las puertas que había adquirido durante sus viajes, y esto incluso en casa.	Gregorio, kichay, valekuyki — ichaqa Gregorioqa manan ni huk chhikantapas kichayta yuyaykurqanchu, aswanpas alabarqanmi purisqanpi tarisqan punkukunata wisq’asqanmanta cuidakusqanmanta, kaytataq wasinpipas.
Al principio tenía la intención de levantarse tranquilamente y, sin ser molestado, vestirse y, sobre todo, desayunar, y después pensar en todo lo demás, porque en la cama, eso ya lo veía, no llegaría con sus cavilaciones a una conclusión sensata.	 Qallariypiqa yuyaykurqanmi ch’inlla hatarispa, mana ima llakisqa, p’achakuyta, llapanmanta aswantaqa desayunayta, chaymantataq tukuy imapi yuyaykuyta, imaraykuchus puñunanpi, chayta rikurqanña, manan yuyaymanayninwanqa allin yuyaywan tukukuyman chayanmanchu .
Recordó que ya en varias ocasiones había sentido en la cama algún leve dolor, quizá producido por estar mal tumbado, dolor que al levantarse había resultado ser sólo fruto de su imaginación, y tenía curiosidad por ver cómo se iban desvaneciendo paulatinamente sus fantasías de hoy.	 Yuyarirqanmi askha kutipi puñunanpi pisi nanayta sientesqanmanta, yaqapaschá mana allinta puñusqanrayku, chay nanayqa hatarispan yuyaykusqanllan karqan, chaymi anchata munarqan imaynatas paypaq kashan chayta kunan tiempopi fantasiakunaqa pisi-pisimantan chinkapusharqan.
No dudaba en absoluto de que el cambio de voz no era otra cosa que el síntoma de un buen resfriado, la enfermedad profesional de los viajantes.	 Payqa manan iskayrayarqanchu kunkan cambiasqanqa manan imapaschu karqan, aswanpas millay chiri onqoypa sintomallanmi karqan, chaymi vendeqkunaq llank’ayninpi onqoynin.
Tirar el cobertor era muy sencillo, sólo necesitaba inflarse un poco y caería por sí solo, pero el resto sería difícil, especialmente porque él era muy ancho.	Tapata hurquyqa ancha facilmi karqa, huk ratochallam phullpuyta necesitarqa hinaspam sapallanmanta wichiykuq, ichaqa puchuqninqa sasachá kanman, astawanraqmi ancha ancho kasqanrayku.
Hubiera necesitado brazos y manos para incorporarse, pero en su lugar tenía muchas patitas que, sin interrupción, se hallaban en el más dispar de los movimientos y que, además, no podía dominar.	 Hatarinanpaqqa makinkunatan makinkunatan necesitanman karqan, ichaqa aswanpas askha huch’uy chakikunayoqmi karqan, mana hark’asqallataqmi aswan mana kaqlla kuyuykunapi kasharqan, aswanpas manan controlayta atirqanchu.
Si quería doblar alguna de ellas, entonces era la primera la que se estiraba, y si por fin lograba realizar con esta pata lo que quería, entonces todas las demás se movían, como liberadas, con una agitación grande y dolorosa.	 Sichus mayqentapas k’umuykuyta munarqan chayqa, chaymi ñawpaq kaq mast’arikurqan, sichus tukukuypi kay patawan munasqanman hina ruwayta atirqan chayqa, llapan wakinkunan kuyurqanku, kacharisqa hina, hatun nanaywan ch’aqwaywan.
«No hay que permanecer en la cama inútilmente», se decía Gregorio.	 -Manan yanqapaqchu puñunapi qhepakunayki, nispas Gregorqa sonqollanpi nisqa.
Quería salir de la cama en primer lugar con la parte inferior de su cuerpo, pero esta parte inferior que, por cierto, no había visto todavía y que no podía imaginar exactamente, demostró ser dificil de mover; el movimiento se producía muy despacio, y cuando, finalmente, casi furioso, se lanzó hada adelante con toda su fuerza sin pensar en las consecuencias, había calculado mal la dirección, se golpeó fuertemente con la pata trasera de la cama y el dolor punzante que sintió le enseñó que precisamente la parte inferior de su cuerpo era quizá en estos momentos la más sensible.	Ñawpaqtaqa uray cuerponwanmi puñunanmanta hatariyta munarqan, ichaqa kay uray parten, chaytaqa, de paso, manaraqmi rikurqanchu, manataqmi allintachu yuyaykurqan, chaymi sasa kuyuchiy karqan; kuyuyqa ancha pisilla karqan, tukukuypi, yaqa phiñasqa, tukuy kallpanwan ñawpaqman phawarirqan mana yuyaykuspa ima consecuenciankunapi, pantasqa juzgasqa maymanchus rinanpaq, sinchitan tuparqan camaq qhepa chakinta hinallataq yachachisqa hina sientekusqan k’iriq nanayta paymanqa, cuerponpa urayninpunichá kay tiempopi aswan sensitivo kasqanmanta.
Así pues, intentó en primer lugar sacar de la cama la parte superior del cuerpo y volvió la cabeza con cuidado hacia el borde de la cama.	 Chaymi ñawpaqtaqa hawan cuerponta camamanta horqonanpaq kallpachakurqan, allintataq umantapas camapa kantunman kutichirqan.
Lo logró con facilidad y, a pesar de su anchura y su peso, el cuerpo siguió finalmente con lentitud el giro de la cabeza.	 Chaytaqa facil-llatan ruwaq, anchon llasayninña karqan chaypas, qhepamanmi cuerpoqa pisi-pisimanta uma muyurisqanta qatikuq.
Pero cuando, por fin, tenía la cabeza colgando en el aire fuera de la cama, le entró miedo de continuar avanzando de este modo porque, si se dejaba caer en esta posición, tenía que ocurrir realmente un milagro para que la cabeza no resultase herida, y precisamente ahora no podía de ningún modo perder la cabeza, prefería quedarse en la cama.	Ichaqa, tukukuypi uman cama hawapi wayrapi warkusqa kashaqtin, manchakurqan kay hinata riyta imaraykuchus sichus kay posiciónpi urmaykunman chayqa, cheqaqtapunin huk milagro kanan karqan uman mana k’irikunanpaq. , hinallataq kunanpachaqa manan imapipas umantapas chinkachiyta atisqachu, aswan allinmi karqan puñunanpi qhepakuyta.
Pero como, jadeando después de semejante esfuerzo, seguía allí tumbado igual que antes, y veía sus patitas de nuevo luchando entre si, quizá con más fuerza aún, y no encontraba posibilidad de poner sosiego y orden a este atropello, se decía otra vez que de ningún modo podía permanecer en la cama y que lo más sensato era sacrificarlo todo, si es que con ello existía la más mínima esperanza de liberarse de ella.	 Ichaqa, chhayna kallpachakusqanmanta asnashaspa, ñawpaq hinaraqmi chaypi puñushasqa, hinaspan rikurqan huch’uy chakichankuna yapamanta maqanakushaqta, ichapas aswan kallpawan, manataqmi tarirqanchu kay phiñakuyman thak kayta, ordenta churananpaq, payqa yapamanta nirqa mana imaynatapas camapi qipananpaq kasqanmanta hinaspa aswan yuyayniyuq ruwayqa tukuy imata sacrificay kasqanmanta, sichus pisilla suyakuypas kaptin chaymanta lluqsinanpaq.
Pero al mismo tiempo no olvidaba recordar de vez en cuando que reflexionar serena, muy serenamente, es mejor que tomar decisiones desesperadas.	 Ichaqa chay pachallapitaqmi mana qunqarqachu sapa kuti yuyarichiyta, hawkalla, ancha hawkalla yuyaymanayqa aswan allinmi mana imamanta manchakuspa tanteaymantaqa.
En tales momentos dirigía sus ojos lo más agudamente posible hacia la ventana, pero, por desgracia, poco optimismo y animo se podían sacar del espectáculo de la niebla matinal, que ocultaba incluso el otro lado de la estrecha calle.	Chay hina ratokunapin ñawinta atisqanman hina k’irisqa ventanaman dirigiq, ichaqa llakikuypaqmi pisillata suyakuyniyoq kayta, kallpachaytapas horqoyta atikurqan tutamanta phuyu qhawarichiymanta, chaymi pakasqa karqan chay k’iti calleq huk ladontapas.
«Las siete ya  —  se dijo cuando sonó de nuevo el despertador — , las siete ya y todavía semejante niebla», y durante un instante permaneció tumbado, tranquilo, respirando débilmente, como si esperase del absoluto silencio el regreso del estado real y cotidiano.	 -Qanchis horasña, nispas sonqonpi nisqa, despertador yapamanta waqaqtin, —qanchis horasña hinallataq chhayna phuyuraq, nispas huk ratulla ch’inlla siriykusqa, pisi kallpata samaspa, cheqaq kaqpa kutimunanta suyashanman hina, sapa punchaw estado de silencio absoluto.
Pero después se dijo:	 Ichaqa chaymantan nirqanku:
«Antes de que den las siete y cuarto tengo que haber salido de la cama del todo, como sea.	 “Chunka pichqayuq watapaqqa tukuy ñannintam puñunaymanta hatarinay, imaña kaptinpas.
Por lo demás, para entonces habrá venido alguien del almacén a preguntar por mí, porque el almacén se abre antes de las siete.» Y entonces, de forma totalmente regular, comenzó a balancear su cuerpo, cuan largo era, hacia fuera de la cama.	 Chaymantapas, chaykamaqa tiendamanta pipas hamurunqa mañakuwananpaq, chay tiendaqa manaraq qanchis hora kachkaptin kichakusqanrayku. Hinaspa, allin sapa kutilla, cuerponta, hunt’a sayayniyoq, puñunanmanta kuyuchiyta qallarisqa.
Si se dejaba caer de ella de esta forma la cabeza, que pretendía levantar con fuerza en la caída, permanecería probablemente ilesa.	Sichus urmaypi kallpawan hoqariyta munasqan umantapas chhaynata urmachinkuman chayqa, manapaschá ima k’irisqachu qhepanman.
La espalda parecía ser fuerte, seguramente no le pasaría nada al caer sobre la alfombra.	 Wasanpas kallpasapa hinam karqa, chiqapmi mana imapas pasanmanchu alfombraman wichiykuspaqa.
Lo más difícil, a su modo de ver, era tener cuidado con el ruido que se produciría, y que posiblemente provocaría al otro lado de todas las puertas, si no temor, al menos preocupación.	 Aswan sasaqa, paypa yuyaykusqanman hinaqa, karqan cuidakuymi chay qapariywan, chaymi llapa punkukunaq huk ladonpi, mana manchakuy kaqtinqa, llakikuytapas apamunman.
Pero había que intentarlo.	 Ichaqa kallpachakunaykin karqan.
Cuando Gregorio ya sobresalía a medias de la cama  —  el nuevo método era más un juego que un esfuerzo, sólo tenía que balancearse a empujones —  se le ocurrió lo fácil que sería si alguien viniese en su ayuda.	 Gregor kuskan camamanta lloqsishaqtin — mosoq métodoqa aswan pukllaymi karqan kallpachakuymantaqa, pay kikinmi tanqakunan karqan — yuyayninpin hamurqan imayna facilchus kanman pipas yanapaqnin hamuqtin.
Dos personas fuertes  —  pensaba en su padre y en la criada —  hubiesen sido más que suficientes; sólo tendrían que introducir sus brazos por debajo de su abombada espalda, descascararle así de la cama, agacharse con el peso, y después solamente tendrían que haber soportado que diese con cuidado una vuelta impetuosa en el suelo, sobre el cual, seguramente, las patitas adquirirían su razón de ser.	Iskay kallpasapa runakunaqa —taytanpi, sirvientapi ima yuyaykusharqan— aswan askharaqmi kanman karqan; paykunaqa makillankuta churananku karqan muyu wasanpa uranpi, chhaynata camamanta horqonanku karqan, llasayninwan k’umuykukunanku karqan, chaymantataqmi aguantananku karqan pampapi usqhaylla muyushaqta, chaypin, cheqaqtapuni, paypaq huch’uy chakikunatan adquiriqku raison d’etre nisqankuta.
Bueno, aparte de que las puertas estaban cerradas, ¿debía de verdad pedir ayuda?	 Bueno, punkukuna wisq’asqa kasqanmanta huk ladoman churaspaqa, ¿cheqaqtachu yanapayta waqyanay?
A pesar de la necesidad, no pudo reprimir una sonrisa al concebir tales pensamientos.	 Necesitasqaña karqan chaypas, manan asirikuyta hark’ayta atirqanchu chhayna yuyaykusqanpi yuyaykuspa.
