español	quechua
Esto significó un gran estímulo para Gregorio; pero todos debían haberle animado, incluso el padre y la madre.	 Chayqa Gregoriopaqqa ancha kallpanchakuymi karqa; ichaqa llapa runan kallpachananku karqan, taytapas mamapas.
«¡Vamos Gregorio!	 ¡Hamuy Gregorio!
debían haber aclamado — .	 paykunaqa kusisqallañam qaparinanku karqa.
¡Duro con ello, duro con la cerradura!» Y ante la idea de que todos seguían con expectación sus esfuerzos, se aferró ciegamente a la llave con todas las fuerzas que fue capaz de reunir.	 Sinchi chaypi, sinchi cerradurapi! Hinaspapas llapa runa suyakuspa kallpachakuyninta qatikusqankuta yuyaykuspan ñawsa hina llaveman k’askakurqan tukuy kallpanwan.
A medida que avanzaba el giro de la llave, Gregorio se movía en tomo a la cerradura, ya sólo se mantenía de pie con la boca, y, según era necesario, se colgaba de la llave o la apretaba de nuevo hacia dentro con todo el peso de su cuerpo.	Llave muyurichisqanman hinan Gregorqa cerrojota muyuriq, kunanqa simillanwanmi sayaqlla kasharqan, necesitasqanman hinataq llaveta warkusqa otaq tukuy kallpanwan kutichispa haykunanpaq ñit’iykurqan cuerpoykiq llasaynin.
El sonido agudo de la cerradura, que se abrió por fin, despertó del todo a Gregorio.	 Chay cerrojopa k’irisqa t’oqyayninmi, chaymi qhepaman kicharisqa karqan, chaymi Gregorta llapanta rikch’arichirqan.
Respirando profundamente dijo para sus adentros: «No he necesitado al cerrajero», y apoyó la cabeza sobre el picaporte para abrir la puerta del todo.	 Samayta hap’ispataq sonqollanpi nisqa: “Manan cerrajerotaqa necesitarqanichu”, nispa, hinaspan umantapas hap’inaman k’umuykuspa punkuta tukuy ñanta kicharirqan.
Como tuvo que abrir la puerta de esta forma, ésta estaba ya bastante abierta y todavía no se le veía.	 Chaynata punkuta kichanan kasqanraykum, kichasqaña kachkasqa, manaraqmi qawakurqachu.
En primer lugar tenía que darse lentamente la vuelta sobre sí mismo, alrededor de la hoja de la puerta, y ello con mucho cuidado si no quería caer torpemente de espaldas justo ante el umbral de la habitación.	 Ñawpaqtaqa pisi pisimantan punkuta muyurinan karqan, chaytataq ancha cuidadowan ruwanan karqan, mana chayqa cuarto punku hawallapin mana allintachu qhepaman urmapunman.
Todavía estaba absorto en llevar a cabo aquel difícil movimiento y no tenía tiempo de prestar atención a otra cosa, cuando escuchó al apoderado lanzar en voz alta un «¡Oh!» que sonó como un silbido del viento, y en ese momento vio también cómo aquél, que era el más cercano a la puerta, se tapaba con la mano la boca abierta y retrocedía lentamente como si le empujase una fuerza invisible que actuaba regularmente.	"Payqa kay sasa kuyuy purichiypiraqmi hunt'aykusqa kasharqan, manataqmi tiempoyoqchu karqan imatapas qhawarinanpaq, chaymi uyarirqan kamachiqpa kallpawan ""Ay!"" chaymi wayrapa silbasqan hina uyarikurqa, chay ratopitaqmi rikurqataqmi imaynatam chay punkuman aswan hichpallapi kaq, kichasqa siminta makinwan taparuspan pisi pisimanta qipaman kutirqa mana rikuy atina kallpawan tanqasqa hina, sapa kuti ruwaq."
La madre  —  a pesar de la presencia del apoderado, estaba allí con los cabellos desenredados y levantados hacia arriba de haber pasado la noche —  miró en primer lugar al padre con la manos juntas, dio a continuación dos pasos hacia Gregorio y, con el rostro completamente oculto en su pecho, cayó al suelo en medio de sus faldas, que quedaron extendidas a su alrededor.	 Mamaqa —abogado kashaqtinpas, chaypin kashasqa chukchanta mana ch’eqesqa, tuta pasasqanmanta hoqarisqa— ñawpaqtaqa makinta huñusqa taytata qhawarisqa, chaymantataq iskay pasota Gregorman rirqan, uyantataq llapanta pakasqa sinqanpi, pampaman urmaykusqa chawpi faldankunapi, chay faldankunaqa muyuriqninpi mast’arisqa kasqa.
El padre cerró el puño con expresión amenazadora, como si quisiera empujar de nuevo a Gregorio a su habitación, miró inseguro a su alrededor por el cuarto de estar, después se tapó los ojos con las manos y lloró de tal forma que su robusto pecho se estremecía por el llanto.	Taytaqa amenazaq uyawan puñunanta k’iskiykusqa, Gregorta cuartonman kutichispa tanqayta munashanmanpas hina, mana seguro tiyay wasi muyuriqninta qhawarispa, chaymantataq makinwan ñawinta tapakuspa waqaykurqan, sinchi sinqan llasaykunanpaq, waqaymanta khatatatasqa.
Gregorio no entró, pues, en la habitación, sino que se apoyó en la parte intermedia de la hoja de la puerta que permanecía cerrada, de modo que sólo podía verse la mitad de su cuerpo y sobre él la cabeza, inclinada a un lado, con la cual miraba hacia los demás.	 Chaymi Gregorqa mana cuartoman haykurqanchu, aswanpas punkuq chawpi kaqninmanmi k’umuykurqan, chaytaq wisq’asqalla qheparqan, chaymi kuskan cuerpollan rikukurqan, chaypa hawanpitaq umantapas, huk ladoman k’umuykuspa, chaywantaq qhawarisqa wakinkunataq.
Entre tanto el día había aclarado; al otro lado de la calle se distinguía claramente una parte del edificio de enfrente, negruzco e interminable  —  era un hospital — , con sus ventanas regulares que rompían duramente la fachada.	 Chaykamataq p’unchawqa ch’uyanchasqaña; huk lado callepiqa, chimpapuray wasiq huk parten sut’ita t’aqakunman karqan, yana hinallataq mana tukukuq —chayqa hospitalmi karqan— sapa kutilla ventanankunayoq, chaymi fachadanta sinchita p’akirqan.
Todavía caía la lluvia, pero sólo a grandes gotas, que se distinguían tina por una, y que eran lanzadas hacia abajo aisladamente sobre la tierra.	 Paraqa chayamuchkarqaraqmi, ichaqa hatun gotakunallapim, chaykunatam huk tinamanta hukmanta rakiyta atirqaku, chaykunatam sapallanta pampaman uraykachirqaku.
Las piezas de la vajilla del desayuno se extendían en gran cantidad sobre la mesa porque para el padre el desayuno era la comida principal del día, que prolongaba durante horas con la lectura de diversos periódicos.	Desayunopaq mesapi churanakunaqa achkallañam mesapi mastarisqa karqa, taytanpaqqa desayunoqa chay punchawpa aswan mikuyninmi karqa, chaytam achka horakuna unayta ruwarqa imaymana periodicokunata leespa.
Justamente en la pared de enfrente había una fotografía de Gregorio, de la época de su servicio militar, que le representaba con uniforme de teniente, y cómo, con la mano sobre la espada, sonriendo despreocupadamente, exigía respeto para su actitud y su uniforme.	 Chimpa pirqallapin Gregorioq foton kashasqa, militar kashasqanmantapacha, chaypin rikukun teniente uniformeyoq, imaynatas espadanpi makinta hap’ispa mana imatapas qhawarispa asirikuspa, actitudninta uniformentapas respetanankupaq mañakurqan.
La puerta del vestíbulo estaba abierta y, como la puerta del piso también estaba abierta, se podía ver el rellano de la escalera y el comienzo de la misma, que conducían hacia abajo.	 Salón punkuqa kichasqañan kasharqan, wasi punkupas kichasqa kasqanraykun rikukuq escalerakunaq aterrizajenta, escaleraq qallariynintapas, urayman riq.
Bueno —  dijo Gregorio, y era completamente consciente de que era el único que había conservado la tranquilidad — , me vestiré inmediatamente, empaquetaré el muestrario y saldré de viaje.	 Bueno, nispas Gregorioqa nisqa, hinaspan allinta yacharqan paylla q’oñi kayninta waqaychasqanmanta, “chaylla p’achakusaq, muestrakunata apasaq, hinaspan viajeman risaq.
¿Queréis dejarme marchar?	 ¿Kachariwayta munankichu?
Bueno, señor apoderado, ya ve usted que no soy obstinado y me gusta trabajar, viajar es fatigoso, pero no podría vivir sin viajar.	Bueno, señor Abogado, rikunki mana k’ulluchu kasqayta, llank’aypas gustawanmi, viajayqa sayk’uchikuqmi, ichaqa manan mana viajaspaqa kawsayta atiymanchu.
¿Adónde va usted, señor apoderado?	 Maymantaq richkanki, wiraqocha?
¿Al almacén?	 ¿Almacén nisqaman?
¿Sí?	 Arí?
¿Lo contará usted todo tal como es en realidad?	 ¿Chiqap kasqanman hinachu tukuy imata willanki?
En un momento dado puede uno ser incapaz de trabajar, pero después llega el momento preciso de acordarse dé los servicios prestados y de pensar que después, una vez superado el obstáculo, uno trabajará con toda seguridad, con más celo y concentración.	 Huk ratopiqa manapaschá llank’ayta atinmanchu, ichaqa chaymantan chay rato preciso chayan yuyarinapaq serviciokuna ruwasqanmanta, hinallataq yuyaykunapaq qhepaman, huk kuti hark’ayta atipasqaña kaqtinqa, mana imamanta manchakuspa llank’anqa, aswan tukuy sonqowan, aswan yuyaywan ima.
Yo le debo mucho al jefe, bien lo sabe usted.	 Achkatam debekuni jefeman, allintam yachanki.
Por otra parte, tengo a mi cuidado a mis padres y a mi hermana.	 Huk ladomantaq tayta-mamayta, ñañaytapas cuidani.
Estoy en un aprieto, pero saldré de él.	 Huk watasqam kachkani, ichaqa chaymantam lluqsisaq.
Pero no me lo haga usted más difícil de lo que ya es.	 Ichaqa ama aswan sasachawaychu, kunan kasqanmantaqa.
¡Póngase de mi parte en el almacén!	 ¡Ñoqawan kuska almacén nisqapi!
Ya sé que no se quiere bien al viajante.	 Yachanim chay rantikuq runaqa mana allin gustasqan kasqanmanta.
Se piensa que gana un montón de dinero y se da la gran vida.	 Yuyakunmi achka qullqita ganaspa alto kawsayta kawsasqanmanta.
Es cierto que no hay una razón especial para meditar a fondo sobre este prejuicio, pero usted, señor apoderado, usted tiene una visión de conjunto de las circunstancias mejor que la que tiene el resto del personal; sí, en confianza, incluso una visión de conjunto mejor que la del mismo jefe, que, en su condición de empresario, cambia fácilmente de opinión en perjuicio del empleado.	Chiqapmi, manam kanchu razon especial kay prejuiciopi ukhunchanapaq, ichaqa qam, señor Abogado, aswan allintam qawarinki circunstanciakunamanta wakin llamkaqkunamantaqa; arí, mana manchakuspa, aswan allin qhawariypas kikin jefemanta, payqa llank’achiq hina facil-llatan yuyaykuyninta cambian llank’aqpa mana allinninpaq.
También sabe usted muy bien que el viajante, que casi todo el año está fuera del almacén, puede convertirse fácilmente en víctima de murmuraciones, casualidades y quejas infundadas, contra las que le resulta absolutamente imposible defenderse, porque la mayoría de las veces no se entera de ellas y más tarde, cuando, agotado, ha terminado un viaje, siente sobre su propia carne, una vez en el hogar, las funestas consecuencias cuyas causas no puede comprender.	 Hinallataqmi allinta yachanki chay vendeq, yaqa watantin tiendamanta hawapi kashaq, facil-llata ch’aqwaypa, coincidenciakunaq, mana cheqaq quejakunaq viktimanman tukupunman, chaykunaq contranpiqa manan atikunmanchu defiendekuyta, imaraykuchus yaqa llapanpiqa mana tarinchu.paykunamanta hinaspa qhepaman, sayk’usqa, huk viajeta tukuqtin, kikin aychapi sientekun, huk kuti wasipi kashaspa, mana allin consecuenciakunata, pikunaq causankunatan mana entiendeyta atinchu.
Señor apoderado, no se marche usted sin haberme dicho una palabra que me demuestre que, al menos en una pequeña parte, me da usted la razón.	 Señor Abogado, ama ripuychu mana huk simitapas niwaspayki, chaymi qawachiwan, pisillapipas, ñuqawan acuerdopi kasqaykita.
Pero el apoderado ya se había dado la vuelta a las primeras palabras de Gregorio, y por encima del hombro, que se movía convulsivamente, miraba hacia Gregorio poniendo los labios en forma de morro, y mientras Gregorio hablaba no estuvo quieto ni un momento, sino que, sin perderle de vista, se iba deslizando hacia la puerta, pero muy lentamente, como si existiese una prohibición secreta de abandonar la habitación.	Ichaqa chay encargadoqa Gregorpa ñawpaq rimasqanwanmi muyurisqaña, hinaspan hombronpa hawanman qhawarisqa, chaymi kuyushasqa convulsivo, Gregorta siminkuna chhuqrispa, Gregorqa rimashaqtintaq mana huk ratullapas sayarirqanchu, aswanpas pitan sayarirqan, mana reparaspa pay, punkuman llanthuykusqa, ichaqa ancha pisi pisimanta, pakallapi hark’akuypas kanman hina chay cuartomanta lloqsinanpaq.
Ya se encontraba en el vestíbulo y, a juzgar por el movimiento repentino con que sacó el pie por última vez del cuarto de estar, podría haberse creído que acababa de quemarse la suela.	 Payqa salapin kashasqaña, qonqayllamanta chakinta qhepa kutita horqosqanmanta qhawarispan, ichapas yuyaykunman karqan chayllaraq suelan ruphachisqanpi.
Ya en el vestíbulo, extendió la mano derecha lejos de sí y en dirección a la escalera, como si allí le esperase realmente una salvación sobrenatural.	 Huk kutinmi salaman haykuspa, paña makinta haywarirqan paymanta karunchakuspa escaleraman, chaypiqa cheqaqtapuni suyashanman hina ima mana rikuy atina qespikuypas.
Gregorio comprendió que de ningún modo debía dejar marchar al apoderado en este estado de ánimo, si es que no quería ver extremadamente amenazado su trabajo en el almacén.	 Gregorioqa entienderqanmi mana imaynapipas kay hina yuyaypi agenteta saqenanmanta, sichus mana munanmanchu almacénpi llank’ayninta sinchita amenazasqa kashaqta rikuyta chayqa.
Los padres no entendían todo esto demasiado bien: durante todos estos largos años habían llegado al convencimiento de que Gregorio estaba colocado en este almacén para el resto de su vida, y además, con las preocupaciones actuales, tenían tanto que hacer, que habían perdido toda previsión.	Tayta-mamakunaqa manan allintachu entienderqanku tukuy kaykunata: tukuy kay unay watakunapin convencisqa karqanku Gregorta kay almacén nisqapi tukuy kawsayninpi churasqa kasqanmanta, chaymantapas, kunan llakikuykunawanqa, askha ruwanayoqmi karqanku, chaykunatan ruwananku karqan chinkachisqa llapan pronóstico.
Pero Gregorio poseía esa previsión.	 Ichaqa Gregorioqa chayna ñawpaqmantaraqmi qawarqa.
El apoderado tenía que ser retenido, tranquilizado, persuadido y, finalmente, atraído.	 Chay proxy nisqataqa hap’ina, thasnuchina, convencechina, qhepamantaq aysachina karqan.
¡El futuro de Gregorio y de su familia dependía de ello!	 ¡Chaymantan Gregorioq familianpa hamuq tiemponpas dependerqan!
¡Si hubiese estado aquí la hermana!	 ¡Sichus chay hermana kaypi kanman karqan chayqa!
Ella era lista; ya había llorado cuando Gregorio todavía estaba tranquilamente sobre su espalda, y seguro que el apoderado, ese aficionado a las mujeres, se hubiese dejado llevar por ella; ella habría cerrado la puerta del piso y en el vestíbulo le hubiese disuadido de su miedo.	 Payqa yachaysapam karqa; Payqa waqasqañan Gregorqa wasanpi thakllaraq kashaqtin, cheqaqtapunin chay encargadoqa, chay hina warmikunata munakuq, paywan apasqa kananta saqenman karqan; chay wasiq punkunta wisq’anman karqan, salapitaq manchakuyninta hark’anman karqan.
Pero lo cierto es que la hermana no estaba aquí y Gregorio tenía que actuar.	 Ichaqa cheqaq kaqmi, chay hermanaqa manan kaypichu kasharqan, chaymi Gregorioqa imatapas ruwanan karqan.
Y sin pensar que no conocía todavía su actual capacidad de movimiento, y que sus palabras posiblemente, seguramente incluso, no habían sido entendidas, abandonó la hoja de la puerta y se deslizó a través del hueco abierto.	Hinaspa mana yuyaykusparaq kunan kuyuy atiyninta yachasqanmanta, hinallataq rimasqanpas ichapas, cheqaqtapunipas, manaraq entiendesqa kasqanmanta, punku raphimanta lloqsispa kichasqa ch’usaq ukhunta llimp’iykurqan.
Pretendía dirigirse hacia el apoderado que, de una forma grotesca, se agarraba ya con ambas manos a la barandilla del rellano; pero, buscando algo en que apoyarse, se cayó inmediatamente sobre sus múltiples patitas, dando un pequeño grito.	 Payqa yuyaykusqañan riyta chay gerenteman, payqa, grotesco hina, iskaynin makinwanmi hap’iykusqaña chay aterrizajeq barandillanmanta; ichaqa, imatapas uywananpaq maskhaspa, chay ratopacha askha chakikunapi urmaykusqa, pisillata waqaspa.
Apenas había sucedido esto, sintió por primera vez en esta mañana un bienestar físico: las patitas tenían suelo firme por debajo, obedecían a la perfección, como advirtió con alegría; incluso intentaban transportarle hacia donde él quería; y ya creía Gregorio que el alivio definitivo de todos sus males se encontraba a su alcance; pero en el mismo momento en que, balanceándose por el movimiento reprimido, no lejos de su madre, permanecía en el suelo justo .	 Kay pasasqan qhepallamanmi kunan paqarin ñawpaq kutita aychapi allin kayninta sientekurqan: chaki huch’uykunaqa uranpi allin takyasqa allpayoqmi kasqa, allintan kasukuqku, kusikuywan reparasqan hina; munasqanman hinaraqmi apayta munarqaku; Gregoriotaq iñirqanña llapa onqoyninkunamanta definitiva allinyachiyqa makinpi kashasqanpi; ichaqa chay ratollapin, chay sarunchasqa kuyuymanta kuyurispa, mamanmanta mana karuchu, pampapi qhepakurqan .
enfrente de ella, ésta, que parecía completamente sumida en sus Propios pensamientos, dio un salto hacia arriba, con los brazos extendidos, con los dedos muy separados entre sí, y exclamó:	Paypa chimpanpitaq, Kikin yuyayninpi chinkasqa hina, makinkunata mast’arisqa, dedonkunata t’aqasqa, saltaspa qaparirqan:
¡Socorro, por el amor de Dios, socorro!	 Yanapay, Diosrayku, yanapay!
Mantenía la cabeza inclinada, como si quisiera ver mejor a Gregorio, pero, en contradicción con ello, retrocedió atropelladamente; había olvidado que detrás de ella estaba la mesa puesta; cuando hubo llegado a ella, se sentó encima precipitadamente, como fuera de sí, y no pareció notar que, junto a ella, el café de la cafetera volcada caía a chorros sobre la alfombra.	 Umanta k’umuykusqa, Gregorta aswan allinta qhawayta munashanman hina, ichaqa, kaywan contradikuspa, usqhaylla qhepaman kutirirqan; qunqarusqañam mesa qipanpi churasqa kasqanmanta; chayman chayaspaqa usqhayllan chaypi tiyaykusqa, hukmanyasqa hina, manataqmi reparasqachu hina, ladonpi, t’ikrasqa kaphiy mankamanta kukata alfombraman ch’aqchuykushaqta.
¡Madre, madre!	 Mama, mama!
dijo Gregorio en voz baja, y miró hacia ella.	 nispas Gregorioqa pisi kunkawan, payman qhawarisqa.
Por un momento había olvidado completamente al apoderado; por el contrario, no pudo evitar, a la vista del café que se derramaba, abrir y cerrar varias veces sus mandíbulas al vacío.	 Huk ratullapaqmi chay encargadota llapanta qonqarusqa; aswanpas, chay kukata hich’akuqta rikuspa, mana ima ruwaytapas atisqachu, askha kutita vacío nisqapi quijadakunata kichariyta, wisq’ayta ima.
Al verlo la madre gritó nuevamente, huyó de la mesa y cayó en los brazos del padre, que corría a su encuentro.	 Payta rikuspas mamaqa yapamanta qaparirqa, mesamanta ayqikuspa, taytapa marq’ayninman urmaykusqa, paytaq phawaylla phawarirqan paywan tupananpaq.
Pero Gregorio no tenía ahora tiempo para sus padres.	Ichaqa Gregorqa manan kunanqa tayta-mamanpaq tiempoyoqchu karqan.
El apoderado se encontraba ya en la escalera; con la barbilla sobre la barandilla miró de nuevo por última vez.	 Chay agenteqa escalerapiñam kachkasqa; rielpi chukchanta hap’ispa qhepa kutita hukmanta qhawarisqa.
Gregorio tomó impulso para.	 Gregorioqa kallpata hap’irqan.
alcanzarle con la mayor seguridad posible.	 atisqaykiman hina mana imamanta manchakuspa chayasunaykipaq.
El apoderado debió adivinar algo, porque saltó de una vez varios escalones y desapareció; pero lanzó aún un «¡Uh!», que se oyó en toda la escalera.	" Chay encargadoqa imatapas adivinasqachá, huk kutillapi askha pasokunata saltaspa chinkapusqanrayku; ichaqa huk ""Whoa!"""
Lamentablemente esta huida del apoderado pareció desconcertar del todo al padre, que hasta ahora había estado relativamente sereno, pues en lugar de perseguir él mismo al apoderado o, al menos, no obstaculizar a Gregorio en su persecución, agarró con la mano derecha el bastón del apoderado, que aquél había dejado sobre la silla junto con el sombrero y el gabán; tomó con la mano izquierda un gran periódico que había sobre la mesa y, dando patadas en el suelo, comenzó a hacer retroceder a Gregorio a su habitación blandiendo el bastón y el periódico.	 Llakikuypaqmi, kay abogadomanta ayqekuyqa taytataqa llapanta hukmanyachirqa hinam karqa, kunankamaqa aswan hawkallam karqa, imaraykuchus kikin abogadota qatipananmantaqa, utaq Gregorta mana harkananmantaqa, derechonwanmi abogadopa bastanta hapirurqa maki.proxy, chaytam sillapi saqirqa sombreronwan, abrigonwan kuska; Lloq’e makinwanmi mesapi kashaq hatun periodicota hap’ispa chakinta pampaman takaspa Gregorta cuartonman kutichiyta qallarirqan, kaspitawan periodicotawan kuyuchispa.
De nada sirvieron los ruegos de Gregorio, tampoco fueron entendidos, y por mucho que girase humildemente la cabeza, el padre pataleaba aún con más fuerza.	Gregoriopa mañakusqanqa yanqapaqmi karqa, manataqmi entiendesqachu karqa, mayna humillakuspan umantapas muyuchiptinpas taytaqa aswan kallpawanraqmi sarurqa.
Al otro lado, la madre había abierto de par en par una ventana, a pesar del tiempo frío, e inclinada hacia fuera se cubría el rostro con las manos.	 Huk ladumantaq mamaqa huk ventanata kichasqata wikch’uykusqa, chiri pachaña kashaspapas, hawaman k’umuykuspa makinwan uyanta tapaykusqa.
Entre la calle y la escalera se estableció una fuerte corriente de aire, las cortinas de las ventanas volaban, se agitaban los periódicos de encima de la mesa, las hojas sueltas revoloteaban por el suelo.	 Callewan escalerawan chawpinpin sinchi wayra sayarirqan, ventanakunamanta cortinakuna phawarirqan, mesapi periodicokuna phawaykacharqan, suchuq hojakuna pampapi phawaykacharqan.
El padre le acosaba implacablemente y daba silbidos como un loco.	 Taytaqa mana samaspa ñakarispanmi loco hina silbarqa.
Pero Gregorio todavía no tenía mucha práctica en andar hacia atrás, andaba realmente muy despacio.	 Ichaqa Gregorioqa manaraqmi anchatachu practicarqan qhepaman purinanpaq, payqa cheqaqtapuni pisi pisimantan purisharqan.
Sí Gregorio se hubiese podido dar la vuelta, enseguida hubiese estado en su habitación, pero tenía miedo de impacientar al padre con su lentitud.	 Gregorqa kutiriyta atinman karqan chayqa, chay ratollan cuartonpi kashanman karqan, ichaqa manchakurqanmi taytanta mana pacienciayoqta pisi-pisimanta rimasqanmanta.
al darse la vuelta, y a cada instante le amenazaba el golpe mortal del bastón en la espalda o la cabeza.	 muyuriqtin, sapa ratotaq wasanman otaq umanman k’aspiq wañuypaq maqasqanqa amenazasqa.
Finalmente, no le quedó a Gregorio otra solución, pues advirtió con angustia que andando hacia atrás ni siquiera era capaz de mantener la dirección, y así, mirando con temor constantemente a su padre de reojo, comenzó a darse la vuelta con la mayor rapidez posible, pero, en realidad, con una gran lentitud.	Tukuyninpiqa Gregorioqa manan huk allichayta tarirqanchu, llakikuywanmi repararqan qhepaman purispa mana maymanchus rinanpaqpas mana atisqanmanta, chaymi sapa kutilla mancharisqa taytanta huk ladoman qhawarispa usqhaylla kutiriyta qallarirqan. , ichaqa, cheqaqpiqa, ancha pisi pisimanta.
Quizá advirtió el padre su buena voluntad, porque no sólo no le obstaculizó en su empeño, sino que, con la punta de su bastón, le dirigía de vez en cuando, desde lejos, en su movimiento giratorio.	 Ichapas taytaqa allin munayninta musyakurqa, mana kallpanchakusqanpi mana harkasqanraykullachu, aswanqa kaspi puntanwanmi sapa kuti, karumanta, muyuriq kuyuyninpi pusarqa.
¡Si no hubiese sido por ese insoportable silbar del padre!	 ¡Manachus chay mana aguantay atina taytaq silbasqan kanman karqan chayqa!
Por su culpa Gregorio perdía la cabeza por completo.	 Payraykum Gregorioqa manaña piensarqachu.
Ya casi se había dado la vuelta del todo cuando, siempre oyendo ese silbido, incluso se equivocó y retrocedió un poco en su vuelta.	 Yaqa llapanmi muyurisqaña, chay silbayta uyarispanmi pantarurqaraq hinaspam turnonpi huk ratochallatapas qipaman kutirqa.
Pero cuando por fin, feliz, tenía ya la cabeza ante la puerta, resultó que su cuerpo era demasiado ancho para pasar por ella sin más.	 Ichaqa qhepaman, kusisqa, umanta punkupi hap’iqtin, cuerpon ancha ancho kashasqan, mana astawan rimaspa chayninta pasananpaq.
Naturalmente, al padre, en su actual estado de ánimo, ni siquiera se le ocurrió ni por lo más remoto abrir la otra hoja de la puerta para ofrecer a Gregorio espacio suficiente.	Arí, taytaqa, kunan yuyayninpi, manan yuyaykurqanchu punkuq huknin ladonta kichariyta Gregorman suficiente espaciota qonanpaq.
Su idea fija consistía solamente en que Gregorio tenía que entrar en su habitación lo más rápidamente posible; tampoco hubiera permitido jamás los complicados preparativos que necesitaba Gregorio para incorporarse y, de este modo, atravesar la puerta.	 Paypa takyasqa yuyaykusqanqa karqan Gregorqa usqhaylla cuartonman haykunanmi karqan; nitaqmi hayk’aqpas saqenmanchu karqan Gregorpa hatarinanpaq, chhaynapi punkumanta pasananpaq sasa preparacionkunatapas.
Es más, empujaba hacia adelante a Gregorio con mayor ruido aún, como si no existiese obstáculo alguno.	 Imataq aswan, Gregorta astawan qapariywan ñawpaqman tanqarqan, mana ima hark’aypas kanmanchu hina.
Ya no sonaba tras de Gregorio como si fuese la voz de un solo padre; ahora ya no había que andarse con bromas, y Gregorio se empotró en la puerta, pasase lo que pasase.	 Manañam Gregorpa qipanpiqa sapallan taytapa kunkanpas hinachu uyarikurqa; kunanqa manañan asikuyqa necesariochu karqan, Gregoriotaq punkuman laq’aykukurqan, imaña kaqtinpas.
