español	quechua
Pero seguramente hubiese podido permanecer allí semanas enteras sin que la hermana hubiese mejorado su actitud por ello; ella veía la suciedad lo mismo que él, pero se había decidido a dejarla allí.	 Ichaqa cheqaqtapunin chaypi semanakuna qhepakunman karqan, manataqmi chay hermanaqa chaypaq yuyaykuyninta allintachu ruwanman karqan; payqa rikusqanman hinan chay qhellitaqa rikusqa, ichaqa chaypi saqenanpaqmi yuyaykusqa.
Al mismo tiempo, con una susceptibilidad completamente nueva en ella y que, en general, se había apoderado de toda la familia, ponía especial atención en el hecho de que se reservase solamente a ella el cuidado de la habitación de Gregorio.	 Chaypachallapitaqmi, huk musuq susceptibilidadwan paypi hinaspa, en general, llapa ayllunta hapirusqanrayku, aswanta qawarirqa Gregorpa cuartonpa cuidakuyninqa payllapaq kasqanmanta.
En una ocasión la madre había sometido la habitación de Gregorio a una gran limpieza, que había logrado solamente después de utilizar varios cubos de agua  —  la humedad, sin embargo, también molestaba a Gregorio, que yacía extendido, amargado e inmóvil sobre el canapé — , pero el castigo de la madre no se hizo esperar, porque apenas había notado la hermana por la tarde el cambio en la habitación de Gregorio, cuando, herida en lo más profundo de sus sentimientos, corrió al cuarto de estar y, a pesar de que la madre suplicaba con las manos levantadas, rompió en un mar de lágrimas, que los padres  —  el padre se despertó sobresaltado en su silla — , al principio, observaban asombrados y sin poder hacer nada, hasta que, también ellos, comenzaron a sentirse conmovidos; el padre, a su derecha, reprochaba a la madre que no hubiese dejado al cuidado de la hermana la limpieza de la habitación de Gregorio, a su izquierda, decía a gritos a la hermana que nunca más volvería a limpiar la habitación de Gregorio, mientras que la madre intentaba llevar al dormitorio al padre, que no podía más de irritación, la hermana, sacudida por los sollozos, golpeaba la mesa con sus pequeños puños, y Gregorio silbaba de pura rabia porque a nadie se le ocurría cerrar la puerta para ahorrarle este espectáculo y este ruido.	Huk kutinmi mamaqa Gregorpa cuartonta allinta picharqan, chaytaqa askha balde unuta utilizaspallan ayparqan — ichaqa chay humedadmi Gregortapas llakichirqan, payqa sofápi mast’arisqa, k’arakta, mana kuyurispataq sirisqa — , ichaqa chay mamaq muchuchisqanqa manan unaychu hamurqan, imaraykuchus yaqapaschá hermanaqa reparasqa tardepi Gregorpa cuarton cambiasqanmanta, chaymi sinchita sientekusqanmanta k’irisqa, chaymi phawaylla phawarirqan salaman, chaywanpas mamaqa hoqarisqa makinwan mañakusqa, waqay hunt’aykusqa, tayta mamakuna--taytaqa sillanpi rikch’arisqa--qallariypiqa musphasqa, mana ima ruway atiq qhawasqankuta, paykunapas, kuyuchisqa sientekuyta qallarinankukama; taytaqa, paña ladonpi, mamata k’amirqan Gregorioq cuarton pichayta mana saqesqanmanta pananpa cuidasqanpi, lloq’e ladonpitaq, ñañanta qaparirqan manaña hayk’aqpas Gregorioq cuartonta pichananpaq, chaykamataq mamaqa kallpachakusharqan taytata puñuna wasiman pusananpaq, payqa manan aswan phiñakuyta atirqanchu, ñañan, waqaywan chhaphchikuspa, mesata puñunachankunawan takaykusqa, Gregorqataq ch’uya phiñakuywan sisiykusqa, mana pipas yuyaykunmanchu punkuta wisq’ayta kay espectáculota qespichinanpaq hinaspa kay qapariy.
Pero incluso si la hermana, agotada por su trabajo, estaba ya harta de cuidar de Gregorio como antes, tampoco la madre tenía que sustituirla y no era necesario que Gregorio hubiese sido abandonado, porque para eso estaba la asistenta.	Ichaqa llank’ayninwan sayk’usqa hermanaña ñawpaq hina Gregorta cuidaspa sayk’usqaña karqan chaypas, manan mamapas paypa rantinpi churananchu karqan, manataqmi necesariochu karqan Gregorta saqesqa kasqanqa, chhayna kasqanraykun chay sirvientaqa chaypi para.
Esa vieja viuda, que en su larga vida debía haber superado lo peor con ayuda de su fuerte constitución, no sentía repugnancia alguna por Gregorio.	 Chay machu viuda, unay kawsayninpi aswan millay kaqta atipanan karqan sinchi hatun kamachikuyninpa yanapayninwan, manan Gregorta millaykurqanchu.
Sin sentir verdadera curiosidad, una vez había abierto por casualidad la puerta de la habitación de Gregorio y, al verle, se quedó parada, asombrada con los brazos cruzados, mientras éste, sorprendido y a pesar de que nadie le perseguía, comenzó a correr de un lado a otro.	 Mana cheqaqtachu yachayta munaspa, huk kutin mana yuyaypichu Gregorpa cuarton punkuta kicharisqa, payta rikuspataq, musphasqa makinta k’uyusqa sayaykusqa, paytaq musphasqa, mana pipas qatishaqtinpas, usqhaylla phawayta qallarisqa .ladomanta huk ladoman.
Desde entonces no perdía la oportunidad de abrir un poco la puerta por la mañana y por la tarde para echar un vistazo a la habitación de Gregorio.	 Chaymantapachan mana hayk’aqpas qonqarqanchu tutamantanpi, ch’isiyaqtapas punkuta pisillata kicharinanpaq, Gregorioq cuartonta qhawananpaq.
Al principio le llamaba hacia ella con palabras que, probablemente, consideraba amables, como: «¡Ven aquí, viejo escarabajo pelotero!» o «¡Mirad el viejo escarabajo pelotero!» Gregorio no contestaba nada a tales llamadas, sino que permanecía inmóvil en su sitio, como si la puerta no hubiese sido abierta.	"Qallariypiqa payman waqyasqa simikunawan, chaykunataqa payqa yuyaykurqanpaschá amistadpaq hina, kay hinata: ""¡Kayman hamuy, machu wanu escarabajo!"" otaq ""¡Qhawariy mawk'a wanu chuspita!"" Gregorqa manan chay hina waqyakuykunata kutichirqanchu, aswanpas mana kuyurispallan qheparqan, punkupas mana kichasqa hina."
¡Si se le hubiese ordenado a esa asistenta que limpiase diariamente la habitación en lugar de dejar que le molestase inútilmente a su antojo!	 ¡Sichus chay sirvientaman kamachisqa kanman karqan sapa p’unchay cuartota pichananpaq, manataqmi yanqapaqchu llakichikunman karqan!
Una vez, por la mañana temprano, una intensa lluvia golpeaba los cristales, quizá como signo de la primavera, que ya se acercaba cuando la asistenta empezó otra vez con sus improperios, Gregorio se enfureció tanto que se dio la vuelta hacia ella como para atacarla, pero de forma lenta y débil.	 Huk kutinmi, tutamantanpi, sinchi para ventanakunaman tupashasqa, ichapas primavera killapa señalnin hina, chaymi asuykamuchkasqaña sirvienta hukmanta insultayta qallariptin, Gregorqa anchata piñakuruspan payman kutirirqa atacananpaq hina.. ichaqa pisi pisimanta pisi pisimanta.
Sin embargo, la asistenta, en vez de asustarse, alzó simplemente una silla, que se encontraba cerca de la puerta, y, tal como permanecía allí, con la boca completamente abierta, estaba clara su intención de cerrar la boca sólo cuando la silla que tenía en la mano acabase en la espalda de Gregorio.	Ichaqa mancharikunanmantaqa, sirvientaqa huk sillata hoqarispallan, chay sillataqa punku qayllapin kasharqan, chaypi simin kicharisqa sayashaqtinmi sut’ita rikukurqan payta hap’isqan sillawanraq siminta wisq’ayta munasqan makinpi kashaspan Gregorioq wasanpi tukurqan.
¿Con que no seguimos adelante?	 ¿Imanasqataq mana ñawpaqman rinchikchu?
preguntó, al ver que Gregorio se daba de nuevo la vuelta, y volvió a colocar la silla tranquilamente en el rincón.	 nispa tapusqa, Gregorta yapamanta muyuriqninta rikuspa, hawkalla sillata esquinaman kutichispa tanqaykusqa.
Gregor ya no comía casi nada.	 Gregorqa manañam imatapas mikurqañachu.
Sólo si pasaba por casualidad al lado de la comida tomaba un bocado para jugar con él en la boca, lo mantenía allí horas y horas y, la mayoría de las veces acababa por escupirlo.	 Mikhunapa waqtanta pasaspallam huk picadurata hapiq siminpi pukllananpaq, chaypim achka horakuna hinaspa achka horakuna waqaychaq, yaqa llapanpiqa thuqaspanmi tukuq.
Al principio pensó que lo que le impedía comer era la tristeza por el estado de su habitación, pero precisamente con los cambios de la habitación se reconcilió muy pronto.	 Qallariypiqa yuyaykurqanmi mikhunanpaq hark’asqanqa llakikuy kananpaq cuarton imayna kashasqanrayku, ichaqa cuartopi cambiokuna kasqanraykun usqhaylla allipunachirqan.
Se habían acostumbrado a meter en esta habitación cosas que no podían colocar en otro sitio, y ahora había muchas cosas de éstas, porque una de las habitaciones de la casa había sido alquilada a tres huéspedes.	Kay cuartomanqa mana maymanpas churayta atisqanku imakunatapas churaymanmi yachasqaña karqaku, kunanqa achkallañam chaykuna karqa, chay wasipi huknin cuarto kimsa internadokunaman alquilasqa kasqanrayku.
Estos señores tan severos  —  los tres tenían barba, según pudo comprobar Gregorio por una rendija de la puerta —  ponían especial atención en el orden, no sólo ya de su habitación, sino de toda la casa, puesto que se habían instalado aquí, y especialmente en el orden de la cocina.	 Kay ancha sinchi wiraqochakuna — kinsantinku barbayoq karqanku, imaynan Gregorqa punkupi raqrawan cheqaqchayta atirqan hina — anchatan qhawarirqanku ordenta, manan cuartonkullapichu, aswanpas llapan wasipin, kaypi churakusqankurayku, hinaspa astawanqa cocinapa ordenninpi.
No soportaban trastos inútiles ni mucho menos sucios.	 Paykunaqa manan sayankuchu inútil aswan pisi qhelli platokuna.
Además, habían traído una gran parte de sus propios muebles.	 Chaymantapas, paykunaqa kikinkumanta mueblenkumanta askha partetan apamusqaku.
Por ese motivo sobraban muchas cosas que no se podían vender ni tampoco se querían tirar.	 Chayraykum achka imapas puchurqa mana rantikuy atikuq nitaqmi wischuyta munarqakuchu.
Todas estas cosas acababan en la habitación de Gregorio.	 Tukuy chaykunaqa Gregorioq cuartonpin tukurqan.
Lo mismo ocurrió con el cubo de la ceniza y el cubo de la basura de la cocina.	 Chaynallataqmi pasarqa uspha latawan hinaspa cocinapi basura churanawanpas.
La asistenta, que siempre tenía mucha prisa, arrojaba simplemente en la habitación de Gregorio todo lo que, de momento, no servía; por suerte, Gregorio sólo veía, la mayoría de las veces, el objeto correspondiente y la mano que lo sujetaba.	Chay sirvientaqa, sapa kuti apuraylla puriq, Gregorpa cuartonman tukuy imata wikch’uykuspalla, manaña imapaqpas valeq kaqta; Ancha kusisqa, Gregorioqa rikusqalla, yaqa llapanpi, tupaq kaqninta, chayta hap’iq makitapas.
La asistenta tenía, quizá, la intención de recoger de nuevo las cosas cuando hubiese tiempo y oportunidad, o quizá tirarlas todas de una vez, pero lo cierto es que todas se quedaban tiradas en el mismo lugar en que habían caído al arrojarlas, a no ser que Gregorio se moviese por entre los trastos y los pusiese en movimiento, al principio, obligado a ello porque no había sitio libre para arrastrarse, pero más tarde con creciente satisfacción, a pesar de que después de tales paseos acababa mortalmente agotado y triste, y durante horas permanecía inmóvil.	 Ichapas pichaq runaqa yuyaykusqa karqan tiempo, oportunidad kashaqtin imakunatapas hoqariyta, otaq yaqapaschá huk kutillapi llapanta wikch’uyta, ichaqa cheqaq kaqmi, llapanku wikch’usqa kashaqtinku urmasqanku cheqasllapi qhepakurqanku, mana wikch’usqa kaqtinkuqa .Ichapas Gregorqa chay basurakuna chawpinta kuyuspa kuyuchinman, qallariypiqa mana libre espacio kasqanraykum obligasqa karqa qasqunanpaq, ichaqa qipamanmi astawan kusisqa, chayna puriyninkuna qipata sayk’usqa hinaspa wañuykama llakisqa tukurqa chaypas , hinaspan askha horakuna mana kuyurispa qheparqan.
Como los huéspedes a veces tomaban la cena en el cuarto de estar, la puerta permanecía algunas noches cerrada, pero Gregorio renunciaba gustoso a abrirla, incluso algunas noches en las que había estado abierta no se había aprovechado de ello, sino que, sin que la familia lo notase, se había tumbado en el rincón más oscuro de la habitación.	Invitadokuna mayninpi salapi cenata mikhusqankuman hinan wakin tutakunapi punkuqa wisq’asqallapuni karqan, ichaqa Gregorqa kusisqan mana kichariyta munarqanchu, wakin tutakuna kichasqa kashaqtinpas manan aprovechasqachu, aswanpas, mana familiaq reparasqan , payqa cuartoq aswan tutayaq k’uchunpi mast’arisqa.
Pero en una ocasión la asistenta había dejado un poco abierta la puerta que daba al cuarto de estar y se quedó abierta incluso cuando los huéspedes llegaron y se dio la luz.	 Ichaqa huk kutinmi sirvientaqa salaman riq punkuta kichasqata saqepurqan, invitasqakuna chayamuqtinkupas, k’anchayta llank’aqtinpas kichasqallan karqan.
Se sentaban a la mesa en los mismos sitios en que antes habían comido el padre, la madre y Gregorio, desdoblaban las servilletas y tomaban en la mano cuchillo y tenedor.	 Paykunaqa ñawpaq taytanku, mamanku, Gregor mikhusqanku cheqaskunapin mesapi tiyaykurqanku, servilletankuta kicharispanku cuchillonkutapas, tenedorninkutapas makinkuman hap’irqanku.
Al momento aparecía por la puerta la madre con una fuente de carne, y poco después lo hacía la hermana con una fuente llena de patatas.	 Chayllam mamaqa punkupi rikurimuq huk plato aychata apaspa, chaymanta pisi tiempollamantam ñañaqa rikurimuq huk plato papa huntasqata apaspa.
La comida humeaba.	 Mikhuyqa q’osñiqmi kasqa.
Los huéspedes se inclinaban sobre las fuentes que había ante ellos como si quisiesen examinarlas antes de comer, y, efectivamente, el señor que estaba sentado en medio y que parecía ser el que más autoridad tenía de los tres, cortaba un trozo de carne en la misma fuente con el fin de comprobar si estaba lo suficientemente tierna, o quizá tenía que ser devuelta a la cocina.	Invitadokunaqa ñawpaqninkupi platokunata k’umuykuspa manaraq mikhushaspa qhawariyta munankuman hina, segurotaqmi, chawpipi tiyaq wiraqocha, kinsantinmanta aswan atiyniyoq hina, huk aychata kuchushasqa kikin fuenteta qhawanapaq sichus suficiente tierno kasqanmanta, otaq ichapas cocinaman kutichina kanman karqan.
La prueba le satisfacía, la madre y la hermana, que habían observado todo con impaciencia, comenzaban a sonreír respirando profundamente.	 Chay pruebaqa satisfacerqa, mamawan ñañanwan, mana pacienciayuq tukuy imata qhawaspa, asiriyta qallarirqanku samayta hap’ispa.
La familia comía en la cocina.	 Aylluqa yanuna wasipi mikhurqanku.
A pesar de ello, el padre, antes de entrar en ésta, entraba en la habitación y con una sola reverencia y la gorra en la mano, daba una vuelta a la mesa.	 Chayna kaptinpas taytaqa manaraq chayman yaykuspanmi chay cuartoman yaykuspan huk arcollawan gorralla makinpi hapispan mesata muyurirqa.
Los huéspedes se levantaban y murmuraban algo para el cuello de su camisa.	 Invitadokunaqa hatarispan camisapa collarninman imatapas murmuraqku.
Cuando ya estaban solos, comían casi en absoluto silencio.	 Sapallan kaspankuqa yaqa upallallam mikuqku.
A Gregorio le parecía extraño el hecho de que, de todos los variados ruidos de la comida, una y otra vez se escuchasen los dientes al masticar, como si con ello quisieran mostrarle a Gregorio que para comer se necesitan los dientes y que, aun con las más hermosas mandíbulas, sin dientes no se podía conseguir nada.	Gregorpaqqa admirakuypaqmi rikchakurqa, mikuy pachapi tukuy imaymana qapariykuna ukhupi, kirukuna yapamanta yapamanta masticasqankuta uyariq, chayta ruwaspapas Gregorman qawachinapaq hina, kirukuna mikunanpaq necesitasqankuta, aswan sumaq quijadayuqpas mana kirukuna mana imatapas tariyta atirqankichu.
Pero si yo no tengo apetito  —  se decía Gregorio preocupado — , pero me apetecen estas cosas.	 Ichaqa manan mikhuy munanichu — Gregorioqa llakisqa sonqonpi nisqa — ichaqa kaykunatan munani.
¡Cómo comen los huéspedes y yo me muero!	 ¡Imaynatataq invitadokuna mikhunku, ñuqataq wañuni!
Precisamente aquella noche  —  Gregorio no se acordaba de haberlo oído en todo el tiempo —  se escuchó el violín.	 Chay tutapunim — Gregorioqa manam yuyarirqachu sapa kuti uyarisqanmanta — violin uyarikurqa.
Los huéspedes ya habían terminado de cenar, el de en medio había sacado un periódico, les había dado una hoja a cada uno de los otros dos, y los tres fumaban y leían echados hacia atrás.	 Invitadokunaqa mikhuyta tukusqaña, chawpipi kaqpas periodicota hurqusqa, huk iskayman sapakama huk raphita qusqa, kimsantinkutaq cigarrota pitaspa leechkasqaku, qhipaman k’umuykuspa.
Cuando el violín comenzó a sonar escucharon con atención, se levantaron y, de puntillas, fueron hacia la puerta del vestíbulo, en la que permanecieron quietos de.	 Violin tocayta qallariqtinmi allinta uyarirqanku, sayarispataq chaki puntanwan vestibulo punkuman rirqanku, chaypin sayaqku.
pie, apretados unos junto a otros.	 chaki, ñit’isqa.
Desde la cocina se les debió oír, porque el padre gritó:	Cocinamantachá uyarisqaku, tayta qaparisqanrayku:
¿Les molesta a los señores la música?	 ¿Chay takiqa wiraquchakunatachu llakichin?
Inmediatamente puede dejar de tocarse.	 Chayllam manaña llachpakuyta atinkichu.
Al contrario  —  dijo el señor de en medio — .	 Aswanpas —nisqa chawpipi kaq runaqa—.
¿No desearía la señorita entrar con nosotros y tocar aquí en la habitación, donde es mucho mas cómodo y agradable?	 ¿Manachu señoraqa ñuqaykuwan kuska yaykuspan kaypi cuartopi pukllayta munanman, chaypiqa aswan sumaq hinaspa aswan sumaqmi?
Naturalmente  —  exclamó el padre, como si el violinista fuese él mismo.	 Naturalmente”, nispas taytaqa qaparisqa, kikin violinistapas kanman hina.
Los señores regresaron a la habitación y esperaron.	 Chay wiraqochakunaqa cuartoman kutispa suyarqanku.
Pronto negó el padre con el atril, la madre con la partitura y la hermana con el violín.	 Pisi tiempollamantan taytaqa takiq sayachin, mamataq partiturawan, ñañataq violinwan.
La hermana preparó con tranquilidad todo lo necesario para tocar.	 Chay hermanaqa hawkallam tukuy ima necesitasqankuta prepararqa pukllananpaq.
Los padres, que nunca antes habían alquilado habitaciones, y por ello exageraban la amabilidad con los huéspedes, no se atrevían a sentarse en sus propias sillas; el padre se apoyó en la puerta, con la mano derecha colocada entre dos botones de la librea abrochada; a la madre le fue ofrecida una silla por uno de los señores y, como la dejó en el lugar en el que, por casualidad, la había colocado el señor, permanecía sentada en un rincón apartado.	Tayta-mamakunaqa manan hayk’aqpas cuartokunata alquilarqankuchu, chaymi invitasqakunaman sumaq sonqo kasqankuta exagerarqanku, manan atrevikurqankuchu kikin sillankupi tiyayta; taytaqa punkuman k’umuykuspa, paña makinta churasqa, watasqa livera iskay botones chawpipi; mamamanqa huknin señormi huk tiyanata haywarirqan, hinaspan, maypichus, qonqayllamanta, wiraqocha churasqanpi saqeshaqtin, huk sapan k’uchullapi tiyasharqan.
La hermana empezó a tocar; el padre y la madre, cada uno desde su lugar, seguían con atención los movimientos de sus manos; Gregorio, atraído por la música, había avanzado un poco hacia delante y ya tenía la cabeza en el cuarto de estar.	 Chay hermanaqa pukllayta qallarisqa; taytapas mamapas, sapakamam maymi kasqankumanta, makipa kuyuyninta allinta qatiparqaku; Gregorqa chay takiwan aysasqa, aslla ñawpaqman purisqa, umantapas tiyakuna wasipi churasqaña.
Ya apenas se extrañaba de que en los últimos tiempos no tenía consideración con los demás; antes estaba orgulloso de tener esa consideración y, precisamente ahora, hubiese tenido mayor motivo para esconderse, porque, como consecuencia del polvo que reinaba en su habitación, y que volaba por todas partes al menor movimiento, él mismo estaba también lleno de polvo.	Manam admirakurqachu kay qipa watakunapi hukkunata mana piensasqanqa; manaraq chay qhawariyniyoq kasqanmanta orgulloso kashaspa, kunanpunitaqmi aswan razonniyoq kanman karqan pakakunanpaq, imaraykuchus, cuartonpi kamachikuq ñut’u hallp’arayku, pisi kuyuyllapipas tukuy ladoman phawaykachaq, paypas hunt’a kasharqan ñut’u allpamanta.
Sobre su espalda y sus costados arrastraba consigo por todas partes hilos, pelos, restos de comida.  Su indiferencia hacia todo era demasiado grande como para tumbarse sobre su espalda y restregarse contra la alfombra, tal como hacía antes varias veces al día.	 Wasanpi, waqtankunapipas maymanpas aysasqa q’aytukunata, chukchata, mikhuy puchukunata. Tukuy imamanta mana interesakusqanqa ancha hatunmi karqa, chaymi wasanpi siriykuspa alfombraman maqchikurqa, imaynam sapa punchaw achka kutita ruwaq hina.
Y, a pesar de este estado, no sentía vergüenza alguna de avanzar por el suelo impecable del comedor.	 Hinaspapas kay hinaña kashaspapas manan p’enqasqachu sientekurqan mana qhelliyoq mikhuy wasiq pampanta purispa.
Por otra parte, nadie le prestaba atención.	 Huk ladomantaq, mana pipas paytaqa uyarirqanchu.
La familia estaba completamente absorta en la música del violín; por el contrario, los huéspedes, que al principio, con las manos en los bolsillos, se habían colocado demasiado cerca detrás del atril de la hermana, de forma que podrían haber leído la partitura, lo cual sin duda tenía que estorbar a la hermana, hablando a media voz, con las cabezas inclinadas, se retiraron pronto hacia la ventana, donde permanecieron observados por el padre con preocupación.	Chay aylluqa violinpa takiyninpim tukuy sunqunwan hapipakurqaku; aswanpas invitasqakunan, qallariypiqa makinkuta bolsillonkupi churaspa, hermanaq contrenpa qhepanpi llumpay qayllallapi churasqa karqanku, chhaynapin partiturata leenkuman karqan, chayqa cheqaqtapunin hermanaq ñanninpi kasharqan, a pisi kunkawan, umankuta k’umuykukuspa, pisi tiempollamanta ventanaman kutirirqanku, chaypin taytankuq llakisqa qhawasqan qhepakurqanku.
Realmente daba a todas luces la impresión de que habían sido decepcionados en su suposición, de escuchar una pieza bella o divertida al violín, de que estaban hartos de la función y sólo permitían que se les molestase por amabilidad.	 Chiqamanta tukuy yuyayta qusqa, paykunap suposicionninkupi hukmanyasqa kasqankuta, violinpi sumaq utaq kusichiq takiyta uyarisqankumanta, chay rikuchiymanta sayk’usqa kasqankumanta, sumaq sunqu kasqankuraykulla llakisqa kasqankuta saqisqankumanta.
Especialmente la forma en que echaban a lo alto el humo de los cigarrillos por la boca y por la nariz denotaba gran nerviosismo.	 Astawanraqmi cigarropa q’osñinta siminkumanta, siminmantawan wayrachisqankuqa sinchi mancharisqa kasqankuta rikuchirqan.
Y, sin embargo, la hermana tocaba tan bien.  Su rostro estaba inclinado hacia un lado, atenta y tristemente seguían sus ojos las notas del pentagrama.	 Hinaspapas chaywanpas chay hermanaqa ancha allintan pukllarqan. Uyanpas huk ladomanmi k’iskisqa kashasqa, ñawinkunapas allintan llakisqataqmi kashasqa chay k’aspipi qelqasqa qelqakunata.
Gregorio avanzó un poco más y mantenía la cabeza pegada al suelo para, quizá, poder encontrar sus miradas.. ¿Es que era ya una bestia a la que le emocionaba la música?	Gregorioqa aswan pisita ñawpaqman puririspa umantapas pampaman k’askarachirqan, ichapas, qhawarisqankuwan tupananpaq... ¿Musikuwan kuyuchisqa uywañachu karqan?
Le parecía como si se le mostrase el camino hacia el desconocido y anhelado alimento.	 Paypaqqa mana riqsisqa, ancha munasqa mikhuyman ñanta rikuchichkankumanpas hinam karqa.
Estaba decidido a acercarse hasta la hermana, tirarle de la falda y darle así a entender que ella podía entrar con su violín en su habitación porque nadie podía recompensar su música como él quería hacerlo.	 Payqa decidisqañan kasharqan hermanaman wichaspa faldanta aysananpaq, chhaynapin entiendechinanpaq violinninta cuartonman apayta atisqanmanta, mana pipas munasqanman hina takiyninta premiayta atisqanrayku.
No quería dejarla salir nunca de su habitación, al menos mientras él viviese; su horrible forma le sería útil por primera vez; quería estar a la vez en todas las puertas de su habitación y tirarse a los que le atacasen; pero la hermana no debía quedarse con él por la fuerza., sino por su propia voluntad; debería sentarse junto a él sobre el canapé, inclinar el oído hacía él, y él deseaba confiarle que había tenido la firme intención de enviarla al conservatorio y que si la desgracia no se hubiese cruzado en su camino la Navidad pasada  — probablemente la Navidad ya había pasado —  se lo hubiese dicho a todos sin preocuparse de réplica alguna.	Payqa manan hayk’aqpas cuartonmanta lloqsichiyta munarqanchu, kawsashaqtinpas; millay rikchayninqa ñawpaq kutitam paypaq allin kanman; payqa huk kutillapin cuartonpa llapa punkunkunapi kayta munarqan, atacaqkunamantaq wikch’ukuyta munarqan; ichaqa manan chay hermanaqa kallpawanchu paywan qhepakunan karqan, aswanpas munasqanman hinan; ladonpi tiyakunan sofápi, rinrinta payman k’umuykachinan, hinaspan payqa willayta munarqan conservatorioman kachayta hunt’asqata yuyaykusqanmanta, hinallataq qayna navidadpi mana desgracia hamuqtinqa —navidadqa yaqapaschá karqanña over. past — llapa runaman willanman karqan mana kutichiymanta llakikuspa.
Después de esta confesión, la hermana estallaría en lágrimas de emoción y Gregorio se levantaría hasta su hombro y le daría un beso en el cuello, que, desde que iba a la tienda, llevaba siempre al aire sin cintas ni adornos.	 Kay confesión nisqa qhepamanmi hermanaqa waqaq, Gregoriotaq hombronkama sayarispa kunkanta much’aykuq, chaytan tiendaman risqanmantapacha mana cintayoq nitaq adornoyoq churakuq.
¡Señor Samsa!	 Señor Samsa!
gritó el señor de en medio al padre y señaló, sin decir una palabra más, con el índice hacia Gregorio, que avanzaba lentamente.	chawpipi kaq runaqa taytata qaparisqa, mana huk simita rimaspataq, hatun dedonwan Gregorman rikuchisqa, payqa pisi pisimanta ñawpaqman purichkasqa.
