español	quechua
En muchos casos, esta incapacidad supone morbosidad, decadencia, síntoma de agotamiento; casi todo lo que la grosería poco filosófica designa con el nombre de “vicio”, se reduce a esa incapacidad fisiológica para no reaccionar.	" Achka kutipi, kay mana atiyqa supone morbilidad, decadencia, huk síntoma de agotamiento; yaqa llapan imapas mana filosofía grosero kay ""vicio"" sutiwan sutichasqanmi pisiyachisqa chay fisiológico mana atiyman mana reaccionananpaq."
Una aplicación práctica de este aprendizaje de la vista es la siguiente: en todo aprender el individuo se vuelve lento, receloso y recalcitrante.	 Kay yachaypa rikuywan ruwaypaq ruwayqa kaymi: tukuy yachaypiqa sapan runaqa pisilla, iskayrayaq, mana kasukuqman tukun.
Lo extraño, lo nuevo, de cualquier índole que sea, lo deja por lo pronto acercarse a él con una calma hostil, retirando la mano.	 Raro, mosoq, ima naturalezaña kaqtinpas, payqa saqepunmi asuykamunanta awqa thak kaywan, makinta horqospa.
El estar con todas las puertas abiertas, la postración servil ante cualquier pequeño hecho, el sentirse dispuesto en todo momento a meterse, precipitarse sobre el prójimo y lo ajeno; en una palabra, la famosa “objetividad” moderna es mal gusto, lo antiaristocrático por excelencia.	 Llapan punkukuna kichasqa kaspa, ima huch’uy cheqaq kaqpa ñawpaqenpi sirviente prostración, tukuy tiempo listo sientekuspa haykunapaq, hukkunaman hukkunamanpas phawaylla; Huk rimayllapi, kunan pacha riqsisqa “objetividad” nisqa mana allin gusto, anti-aristocrático par excelencia.
Aprender a pensar: se ha perdido la noción de esto en nuestros establecimientos de enseñanza.	Yuyaymanay yachay: kaymanta yuyayka yachay wasinchikkunapi chinkarka.
Hasta en las Universidades, incluso entre los estudiosos propiamente dichos de la filosofía, la lógica empieza a extinguirse como teoría, como práctica, como oficio.	 Hatun Yachay Wasikunapipas, filosofía nisqamanta allinta rimaq yachakuqkunapas, lógica nisqa wañuyta qallarikun teoría hina, práctica hina, profesión hina.
Leyendo libros alemanes, ya no se descubre en ellos el más remoto recuerdo de que el pensamiento requiere una técnica, un plan didáctico, una voluntad de maestría; que hay que aprender a pensar como hay que aprender a bailar, concibiendo el pensamiento como danza.  ¿Dónde está el alemán que conozca todavía por experiencia ese estremecimiento sutil que los pies ligeros en lo espiritual irradian a todos los músculos?	 Alemán librokunata leespaqa manañan chaykunapi tarinchu aswan karu yuyariyta, chaymi yuyayqa necesitakun huk técnica, huk plan didáctico, huk dominación munayta; chaymi tusuyta yachanan hina yuyayta yachanan, yuyayta tusuyta hina yuyaykuspa. ¿Maypitaq kachkan alemán runa, payqa experienciawanmi yachanraq chay sutil kuyuriyta espiritualpi llampu chakikuna sapa aychaman radiasqanmanta?
La rígida torpeza del ademán espiritual, la manera desmañada de asir, son tan alemanas, que en el exterior suele considerárselas lo alemán.	 Espiritual gestopa sinchi torpe kaynin, hap’iypa torpe kaynin, ancha alemanmi, chaymi hawa llaqtakunapiqa alemán hina qhawarisqa kanku.
El alemán no tiene el sentido del matiz.	 Alemán runaqa manan ima sentido de matiz nisqatapas tarinchu.
El que los alemanes hayan siquiera aguantado a sus filósofos, sobre todo al eximio Kant, el lisiado más contrahecho que se ha dado jamás en el reino de los conceptos, dice demasiado de la gracia alemana.	Alemania runakunaqa filósofonkutapas aguantasqankun, astawanqa reqsisqa Kant sutiyoq runata, payqa aswan mana allin formayoq mana puriq runan, payqa manan hayk’aqpas hamut’aykunapi tarikurqanchu, chaymi Alemaniamanta graciamantaqa nishuta riman.
Sabido es que la danza, en todo sentido, está inseparablemente ligada a la educación aristocrática.	 Yachakunmi tusuyqa, tukuy imapi, mana t’aqay atina educación aristocrática nisqawan tupachisqa kasqan.
Si hay que saber bailar con los pies, con los conceptos, con las palabras: ¿es necesario agregar que hay que saber bailar también con la pluma, que hay que aprender a escribir?	 Sichus chakiwan, hamut’aykunawan, simikunawan tusuyta yachanayki kanqa chayqa: yapanaykichu kanman plumaykiwanpas tusuyta yachanayki kasqanmanta, qillqayta yachanayki kasqanmanta?
Mas llegado este punto es posible que yo me convierta en un completo enigma para los lectores alemanes.	 Ichaqa kaypiqa atikunmanmi Alemania leeqkunapaq hunt’asqa enigmaman tukusaq.
CORRERÍAS DE UN HOMBRE INACTUAL	 RUNAKUNA MANAM RUNAMANTA RUWAYKUNA
Mis imposibles.	 Mana atikuqniy.
Séneca: o el torero de la virtud.	 Seneca: utaq allin kaymanta toro maqanakuq.
Rousseau: o el retorno a la Naturaleza in impuris naturalibus.	 Rousseau: utaq impuris naturalibus nisqapi Pachamamaman kutiy.
Schiller: o el trompeta moral de Säckingen.	 Schiller: icha Säckingenpa trumpeta moralnin.
Dante: o la hiena que compone sus versos en tumbas.Kant: o cant como carácter inteligible. - Víctor Hugo: o el faro junto al mar del absurdo. - George Sand: o lactea ubertas, o sea, la vaca lechera con “estilo hermoso”. - Michelet: o el entusiasmo en mangas de camisa. - Carlyle: o el pesimismo como almuerzo mal digerido.	"Dante: otaq sepulturakunapi versiculonkunata ruwaq hiena Kant: otaq cant runa entiendenapaq hina. - Víctor Hugo: utaq mana yuyayniyuqpa lamar quchapa patanpi faro. - George Sand: utaq lactea ubertas, chaymi ""sumaq estilo""yuq lechero waka. - Michelet: otaq entusiasmo en mangas de camisa. - Carlyle: utaq pesimismo mana allin digerido almuerzo hina."
John Stuart Mill: o la claridad agraviante.	 John Stuart Mill: otaq ofensiva sut’i kaynin.
Les frères de Goncourt: o los dos Ayax trabados en lucha con Homero.	 Les frères de Goncourt: icha iskay Ajaxkuna Homerwan maqanakuypi llamk'arqanku.
Música de Offenbach.	 Offenbach taki.
Zola: o “el deleite de heder”.	" Zola: otaq ""asnaq kusikuy""."
Renan: Teología, o la corrupción de la razón por el “pecado original” (el cristianismo).	" Renan: Teología, icha ""qallari hucha"" (kristiyanu) nisqawan yuyay waqllichisqa."
Testimonio de ello es Renan, quien en cuanto arriesga un sí o no de carácter más bien general se equivoca con penosa regularidad.	 Kaypa pruebanqa Renanmi, payqa, chaylla riesgoman churan arí otaq mana nisqa, aswan general naturalezayoq, pantasqa kashan nanay regularidadwan.
Quisiera, por ejemplo, aunar la science con la noblesse; pero es evidente que la science pertenece a la democracia.	 Ejemplopaq, cienciata noblesse nisqawan kuskanchayta munani; ichaqa sut’inmi ciencia democraciaman pertenecesqan.
Desea, con no escasa ambición, representar un aristocratismo del espíritu; mas al mismo tiempo dobla la rodilla, y no solamente la rodilla ante la doctrina contraria, el évangile des humbles.  ¡De nada sirven el librepensamiento, el modernismo, la ironía, etc., si íntimamente se sigue siendo cristiano, católico y aun sacerdote!	Payqa munanmi, mana huch’uy munayniyoq, huk espiritu aristocrático nisqa representayta; ichaqa kaq pachallapitaqmi qonqoritapas k’umuykachin, manataqmi qonqorillatachu contrario yachachikuypa ñawpaqenpi, évangile des humbles nisqa. ¡Mana imapaqpas valenchu libre yuyay, modernismo, ironía, hukkunapas, sichus cristiano, católico, sacerdotepas hinalla kanki chayqa!
Como un jesuita y confesor, Renan tiene la capacidad inventiva de la seducción; no le falta a su espiritualidad la amplia sonrisa de frailuco; como todos los sacerdotes, sólo se vuelve peligroso cuando ama.	 Jesuita hinallataq confesor hina, Renanqa seducción nisqa inventivo atiyniyoqmi; Espiritalidadninpiqa manan faltanchu fraileq ancho asiriynin; llapa sacerdotekuna hina, munakuspallan peligrosoman tukupun.
Nadie lo iguala en eso de adorar de una manera que entraña peligro mortal.	 Manan pipas paywanqa igualanchu wañuyman apaq peligropi yupaychaypiqa.
Este espíritu de Renan, un espíritu que enerva, es una fatalidad más para la pobre Francia enferma, con la voluntad enferma.	 Kay Renanpa espiritun, huk espiritu kallpachaq, huk wañuy aswan wakcha unqusqa Franciapaq, unqusqa munayniyuq.
Sainte - Beuve: No tiene ni pizca de virilidad; rebosa un odio mezquino frente a todos los espíritus viriles.	 Sainte-Beuve: Payqa manan huk chikan qhari kayniyoqchu; payqa llapa qhari espiritukunaman huch’uy cheqnikuywanmi hunt’a kashan.
Vaga sutil, curioso, aburrido, fisgón; en el fondo, mujer, con un rencor y una sensualidad muy femenina.	 Vago sutil, curioso, aburrido, nosy; ukhupi, warmi, envidiayuq, ancha warmi sensualidadniyuq ima.
Como sicólogo, un genio de la maledicencia; pródigo, inagotable en medios para tal fin; nadie como él para emponzoñar elogiando.	Psicólogo hina, ch’aqwaypi genio hina; prodigal, mana tukukuq chaypaq medios nisqapi; mana pipas pay hinachu venenowan alabayta.
Plebeyo en sus instintos más soterrados y afín al resentimiento de Rousseau: por ende, romántico; pues bajo todo romantisme el instinto de Rousseau clama, rencoroso, venganza.	 Común aswan pakasqa instintonkunapi hinaspa Rousseaupa phiñakuyninman rikchakuq: chayrayku, romantico; imaraykuchus tukuy romantisme ukhupi Rousseau instinton qaparin, phiñakuywan, venganza.
Revolucionario, pero contenido ajustado por el miedo.	 Revolucionario, ichaqa contenido manchakuymanta allichasqa.
Sin libertad ante todo lo que tiene fuerza (la opinión pública, la Academia, la Corte, hasta Port Royal).	 Mana libre kaspa tukuy ima atiyniyoqpa ñawpaqenpi (opinión pública, Academia, Corte, Port Royalpas).
Furioso con todo lo grande en los hombres y las cosas, con todo lo que cree en sí.	 Runakunapi, imakunapipas tukuy hatun kaqkunawan, tukuy ima kikinpi iñiqkunawan phiñasqa.
Lo suficientemente poeta y semi - mujer para sentir lo grande aun como poder; retorciéndose constantemente, como ese famoso gusano, porque constantemente se siente pisoteado.	 Harawiq hinaspa kuska warmi suficiente hatun sientekunanpaq atiy hinapas; sapa kuti kuyurispa, chay riqsisqa kuru hina, sapa kuti sarusqa hina sientekusqanrayku.
Como crítico, sin criterio ni sustancia, con el paladar del libertino cosmopolita para variadas cosas, pero sin tener valor ni siquiera para admitir el libertinaje.	 Crítico hina, mana criterioyuq nitaq sustanciayuq, cosmopolita libertinopa paladarninwan imaymana ruwaykunapaq, ichaqa mana valorniyuq nitaq licentiousidadta riqsikunanpaq.
Como historiador, sin filosofía, sin el poder de la mirada filosófica; es, por consiguiente, por lo que en todos los asuntos principales repudia la tarea de juzgar bajo la máscara de la “objetividad”.	"Historiador hina, mana filosofíayoq, mana filosofía qhawariypa atiyninwan; chaymi, chayrayku, imaraykun llapa hatun asuntokunapi ""objetividad"" nisqa mascarawan juzgay ruwayta repudian."
Muy otra actitud observa ante todas las cosas donde un gusto refinado, gastado, es la más alta instancia; aquí si que tiene el valor de la autoafirmación, el deleite de la autoafirmación ; en esto es un maestro consumado.	 Huk actitudpuni qhawan ñawpaq tukuy imakunapi maypichus huk refinado gusto, gastasqa, aswan hatun instancia; kaypiqa kanmi kikinmanta takyakuypa chanin, kikinmanta takyachiypa kusikuy; kaypiqa allin ruwaq maestron.
A juzgar por algunas páginas, una forma preliminar de Baudelaire.	 Iskay kimsa paginakunawan chaninchaspaqa, Baudelairepa ñawpaq rikchaynin.
La Imitatio Christi es uno de esos libros que yo no puedo hojear sin experimentar una repulsión fisiológica; trasciende de ella un perfume femenino, para cuyo disfrute hay que ser francés o wagneriano.  Su autor tiene una manera de hablar del amor que hasta las parisienses quedan intrigadas.	 Imitatio Christi nisqa libroqa hukninmi chay librokunamanta, chaytaqa manan raphichayta atiymanchu mana revulsión fisiológica nisqawan tupaspa; huk warmi q’apaymi chaymanta pasapun, kusikunapaq mayqenmi francés otaq wagneriano kanan. Qelqaqninqa munakuymanta rimananpaqmi paris llaqtayuq runakunapas anchata admirakunku.
Me dicen que ese jesuita más listo, A. Comte, que pretendió conducir a sus franceses a Roma por el rodeo de la ciencia, se inspiró en este libro.	 Willawanku chay aswan yachaysapa jesuita A. Comte, paymi francés runakunanta Roma llaqtaman pusayta munarqan cienciaq desvío nisqawan, kay libromanta yuyaychasqa kasqanmanta.
Lo creo: “la religión del corazón”.	 Creeni: “sonqoq religionnin”.
G. Eliot: Esa gente se ha librado del Dios cristiano y cree ahora que debe profesar más que nunca la moral cristiana; he aquí una consecuencia inglesa, que no vamos a reprochar a los mamarrachos morales a lo Eliot.	G. Eliot: Kay runakunaqa cristiano Diosmantan kacharikurqanku, kunantaq creenku ñawpaqmantaqa aswanta cristiano moralidadta ninanku kasqanpi; kaypiqa inglés simipi consecuencian, manan Eliotmanqa k’amisunchischu chay jerks morales nisqakunata.
En Inglaterra, por cualquier pequeña emancipación de la teología, hay que rehabilitarse de una manera aterradora como fanático de la moral.	 Inglaterra suyupiqa, teologíamanta ima pisi emancipacionpaqpas, manchakuypaqmi rehabilitasqa kanan huk fanatico moral hina.
Tal es en ese país la multa que por esto se paga.	 Chayna multa chay suyupi kaymanta pagasqa.
Nosotros, en cambio, tenemos entendido que quien repudia el credo cristiano no tiene derecho a la moral cristiana.	 Ñoqanchistaqmi ichaqa entiendenchis pipas cristiano creenciata renunciaqqa manan derechoyoqchu cristianokunaq allin kawsakuyninman.
Ésta no es en absoluto una cosa sobrentendida; digan lo que digan los menos ingleses, hay que insistir en la verdad sobre este punto.	 Kayqa manan imaraykupas entiendenapaq hinachu; imaña pisi inglés runakunapas ninkuman chaypas, kaymantan cheqaq kaqta insistinanchis.
El cristianismo es un sistema, una concepción global y total de las cosas.	 Cristianismo nisqaqa huk sistemam, pachantinpi hinallataq llapanpi imakunatapas hamut'aymi.
Desglosar de él un concepto capital, la creencia en Dios, significa romper el todo, quedarse sin nada necesario.	 Huk capital hamutayta, Diospi iñiy, pakiyqa, tukuy imata pakiymi, mana ima necesario kaqwan saqisqa kay.
Descansa el cristianismo en el supuesto de que el hombre no sepa, no pueda saber, qué es bueno y qué es malo para él; cree en Dios, el único que lo sabe.	Cristianismoqa sayan kay yuyaypi, runaqa manan yachanchu, manan yachayta atinchu, imachus allin kaqta, imachus mana allin kaqta paypaq; Diospi iñiy, paylla yachaq.
La moral cristiana es una orden; su origen es trascendente; se halla más allá de toda crítica, de todo derecho a la crítica; sólo expresa la verdad si Dios es la verdad; está inseparablemente ligada a la creencia en Dios.	 Cristiano moralidadqa huk ordenmi; mayninpiqa transcendentalmi; llapan k’amiymanta aswan hatunmi, llapan k’amiypaq derecho; cheqaq kaqtaqa sut’inchan Dios cheqaq kaqtinllan; mana t’aqay atina t’inkisqa kashan Diospi iñiywan.
Si los ingleses creen efectivamente que saben por sí solos, por vía de la “intuición”, qué es bueno y qué es malo; si, en consecuencia, creen que ya no tienen necesidad del cristianismo como garantía de la moral, es por una mera consecuencia del imperio del juicio de valor cristiano y una expresión de lo sólido y profundo que es este imperio, así que se ha olvidado el origen de la moral inglesa y ya no se siente lo muy condicionado de su derecho a la existencia.	" Sichus inglés runakuna cheqaqtapuni creenku paykuna kikinku yachasqankuta, ""intuición"" nisqawan, imachus allin kaqta, imachus mana allin kaqtapas; sichus, chayrayku, creenku manaña necesitasqankuta cristiano kayta garantia de moralidad hina chayqa, chayqa consecuenciallanmi imperiomanta cristiano valor juiciomanta hinallataq expresionlla imayna solido hinallataq ukhun kay imperio kasqanmanta, chaymi inglés moralidadpa originnin hinallataq manañan sientekunchu derechonpa ancha condicional kaynin."
Para el inglés, la moral aún no constituye un problema.	 Inglés simipaqqa manaraqmi sasachakuychu moralidadqa.
George Sand: He leído las primeras Lettres d’un voyageur: como todo lo que deriva de Rousseau, falsas, artificiosas, blandas, exageradas.	George Sand: Ñawpaq kaq Lettres d’un voyageur nisqa qillqata ñawincharuni: tukuy imapas Rousseaumanta lluqsiq hina, llulla, artificial, llampu, exagerado.
Yo no soporto este abigarrado estilo de papel pintado, como tampoco la ambición plebeya de sentimientos generosos.	 Mana aguantayta atinichu kay motley estilo wallpaper, nitaqmi atinmanchu plebeo ambición de generoso sentimientos.
Lo peor, por cierto, es y sigue siendo la coquetería femenina con virilidades, con modales de mozalbete petulante.	 Aswan mana allinqa, de paso, kanmi, hinallataqmi kashan warmi coquetería virilidadwan, huk petulanto waynaq costumbrenkunawan.
¡Qué fría sería, con todo, esa artista insoportable!	 ¡Mayna chirichá kanman chay mana aguantay atina artista!
Se daba ella cuerda como si fuese un reloj y a escribir.  ¡Fría, como Hugo, como Balzac, como todos los románticos, en cuanto empuñaban la pluma!	 Reloj hinapas, qillqananpaqpas k’irisqa. ¡Chiri, Hugo hina, Balzac hina, llapa romanticokuna hina, plumankuta hap’isqanku qhepallaman!
Y con qué aire de suficiencia se tumbaría esa fecunda vaca plumífera, que tuvo algo de alemán en sentido fatal, igual que el propio Rousseau, su maestro, y aunque sólo haya podido darse en tiempos en que declinaba el gusto francés!	 Hinaspa ima wayrawanmi chay puquyniyuq plumayuq wakaqa puñunman karqa, chaymi imapas alemán simiyuq karqa wañuypaq hina, kikin Rousseau hina, yachachiqnin hina, hinaspapas francés sabor pisiyachkaptin tiempollapiña kanman karqa!
Sin embargo, Renan la venera.	 Ichaqa Renanqa respetanmi.
Moral para sicólogos.	 Psicólogos nisqapaq moralidad nisqa.
¡No practicar una sicología reporteril!	 ¡Ama psicología reporterial nisqapi ruwaychu!
¡No observar nunca por el hecho de observar!	 ¡Ama hayk’aqpas qhawaychu qhawarinaykichisrayku!
Conduce esto a una óptica falsa, a una perspectiva torcida, a una cosa forzada y exagerada.	Kayqa llulla óptica nisqamanmi apamun, huk k’ullu qhawariyman, imapas kallpachasqaman, hatunyachisqamanpas.
El experimentar como prurito de experimentar no sale bien.	 Experimentayqa huk picazón hina experimentanapaqqa manam allintachu rin.
Quien experimenta no debe estar con los ojos fijos en sí, o si no, toda ojeada se convierte en “aojadura”.	" Pipas experimentaqqa manan ñawinta kikinpichu hap'inan, mana chayqa, llapa qhawariykunan ""wow"" nisqaman tukupun."
El sicólogo nato se cuida por instinto de ver para ver; lo mismo se aplica al pintor nato, quien no trabaja nunca “del natural”, sino que encomienda a su instinto, su cámara oscura, la tarea de cribar y exprimir el “caso”, la “Naturaleza”, la “experiencia”.  Sólo lo general, la conclusión, el resultado, entra en su conciencia; no sabe de esa arbitraria deducción de caso particular.	" Naceq psicólogoqa instintivamente qhawayta qhawan qhawananpaq; chay hinallataqmi naceq pintorpaqpas, payqa manan hayk'aqpas llank'anchu ""naturalezamanta"", aswanpas instintonman, cámara obscuranman, encargakun ""caso"", ""Naturaleza"", ""experiencia"" nisqakunata tamizaspa, siq'ispa. General, conclusión, resultadollanmi conciencianman haykun; mana yachanchu chay deducción arbitraria de caso particular nisqamanta."
¿Cuál es el resultado si se procede de un modo diferente?	 ¿Imataq kanman huknirayta puririspaqa?
¿Si, por ejemplo, se practica sicología reporteril sobre el modelo de los romanciers parisienses, grandes y pequeños?	 Sichus, ejemplopaq, psicología reporterial nisqa ruwakunman, hatun huch’uypas, parisino romancekunaq modelonpi?
Esa gente dijérase que acecha la realidad y todas las noches vuelve a casa con un puñado de curiosidades.	 Chay runakunaqa realidadta qatipachkankumanpas hinam sapa tuta wasinkuman kutimunku huk makilla curiosidadkunawan.
Pero el resultado está a la vista: un montón de páginas pintarrajeadas, un mosaico en el mejor de los casos; de todos modos, una cosa compuesta, inquieta, estridente.	Ichaqa chaypa ruwasqanqa sutillam qawakun: huk montón waqllichisqa paginakuna, aswan allin kaqpiqa huk parche; llapanku kaqlla, huk compuesto, mana samayniyuq, qapariq imapas.
En este aspecto, lo peor corresponde a los Goncourt, los cuales no juntan tres frases que no hieran la vista, la vista del sicólogo.	 Kay aspectopiqa aswan mana allinqa tupanmi Goncourt runakunawan, paykunaqa manam kimsa rimaykunata huñunkuchu, mana ñawita nanachiq, psicólogopa ñawinta.
La Naturaleza, artísticamente apreciada, no es un modelo.	 Naturaleza, artísticamente chaninchasqa, manan modelochu.
Exagera, deforma y crea lagunas.	 Exagera, distorsiona hinaspa brechas nisqakunata paqarichiy.
La Naturaleza es el azar.	 Naturalezaqa random nisqa.
El estudio “del natural” se me antoja un mal síntoma; denota sumisión, debilidad y fatalismo.	" ""Naturalezamanta"" estudioqa mana allin sintomamanmi rikchawan; kasukuyta, pisi kallpa kayta, fatalismo nisqatapas riqsichin."
Esta postración ante los petits faits no es digna del artista cabal.	 Kay petits faits nisqakunaq ñawpaqenpi prostracionqa manan dignochu hunt’asqa artistapaq.
Ver lo que es - he aquí algo que corresponde a un tipo diferente de espíritus, a los espíritus anti - artísticos, fácticos - .	 Qaway ima kasqanmanta - kaypi kachkan imapas hukniray laya espiritukunawan tupaq, anti-artista, chiqap espiritukunawan.
Hay que saber quién se es.	 Yachanayki tiyan pi kasqaykita.
A propósito de la sicología del artista.	 Artistapa psicologíanmanta.
Para que haya arte, cualquier hacer y mirar estético, es imprescindible un requisito fisiológico: la embriaguez.	 Arte kananpaq, ima estética ruwaypas, qhawaypas, huk requisito fisiológico nisqa ancha allinmi: machasqa kay.
Hasta que la embriaguez no haya acrecentado la excitabilidad de todo el mecanismo no aparece el arte.	Arteqa manan rikhurinchu machasqa kay llapan mecanismoq excitabilidad nisqa yapakunankama.
Todas las clases de embriaguez, por diferentemente determinadas que estén, tienen este poder; lo tiene, sobre todo, la embriaguez de la excitación sexual, forma antigua y primaria de la embriaguez.	 Tukuy rikchaq machaykunam, mayna hukniraq tanteasqa kaptinpas, kay atiyniyuqmi; Chayqa, tukuy imamanta aswantaqa, warmi-qhari puñuy kusikuypa machasqa kayninmi, ñawpaq pachamanta, ñawpaq kaq machaymanta.
Como también la embriaguez que deriva de todos los grandes apetitos, de todos los fuertes afectos; la embriaguez de la fiesta, de la rivalidad, de la hazaña, del triunfo, de todo movimiento extremo; la embriaguez de la crueldad; la embriaguez de la destrucción; la embriaguez derivada de determinados factores meteorológicos, por ejemplo, la embriaguez de la primavera o de la acción de los narcóticos.	 Imaynan machaypas llapa hatun mikhuykunamanta, tukuy sinchi munakuykunamanta paqarimuq; partidoq machasqa kaynin, atipanakuypa, hazañaq, atipaypa, tukuy sinchi kuyuypa; millay ruwaykunawan machasqa kay; chinkachiypa machaynin; wakin factores meteorológicos nisqamanta paqarimuq machay, ejemplopaq, primavera killapi machasqa kay otaq narcóticos nisqakunaq ruwaynin.
Por último, la embriaguez de la voluntad, de una voluntad cargada y henchida.	 Tukuchanapaqtaq, munaypa machasqa kaynin, cargado, punkisqa munaypa.
Lo esencial de la embriaguez es la sensación de fuerza acrecentada y plena.	 Machaypa esencianqa alto kallpayuq hinaspa hunt’asqa kallpayuq kaymi.
Esta sensación impulsa al individuo a obsequiar a las cosas, a participar en ellas, a violentarlas; a esto es a lo que se le llama idealizar.	Kay sensación nisqa sapan runata tanqan imakunamanpas regalokunata qonanpaq, chaypi participananpaq, chaykunata sarunchananpaq; kaymi idealizacion nisqa.
Emancipémonos en este punto de un prejuicio: el idealizar no consiste, como se cree comúnmente, en una deducción o abstracción de lo pequeño y secundario, lo decisivo es una tremenda acentuación de los rasgos principales, al punto que desaparecen los demás.	 Kaypiqa kacharikusun huk prejuiciomanta: idealizacionqa manan, imaynan común creekun hinachu, deducción otaq abstracción nisqapichu kashan imakunachus huch’uylla, secundaria nisqamanta, imachus decisivo nisqataqmi hatun acentuación nisqa hatun rasgokuna, chaymi chay wakintaq chinkapun.
Embargado por este estado, uno enriquece todo con su propia plenitud; todo lo que ve y apetece lo ve henchido, pletórico, vigoroso, cargado de fuerza.	 Kay estadowan hap’isqa, runaqa tukuy imatan qhapaqyachin kikin hunt’asqa kayninwan; tukuy rikusqanta, munasqantapas rikun hunt’a, hunt’a, kallpasapa, kallpawan cargasqa.
El hombre ebrio transmuta las cosas, hasta que reflejan su propio poder, hasta que son reflejos de su propia perfección.	 Machasqa runaqa imakunatapas t’ikrakunmi, kikin atiyninta rikuchinankama, kikin hunt’asqa kayninpa rikuchiyninkama.
Este no poder por menos de transmutar las cosas en algo perfecto es a lo que llamamos arte.	 Kay mana atiymi aswan pisita imakunatapas imapas hunt’asqaman t’ikrayqa, chaytan sutichanchis arte nispa.
Incluso todo lo que él no es, se convierte en goce propio; en el arte, el hombre goza de sí mismo como de algo perfecto.	 Tukuy mana kasqanpas, kikinpa kusikuymanmi tukupun; artepiqa runaqa imapas hunt’asqa hinam kusikun.
Es dable concebir un estado contrario, una específica esencia anti - artística del instinto, un modo de ser que empobrece, diluye y atrofia todas las cosas.	Atikunmi yuyaymanayta huk estado contrario nisqamanta, huk esencia antiartística específica de instinto nisqamanta, huk forma de ser nisqamanta, chaymi wakchayachin, diluyan hinaspa atrofia tukuy imatapas.
