español	quechua
Mi objeción contra toda la sociología inglesa y francesa es que conoce por experiencia únicamente las formas de una sociedad decadente y con todo candor toma los propios instintos de la decadencia como norma del juicio de valor sociológico.	Llapa inglés, francés sociología nisqamanta hark’akusqayqa, experienciamantan yachan huk sociedad decadente nisqa formakunallata, hinaspan candidamente hap’in decadenciaq kikin instintonkunata, norma hina juicio de valor sociológico nisqapi.
La vida descendente, la merma de toda fuerza organizadora, esto es, separadora, diferenciadora, jerarquizante, se formula en la sociología de ahora como ideal.	 Uraykamuq kawsay, llapan organizaq kallpa pisiyachiy, chaymi t’aqanakuy, t’aqanakuy, jerárquico nisqa, kunan pacha sociología nisqapiqa ideal hina formulasqa.
Nuestros socialistas son un montón de décadents; pero también el señor Herbert Spencer es un décadent: ¡juzga deseable, por ejemplo, el triunfo del altruismo.	 Socialistanchiskunaqa huk t’aqa decadentekunan kanku; ichaqa Herbert Spencerpas huk décadente: payqa munasqapaqmi qhawarin, ejemplopaq, altruismoq atipayninta!
Mi noción de la libertad.	 Libre kaymanta yuyayniy.
A veces el valor de una cosa no reside en lo que con ella se consigue, sino en lo que por ella se paga, en lo que nos cuesta.	 Wakin kutipiqa imapaspa chaninqa manam chaywan imapas aypaypichu tiyan, aswanqa imamanta qullqi qusqapim, ima qullqi quwasqanchikpim.
Consignaré un ejemplo.	 Huk ejemplotan grabasaq.
Las instituciones liberales, una vez impuestas dejan de ser pronto liberales; posteriormente, nada daña en forma tan grave y radical la libertad como las instituciones liberales.	 Liberal institucionkuna, huk kuti churasqa, pisi tiempollapi manaña liberal kanku; chaymantaqa manan imapas libertad nisqataqa sinchitachu, radicalmentepas waqllichinchu, instituciones liberales nisqakuna hina.
Sabidos son sus efectos: socavan la voluntad de poder, son la nivelación de montaña y valle elevada al plano cie la moral, empequeñecen y llevan a la pusilanimidad y a la molicie; con ellas triunfa siempre el hombrerebaño.	Efectonkunaqa allin reqsisqan: atiyniyoq kay munaytan pisiyachin, urqukunaq, wayq’okunaq nivelayninmi, plano de moralidad nisqaman hoqarisqa, enanoyapun, pusillanimidadman, qella kayman ima apamun; paykunawanmi runa-rebañoqa atipanpuni.
El liberalismo significa el desarrollo del hombre - rebaño.	 Liberalismo nisqaqa runap - uywakunap wiñayninmi.
Las mismas instituciones, mientras se brega por ellas, producen muy otros efectos; entonces promueven, en efecto, poderosamente la libertad.	 Chay kikin institucionkunan, chaykunapaq maqanakushaspapas, ancha huk efectota paqarichimunku; chaymantataq, yaqapaschá atiywan kallpachanku libre kayta.
Bien mirado, es la guerra la que produce estos efectos; la guerra librada por instituciones liberales, que como guerra perpetúa los instintos antiliberales.	 Allinta qhawarisqa, guerran kay efectos nisqakunata paqarichimun; liberal institucionkunaq ruwasqan guerra, chaymi guerra hina antiliberal instintokunata wiñachin.
Y la guerra educa para la libertad.	 Hinaspapas guerraqa libre kaytan yachachin.
Pues ¿qué significa libertad?	 ¿Ima ninantaq libre kayqa?
Que se tiene la voluntad de responsabilidad personal.	 Chayqa kanmi kikinpa responsabilidadninpa munaynin.
Que se mantiene la distancia jerárquica que diferencia.	 Chay distancia jerárquica nisqa waqaychasqa kasqanmi huknirayta ruwan.
Que se llega a ser más indiferente hacia la penuria, la dureza, la privación y aun hacia la vida.	 Chayqa aswan mana interesakuqmanmi tukupun sasachakuyman, k’arak kaywan, pisichikuyman, kawsaymanpas.
Que se está pronto a sacrificar en aras de su causa vidas humanas, la propia inclusive.	 Chay hukninmi listo kashan runakunaq kawsayninta sacrificananpaq, kikinpa kawsaynintapas, paykunaq ruwayninkurayku.
Significa la libertad que los instintos viriles, guerreros y triunfantes privan sobre otros instintos, por ejemplo, los de la “felicidad”.	"Niyta munan, chay instinto virile, guerrero, triunfante nisqakuna huk instintokunamanta qechusqankuta, ejemplopaq, ""kusikuy"" nisqamanta."
El hombre libertado, y, sobre todo, el espíritu libertado, pisotea el despreciable bienestar con que sueñan mercachifles, cristianos, vacas, mujeres, ingleses y demás demócratas.	 Kacharisqa runaqa, llapanmanta aswantaqa kacharisqa espirituqa, hucksterkuna, cristianokuna, wakakuna, warmikuna, inglés runakuna, huk demócratas nisqakunapas musqukusqanku millay allin kawsaytan saruykun.
El hombre libre es un guerrero.	 Libre runaqa maqanakuqmi.
¿Cuál es el criterio de la libertad en los individuos y los pueblos?	 ¿Imataq sapan runakunapi, llaqtakunapipas libre kanankupaq criterio?
La resistencia que es preciso superar, el esfuerzo que demanda el mantenerse arriba.	 Chay hark’akuy atipanapaq, kallpachakuy necesitakun patapi qhepanapaq.
El tipo más alto de hombres libres debiera buscarse allí donde continuamente se supera la resistencia más grande a dos pasos de la tiranía, a un tris del trance de caer en la servidumbre.	 Aswan hatun laya libre qharikunatan maskhana maypichus aswan hatun hark’akuyqa sapa kutilla atipakun iskay llank’aypi tiraníamanta, pisillapi kamachi kayman urmaymanta.
Esto es sicológicamente cierto si aquí se entiende por los “tiranos” instintos implacables y terribles que desafían contra sí el maximum de autoridad y disciplina: el tipo más hermoso es Julio César, y es también políticamente cierto, como lo prueba la historia.	" Kayqa psicológicamente cheqaqmi sichus kaypi niyta munan ""tiranokuna"" mana khuyapayakuq manchay instintokunata, chaykunan desafian máximo autoridadta, disciplinatapas paykuna kikinku contra: aswan sumaq tipoqa Julio César, hinallataqmi política nisqapipas cheqaq, historiaq pruebasqan hina."
Ningún pueblo importante que llegó a ser un pueblo de valía, llegó a serlo bajo instituciones liberales; el grave peligro hizo de él algo dignó de veneración: el peligro que nos da la noción de nuestros recursos, nuestras virtudes, nuestras armas, nuestro espíritus que nos obliga, en suma, a ser fuertes.  Primer axioma: hay que estar obligado a ser fuerte o si no, no se lo es nunca.	Manan mayqen importante runakunapas valeq llaqtaman tukuq runakunapas chay hinachu karqanku liberal institucionkunaq kamachisqanpi; chay hatun peligromi payta ruwarqan imapas yupaychanapaq hina: chay peligro qowanchis recursonchismanta, allin kayninchismanta, armanchismanta, espiritunchismanta yuyayta, chaymi obligawanchis, pisi rimayllapi, kallpasapa kananchispaq. Ñawpaq kaq axioma: kallpasapa kanaykipaqmi obligasqa kanayki mana chayqa manan hayk’aqpas kankichu.
Esos grandes semilleros del hombre fuerte, del tipo humano más fuerte que se ha dado jamás, las comunidades aristocráticas al estilo de Roma y Venecia, entendían la libertad exactamente en el sentido en que yo entiendo la palabra “libertad”: como algo que se tiene y no se tiene, que se quiere, que se conquista.	" Chay hatun muhukuna kallpasapa runaq, aswan kallpasapa runaq laya, Romaq Veneciaq estilonpi aristocrático ayllukuna, entienderqanku libre kayta exactamente chay sentidopi entiendesqayman hina ""libertad"" simita: imapas hukpa kasqanman hina.and you don 't have, imatachus munanki, imatataq atipanki."
Crítica del modernismo.	 Modernismo nisqamanta k’amiy.
Todo el mundo conviene en que nuestras instituciones ya no sirven para nada.	 Lliwmi acuerdopi kachkanku institucionninchikkuna manaña imapaqpas allin kasqanmanta.
Pero la culpa no la tienen ellas, sino nosotros.	 Ichaqa manan paykunaq huchanchu, ñoqanchismi.
Tras haber perdido todos los instintos de los que surgen las instituciones, perdemos las instituciones porque ya no servimos para ellas.	Llapan instintokunata chinkachispa, maymantachus institucionkuna paqarimunku, institucionkunata chinkachinchis, manaña servisqanchisrayku.
Siempre el modernismo ha sido la forma de decadencia del poder de organización; ya en Humana, demasiado humano I, 349, he definido la democracia moderna, junto con sus cosas a medio hacer, como el “Reich alemán”, como forma de decadencia del Estado.	 Modernismoqa ñawpaqmantaraqmi organizacionpa atiyninpa pisiyayninpa rikchaynin karqa; ña Humana, ancha runa I, 349, kunan pacha democraciata, kuskan ruwasqa ruwayninkunawan kuska, “Reich Alemán” hina, Estadoq pisiyayninpa rikch’ayninta hina sut’incharqani.
Para que haya instituciones debe haber un tipo de voluntad distinto, imperativo, antiliberal hasta el summum: la voluntad de tradición, de autoridad de responsabilidad ante centurias por venir, de solidaridad de cadenas de generaciones hacia adelante y hacia atrás in infinitum.	 Institucionkuna kananpaqqa hukniraymi kanan munay, imperativo, antiliberal nisqa extremokama: tradicionpa munaynin, manaraq pachak watakuna hamuchkaptin responsabilidadpa autoridadnin, cadenakuna miraykunapa ñawpaqman hinaspa qipaman hukllawakuynin mana tukukuq.
Si existe tal voluntad, se establece algo como el Imperio Romano o como Rusia, la única potencia que hoy tiene duración, que puede esperar, que puede aún dar promesas; Rusia, la antítesis de la miserable fragmentación y nerviosidad de Europa, que han hecho crisis con la fundación del Reich alemán.	 Sichus chay hina munay kanman chayqa, imapas Roma Imperio hina otaq Rusia hina takyasqa, kunan p’unchaypi sapallan atiyniyoq, suyayta atin, promesakunata qoyta atinraq; Rusia, Europaq llakikuypaq t’aqanakuyninpa, nerviosidadninpa antítesisnin, chaykunan sasachakuyman rirqanku Alemania Reich nisqa kamachikuypa kamakuyninwan.
Todo el Occidente ha perdido esos instintos de los que surgen las instituciones, de los que surge el porvenir: no hay acaso nada tan reñido con su “espíritu moderno”.	Lliw Occidenteqa chinkachirunmi chay instintokunata, chaymantam institucionkuna paqarimunku, chaymantam hamuq pachaqa rikurimun: manapaschá imapas kanchu chayna contrario “espíritu moderno” nisqawan.
Se vive para el hoy, muy de prisa; se vive de una manera muy irresponsable: precisamente a esto se le llama “libertad”.	 Kunan punchawpaqmi kawsanki, ancha utqaylla; hukqa ancha irresponsable hinam kawsan: precisamente kaytam sutichanku “libertad” nispa.
Lo que convierte en instituciones las instituciones es despreciado, odiado, repudiado; en cuanto se pronuncia la palabra “autoridad” se cree correr peligro de caer en una nueva esclavitud.	" Imachus institucionkunata institucionkunata ruwan chayqa pisichasqa, chiqnisqa, qhisachasqa; ""Autoridad"" simita t'uqyachisqa kaqtin hina, hukqa iñin mosoq kamachiman urmanankupaq peligropi kasqankuta."
A tal extremo llega la decadencia en el instinto valorativo de nuestros políticos, de nuestros partidos políticos: prefieren instintivamente lo que desintegra, lo que acelera el proceso.	 Politiconchiskunaq, partido políticonchiskunaq instinton valor nisqa pisiyayninqa chay hina extremomanmi chayan: instintivamenten aswan allinpaq qhawarinku imakunachus ch’usaqyachiq, imachus usqhaylla puririq chayta.
Testimonio de ello es el matrimonio moderno.	 Chayta testigoqa kunan tiempopi casarakuymi.
Éste claramente ha perdido su buen sentido; mas esto no constituye una objeción contra el matrimonio, sino contra el modernismo.	 Kayqa sut’itan allin yuyayninta chinkachipun; ichaqa kayqa manan casarakuy contra hark’akuychu, aswanpas modernismo contra.
Radicaba el buen sentido del matrimonio en la responsabilidad jurídica exclusiva del hombre, la que aseguraba equilibrio al matrimonio, el cual hoy cojea de ambas piernas.	Casarakuypi allin yuyayqa karqan qhariq sapallan responsabilidad legalninpi, chaymi casarakuypi equilibriota segurarqan, kunan tiempopiqa iskaynin chakinpin llañuyashan.
Radicaba el buen sentido del matrimonio en su indisolubilidad fundamental, la que le confería un acento que sabía hacerse oír frente a la contingencia de sentimiento, pasión y momento.	 Casarakuypa allin yuyayninqa karqan fundamental indisolubilidadninpin, chaymi qorqan huk acentota, chaymi yacharqan imayna uyarikunanpaq, contingencia de sentimiento, pasión, momento nisqakunaq ñawpaqenpi.
Radicaba asimismo en la responsabilidad de las familias por la selección de los cónyuges.	 Hinaspapas familiakunaq ruwayninpin kasharqan esposakunata akllanankupaq.
Con la creciente indulgencia en favor del casamiento por amor se ha eliminado de hecho el fundamento del matrimonio, aquello que hace de él una institución.	 Munakuyrayku casarakuyman aswan llamp’u sonqo kasqankuwanmi, allinta horqosqa kashan casarakuypa teqsin, chaymi institucionman tukuchin.
No se funda jamás una institución sobre una idea; no se funda el matrimonio, como queda dicho, sobre el “amor”, sino sobre el instinto sexual, el instinto de propiedad (mujer e hijo como .propiedad), el instinto de dominación, que constantemente organiza el señorío más pequeño, la familia, y necesita de hijos y herederos para mantener también fisiológicamente un grado logrado de poder, influencia y riqueza; para preparar largas tareas, solidaridad instintiva a través de centurias.	"Huk institucionqa manan hayk’aqpas huk yuyaypi sayarinchu; Casarakuyqa manan, nisqa hina, ""munakuy"" nisqapichu sayarin, aswanpas instinto sexual nisqapi, instinto de propiedad nisqapi (warmiwan wawawan .propiedad hina), instinto dominación nisqapi, chaymi sapa kutilla organizan aswan huch'uy kamachiyta, ayllu , hinaspa wawakunata necesitan hinaspa herederos nisqakunapas fisiológicamente allin grado de poder, influencia hinaspa qhapaq kayta waqaychanankupaq; unay ruwaykunata wakichinapaq, pachak watakunapi instintiva solidaridad."
El matrimonio como institución implica ya la afirmación de la forma de organización más grande, más perdurable; si la sociedad misma no puede dar garantías, como un todo, hasta las generaciones más remotas, el matrimonio no tiene sentido.	 Casarakuyqa institucion hinaqa ñam implican aswan hatun, aswan wiñaypaq forma de organización nisqapa afirmacionninta; sichus kikin sociedad mana garantiakunata qoyta atinmanchu chayqa, llapanpiqa, aswan karu miraykunamanpas, casarakuyqa manan imapaqpas valenchu.
El matrimonio moderno ha perdida su sentido; en consecuencia, debe procederse a abolirlo.	 Kunan tiempopi casarakuyqa manañan imapaqpas valenñachu; chayraykun chinkachisqa kanan.
La cuestión obrera.	 Llamkay tapukuy.
La estupidez, en el fondo; la degeneración de los instintos, que hoy día es la causa de todas las estupideces, reside en que exista una cuestión obrera.	Chay sonso kay, básicamente; instintokunaq degeneracionnin, kunan p’unchaypi llapa sonso kaypa causan, llank’ay tapukuypa kayninpi tiyan.
Hay cosas de las que no se hace cuestión: imperativo primordial del instinto.	 Kanmi imakuna mana tapukuy ruwasqa: imperativo primordial de instinto.
Yo no veo en absoluto qué quiere hacerse con el obrero europeo, una vez que se le ha convertido en cuestión.	 Manam rikunichu ni imapipas ima ruwayta munasqanmanta Europa llamkaqwan, huk kuti tapukuyman tikrakuruptinqa.
Se encuentra en una situación demasiado ventajosa como para no plantear su cuestión de una maner=a cada vez más categórica e imperiosa.	 Qamqa ancha ventajoso posiciónpi kachkanki mana aswan categorial hinaspa imperioso hina asuntoykita hatarichinaykipaq.
Cuenta, en definitiva, con la ventaja de la superioridad numérica.	 Pisi rimayllapi, yupaypi aswan allin kayninpa ventajayuqmi.
Se ha desvanecido por completo la esperanza de que en el obrero se cristalice como clase un tipo humano modesto y que se baste a él mismo, lo cual hubiera tenido sentido, pues resultâuu francamente necesario.	 Chay suyakuyqa, huk modesto y autosuficiente tipo runa llamkaqpi huk clase hina cristalizakunman karqa, chaymi tukuy imapi chinkarunman karqa, chaymi sentidoyuq kanman karqa, francamente necesario kasqanrayku.
¿Qué se ha hecho?	 ¿Imatan ruwasqa kashan?
Se ha hecho todo por matar en germen hasta la idea de tal evolución; por obra de la más irresponsable despreocupación y ligereza se ha causado la destrucción total de los instintos, gracias a los cuales el obrero es factible, factible para sí mismo, como clase.	Tukuy imapas ruwasqañam chay germen wañuchinapaq chayna evolución nisqa yuyaypas; aswan irresponsable insouciancepa, llampu kayninpa llamkayninwanmi, instintokunapa tukuyninpi chinkachiynin rikurirun, chaymanmi gracias llamkaqqa factible, factible pay kikinpaq, huk clase hina.
Se ha desarrollado en el obrero la capacidad militar, se le ha acordado el derecho de coalición, el sufragio; no es de extrañar así que el obrero sienta en realidad su existencia como un apremio (moralmente hablando, como una injusticia).	 Llank’aqpi capacidad militar nisqa wiñachisqa, paymanmi qosqa derecho de coalición, sufragio; Hinaptinqa, manam admirakuypaqchu llamkaq runaqa cheqaptapuni kayninta huk harkakuq hina sientesqanqa (moralmente rimaspaqa, injusticia hina).
¿Qué es lo que, en definitiva, se quiere?	 ¿Imataq, qhipaman, munasqa?
Si se intenta un fin, hay que procurar también los medios conducentes a su logro; si se quiere esclavos, es una locura educarlos para amos.	 Sichus huk tukukuy yuyaykusqa kanman chayqa, maskhanataqmi chayman chayanapaq ñankunata; kamachikunata munaspaqa loco kaymi patron kanankupaq yachachiyqa.
“Libertad a que yo no aspiro. ” En tiempos como los actuales, estar librado a los instintos es una fatalidad más.	 “Manan munanichu libre kayta. ” Kunan tiempokunapiqa instintokunaman saqesqa kayqa huk wañuymi.
Estos instintos se contradicen, se obstruyen y se destruyen unos a otros; yo defino lo moderno como la contradicción fisiológica consigo mismo.	 Kay instintokunaqa churanakunku, hark’anakunku, chinkachinakunku ima; Moderno nisqataqa kikinwan contradicción fisiológica nisqatan definini.
La razón, la educación, exigiría que bajo una presión férrea se paralizara, por lo menos, uno de estos sistemas de instintos para permitir a otro expandirse, adquirir fuerza y llegar a prevalecer.	Razón, educación, mañakunman hierro ñit’iypi, hukninpas kay sistemas de instintos paralizasqa kananpaq, huknin mast’arikunanpaq, kallpata tarinanpaq, atipananpaq ima.
Hoy día debiera hacerse posible al individuo podándolo: posible quiere decir íntegro.	 Kunanqa sapan runataqa podaspa atikuqmi ruwakunan: atikuqmi llapan niyta munan.
Sin embargo, suele hacerse justamente lo contrario: los que con más vehemencia reivindican la independencia, el desarrollo libre de trabas, el laisser aller, son precisamente los que más tienen de rienda y freno, lo mismo in politicis que en arte.	 Ichaqa, aswantaqa contrariotan ruwakun: pikunachus aswan kallpawan independencia nisqa, mana hark’asqa wiñariy, laisser aller nisqa, precisamente pikunachus aswan riendayoq, frenoyoq ima kanku, política nisqapipas arte nisqapi hina.
Mas se trata de un síntoma de la decadencia; nuestra noción moderna de la “libertad” es una prueba más de la degeneración de los instintos.	" Ichaqa ismuypa sintomallanmi; kunan pacha ""libertad"" nisqa yuyaykusqanchisqa aswan prueban instintokunaq pisiyasqanmanta."
Donde hace falta la fe.	 Maypichus iñiy necesitakun.
Nada hay tan raro entre moralistas y santos como la probidad; tal vez afirmen lo contrario y es posible que hasta lo crean.	 Moralistakunawan santokunawanqa manan imapas ancha pisillachu, probidad hinaqa; paykunaqa huktachá ninkuman, creenkumanpas.
Pues cuando creer es más útil, eficaz y convincente que fingir de modo consciente, el fingimiento, por instinto, no tarda en tornarse inocencia: tesis capital para la comprensión de los grandes santos.	Imaraykuchus iñiyqa aswan allin, aswan allin, convencechiq kaqtin, consciente hina ruwaymantaqa, chay pretensión, instintivamente, pisi tiempollapin mana huchayoq kayman tukupun: hatun santokunata entiendenapaq tesis capital.
También en el caso de los filósofos, tipo diferente de santos; es un “gaje del oficio” eso de admitir solamente determinadas verdades, esto es, aquellas en base a las cuales su oficio cuenta con la sanción pública; en el lenguaje de Kant: verdades de la razón práctica.	" Hinallataqmi filósofokunaq rimayninpipas, hukniray clase santokuna; ""peligro comercial"" nisqa wakin cheqaq kaqkunata chaskiyqa, chaymi, chaykunaq hawanpi qhatuyninpa sanción pública nisqayoq; Kantpa rimayninpi: razones prácticas nisqamanta chiqapkuna."
Saben lo que deben demostrar; en esto son gente práctica; el acuerdo sobre “las verdades” es el signo por el cual se reconocen.	 Paykunaqa yachanku imatachus pruebanankuta; kaypiqa ruway atiy runakunan kanku; “cheqaq kaqkunamanta” rimanakuyqa, chaywanmi reqsisqa kanku.
“No mentirás” significa, en definitiva: cuidado, señor filósofo, con decir la verdad.	" ""Manan llullakunkichu"" niyta munan, pisi rimayllapi: cuidakuy, wiraqocha Filósofo, cheqaqta rimaywan."
Una sugestión para los conservadores.	 Conservadorkunapaq yuyaychay.
He aquí algo que antes no se supo y ahora se sabe: no es posible la regresión, el retorno, en ningún sentido ni grado.	 Kaypim kachkan ñawpaqpi mana riqsisqa, kunanpas riqsisqa: regresión, kutimuy, manam ima sentidopipas nitaq gradopipas atikunmanchu.
Los fisiólogos, por lo menos, lo sabemos.	 Fisiólogos, al menos, yachanchikmi.
Mas todos los sacerdotes y moralistas han creído en esta posibilidad; pretendían retraer a la humanidad por la fuerza a una medida anterior de virtud.	Ichaqa llapa sacerdotekuna, moralistakuna ima, kay atikusqanpi iñirqanku; paykunaqa kallpachakurqankun runa kayta ñawpaq allin ruwayman kutichiyta.
La moral siempre ha sido un lecho de Procusto.	 Moralidadqa ñawpaqmantaraqmi Procrusteo cama karqan.
Hasta los políticos han seguido en esto las huellas de los predicadores de la virtud; hay aún partidos que sueñan con la regresión de todas las cosas.	 Politicokunapas kaypim qatiparqaku allin kaymanta willakuqkunapa puriyninta; kanraqmi partidokuna tukuy imapa kutiriyninta musqukuq.
Sin embargo, nadie está en libertad de retroceder.	 Ichaqa manan pipas librechu qhepaman kutinanpaqqa.
Quiérase o no, hay que avanzar, quiere decir, avanzar paso a pasó por el camina de la décadence (tal es mi definición del moderno “progreso” .  ).	" Munaspapas mana munaspapas, ñawpaqmanmi purinayki, chaymi, decadencia nisqa ñanninta hukmanta pasoman purinayki (chaynam kunan pacha ""progreso"" nisqamanta definicionniy . )."
Se puede poner trabas a esta evolución y así estancar, acumular, hacer más vehemente y fulminante la degeneración misma, aunque no se pueda hacer más.	 Huk runaqa kay evolución nisqaman hark’akunatan churanman, chhaynapin sayanman, huñukunman, kikin degeneración nisqatan aswan kallpawan ch’akichinman, manaña astawanqa ruwayta atikunmanchu chaypas.
Mi concepto del genio.	 Geniomanta yuyayniy.
Los grandes hombres, como las grandes épocas, son explosivos donde está acumulado un poder tremendo; su propósito es siempre, en el orden histórico y el fisiológico, que durante largo tiempo se haya concentrado, acumulado, ahorrado y preservado con miras a ellos; que durante largo tiempo no haya ocurrido ninguna explosión.	Hatun runakuna, hatun pachakuna hina, hatun atiy huñusqapi phataq kanku; propósitonqa sapa kutinmi, orden histórico y fisiológico nisqapi, unaymantapacha chaykunata qhawarispa huñusqa, huñusqa, waqaychasqa, waqaychasqa ima; unaymantaña mana ima phataypas kasqanmanta.
Cuando la tensión en la masa se ha hecho excesiva, basta el estímulo más casual para producir el “genio”, la “magna realización”, el gran destino.	" Masapi tension nishuta tukuqtinqa, aswan casual estímulo nisqa suficienten ""genio"", ""hatun aypayta"", hatun destino nisqa paqarichinanpaq."
¡Qué importa entonces el ambiente, la época, el “espíritu de la época”, la “opinión pública”!	 ¡Imataq chaypachaqa pachamama, pacha, “espíritu de la época”, “opinión pública” nisqa!
Veamos el caso de Napoleón.	 Qhawarisunchis Napoleonpa ruwasqanmanta.
La Francia de la Revolución, y sobre todo la de antes de la Revolución, hubiera producido el tipo opuesto al de Napoleón; y lo produjo, en efecto.	 Revolución nisqa Francia, aswantaqa manaraq Revolución nisqa Francia, Napoleonpa contranpi kaq layatan paqarichimunman karqan; hinaspan chayta ruruchirqan, cheqaqtapuni.
Y porque Napoleón fue diferente, heredero de una civilización más fuerte, más larga, más antigua que aquella que se venía abajo en Francia, llegó a ser amo, fue únicamente el amo.	 Hinaspa Napoleón hukniray kasqanrayku, Francia suyupi thuñikushaq civilización nisqamanta aswan kallpasapa, aswan unay, aswan kuraq civilización nisqapa herederon kasqanrayku, payqa patronman tukupurqan, payqa patronllan karqan.
Los grandes hombres son necesarios, la época en que se presentan es accidental; el que casi siempre lleguen a dominarla depende sólo de que sean más fuertes, más antiguos; de que durante más tiempo se hayan concentrado y acumulado con algún propósito.	Hatun runakunan necesario, rikhurimusqanku pachaqa accidentalmi; Yaqa sapa kuti kamachiyta atisqankuqa aswan kallpasapa, kuraq kasqankumantallan kanqa; aswan unayña imapaqpas huñusqa, huñusqa kasqankuta.
Entre un genio y su época existe una relación como entre lo fuerte y lo débil, también como entre lo viejo y lo joven; la época siempre es relativamente mucho más joven, floja, falta de madurez, falta de seguridad, infantil.	 Huk geniowan edadninwanqa kanmi huk relación imaynan kallpasapawan pisi kallpawan, hinallataq machuwan waynawan; chay edadqa sapa kuti relativamente aswan wayna, qella, mana puqusqa, mana seguro, wawa hina.
