español	quechua
La moral, tal como hasta ahora se la ha entendido, tal como la ha formulado por último también Schopenhauer, como “negación de la voluntad de vida”, es el instinto de la décadence que se presenta como imperativo.	" Moralidad, kunankama hamut'asqa hina, Schopenhauerpas qhipaman formulasqanman hina, ""kawsayman munaypa negacionnin"" hina, decadenciaq instintonmi, chaymi imperativo hina rikuchikun."
Dice ella: “¡Sucumbe!”; es el juicio de condenados.	" Payqa nin: ""¡Sucumb!""; Huchachasqa runakunaq taripayninmi."
Consideramos, por último, la ingenuidad que supone decir: “¡así debiera ser el hombre!'	 Tukuchanapaqtaq, qhawarinchik ingenuo kay niyta: “¡kayjina runa kanan tiyan!’, nispa.
La realidad nos muestra una encantadora riqueza de tipos, la exuberancia de un derrochador juego y cambio de formas; y he aquí que tal pobre moralista metido en su rincón dice: “¡no!, ¡el hombre debiera ser diferente!”.  Y este pedante hasta pretende saber cómo debiera ser el hombre; pinta en la pared su propia imagen y dice “¡ecce homo!”.	"Realidadqa rikuchiwanchismi huk munay qhapaq kay tipos nisqakunata, exuberancia nisqa usuchiq pukllaymanta hinallataq formakuna cambiaymanta; Hinaspa qhawariy, chhayna wakcha moralista k’uchunpi k’askarasqa nin: ""Manan! ¡Runaqa hukniraymi kanan!"" Hinaspa kay pedanteqa runa imayna kananta yachaq hinaraqmi ruwan; pirqapi kikinpa rikch’ayninta pintaspa “ecce homo!”, nispa nin."
Aunque el moralista sólo se dirija al individuo y le diga: “¡tú debieras ser así!”, hace también el ridículo.	" Moralista runaqa sapan runaman rimapayaspalla: ""¡Kay hina kanayki!"""
El individuo es en un todo un trozo de fatum, una ley más, una necesidad más para todo lo por venir, todo lo que será.	 Sapa runaqa llapanpiqa fatum nisqa pedazo, huk kamachikuy aswan, huk necesidad aswan tukuy ima hamunanpaq, tukuy imapas kanqa.
Decirle “¡sé diferente!” significa pedir que todo sea diferente y cambie, incluso retroactivamente.  Y en efecto, no han faltado los moralistas consecuentes que pedían que el hombre fuese diferente, esto es, virtuoso, trasunto fiel de ellos, vale decir, estrecho y mezquino; ¡para tal fin negaban el mundo!	 Niy “hukniray kay!” tukuy ima hukniray kananpaq, tikrakunanpaq ima mañakuymi, qhipaman kutispapas. Hinaspapas cheqaqtapunin, manan pisinchu karqan constante moralistakuna, paykunan mañakurqanku runa hukniray kananpaq, chaymi virtuoso, paykunaq hunt’aq transcripcionnin, chaymi estrecho hinallataq huch’uylla; chaypaqmi kay pachata negarqanku!
¡Una máxima locura, por cierto!	 Absolutamente loco, por cierto!
¡Una inmodestia nada modesta, por cierto!	 ¡Huk karun modesta inmodestiamanta, cheqaqtapuni!
La moral, en tanto que condena por principio y supone un no con referencia a cosas, factores o propósito de la vida, es un error específico con el cual no hay que tener contemplaciones, una idiosincrasia de degenerados qué ha hecho un daño inmenso.	Moralidad, maypachachus condenan principio nisqapi, hinallataq asumin mana nisqata imakunamantapas, factorkunamanta otaq imapaqchus kawsaymanta rimaspa, ichaqa huk pantay específico, chaywanmi mana contemplacionkuna kananchu, huk idiosincrasia degenerados nisqakunan, chaymi hatun dañota ruwarqan.
Los otros, los inmoralistas, por el contrario, hemos abierto nuestro corazón a toda clase de comprensión, compenetración y aprobación.	 Wakinkuna, qhelli huchapi puriqkuna, aswanpas, sonqonchistan kicharirqanku tukuy imaymana hamut’ayman, atipanakuyman, allin qhawarisqa kayman ima.
Nos cuesta negar; anhelamos decir sí.	 Sasam ñuqanchikpaqqa negayqa; arí niyta anchata munanchik.
Se nos han abierto cada vez más los ojos para esa economía que necesita y sabe aprovechar aun todo lo que repudia la santa locura del sacerdote, de la razón enferma operante en el sacerdote; para esa economía en la ley de la vida que saca provecho incluso de la repugnante especie de los mojigatos, los sacerdotes y los virtuosos.	 Ñawinchismi aswan aswan kicharisqa kashan chay economía nisqaman, chaymi necesitan, yachantaqmi aprovechayta tukuy imata, sacerdoteq ch’uya locuranta, sacerdotepi llank’aq onqosqa razonmanta; chay economía nisqapaq kawsay kamachikuypi, chaymi gananciata tarin millay especie prudes nisqakunamanta, sacerdotekunamanta, allin ruwaqkunamantapas.
¿Qué provecho?	 ¿Ima allinninpaqtaq?
En este punto nosotros mismos, los inmoralistas, somos la respuesta.	 Kaypiqa ñoqanchis kikinchismi, qhelli huchapi puriqkuna, kutichiyqa.
LOS CUATRO GRANDES ERRORES	 TAWA HATUN PANTAYKUNA
Error de la confusión de causa y efecto.	 Causa y efecto nisqa pantasqa kayninpi pantay.
No hay error más peligroso que confundir el efecto con la causa: para mí es la depravación propiamente dicha de la razón.	Manan kanchu pantay aswan peligroso chay efectota causawan pantachiymantaqa: ñoqapaqqa kikin razonpa waqlliyninmi.
Y sin embargo, forma parte de este error de los hábitos más antiguos y más actuales de la humanidad; hasta entre nosotros está santificado, llevando el nombre de “religión”, “moral”.	 Hinaspapas, chaywanpas, runaq aswan ñawpaq, kunan pacha costumbrenkunaq kay pantayninpa hukninmi; noqanchis ukhupipas ch’uyanchasqan, “religión”, “moral” sutiwan.
Lo implica cada principio enunciado por la religión y la moral; los sacerdotes y los legisladores morales son los autores de esta depravación de la razón.	 Chayqa religionpa, moralidadpa enunciasqan sapa principiowanmi implicakun; sacerdotekuna, legisladores morales nisqakunan kay depravación de razonpa qelqaqnin kanku.
Un ejemplo ilustrará lo antedicho.	 Huk ejemplon sut’inchasun hanaqpi kasqanchista.
Todo el mundo conoce el libro en que el famoso Cornaro recomienda su dieta frugal como receta para una vida larga, feliz y también virtuosa.	 Lliwmi yachanku chay librota, chaypim riqsisqa Cornaroqa frugal dietanta yuyaychakun, unay, kusisqa hinaspa allin kawsaypaq receta hina.
Pocos libros han sido leído con tanto afán; todavía ahóra se imprimen en Inglaterra todos los años muchos miles de ejemplares.	 Pisilla librokunan chhayna munakuywan leesqa kanku; kunankamapas sapa watanmi Inglaterra nacionpi askha waranqa waranqa copiakuna imprimikun.
Dudo de que libro alguno (excepción hecha de la Biblia) haya causado tanto estrago, acortado tantas vidas como este curiosum bien intencionado.	 Iskayrayani ima libropas (Bibliamanta aswanqa) kay allin yuyaywan curiosum hina askha runakunaq kawsayninta pisiyachisqanmanta.
Todo por haber confundido su autor el efecto con la causa.	Tukuy chaykunaqa, qillqaqnin chay efectota imarayku kasqanmanta pantachisqanrayku.
Ese buen italiano consideraba su dieta como la causa de su longevidad; cuando lo que pasaba era que la lentitud extraordinaria del metabolismo, el desgaste reducido, resultaba la causa de su dieta frugal.	 Chay allin italiano runaqa mikhuynintan qhawarirqan unay kawsananpaq; maypachachus imachus pasasqanqa karqan, metabolismoq extraordinario llasaq kaynin, pisiyasqan desgaste, chaymi karqan frugal dieta nisqa ruwasqan.
No estaba en libertad de comer poco o mucho; su frugalidad no era un “libre albedrío”; el hombre enfermaba si comía más.	" Payqa manan librechu karan pisillata otaq askhata mikhunanpaq; frugalidadninqa manan ""libre albedrío""chu karqan; chay runaqa astawan mikhuspaqa unquq."
Mas a todo el que no es un pez de sangre fría no sólo le conviene, sino que le hace falta comer bien.	 Ichaqa llapa mana chiri yawar challwa kaqqa manan necesitasqallantachu necesitan, aswanpas allintan mikhuna.
El erudito de nuestro tiempo, con su rápido desgaste de energía nerviosa, se arruinaría si adoptase el régimen de Cornaro.	 Kay tiemponchispi yachaq runaqa, usqhayllan nervioso kallpanta usuchinman, Cornaroq regimenninta hap’ispaqa waqllipunmanmi.
Crede experto.	 Iñiy yachaq.
La fórmula implícita en toda religión y moral reza “¡Haz esto y aquello, no hagas esto ni aquello; así alcanzarás la felicidad!	 Llapa religionpi, moralidadpipas fórmula implícita nisqa nin “Kayta chayta ruway, ama kayta otaq chayta ruwaychu; chaymi kusikuyman chayanki!
De lo contrario. ” Toda moral, toda religión, es este imperativo, al que yo llamo gran pecado original de la razón, inmortal sinrazón.	" Mana chayqa. ""Llapa moralidad, llapan religion, kay imperativo, chaytan sutichani hatun original hucha razonpa, mana wañuq mana razon""."
En boca mía, esa fórmula se convierte en su inversión, primer ejemplo de mi “transmutación de todos los valores”: el hombre armonioso, el “afortunado”, no puede meteos que cometer determinados actos e instintivamente rehúye otros; introduce el orden que fisiológicamente encarna en sus relaciones con los hombres y las cosas.	"Simiypiqa chay fórmulaqa inversiónninmanmi tukupun, ""transmutación de todos los valores"" nisqaypa ñawpaq kaq ejemplon: armonioso runa, ""suerteyoq"" runaqa manan yanapayta atinchu wakin ruwaykunata ruwayta, instintivamentetaq hukkunata karunchakun; payqa riqsichin ordenta, chaytam fisiológicamente encarna runawan, imakunawanpas rimanakuyninpi."
He aquí la fórmula correspondiente: su virtud es el efecto de su felicidad.	 Kaypin kashan tupaqnin fórmula: virtudninqa kusikuyninpa efectonmi.
La vida larga y la prole numerosa no son el premio de la virtud, sino que la virtud es ese retardo del metabolismo que, entre otras cosas, determina también una vida larga y una prole numerosa, en una palabra, el cornarismo.	 Unay kawsaypas, achka miraykunapas manam allin kaypa premionchu, aswanqa allin kaymi chay metabolismopa tardaynin, chaymi, hukkunamantapas, unay kawsayta, achka miraykunatapas, huk rimayllapi, cornarismo nisqatapas kamachin.
La Iglesia y la moral dicen: “el vicio y el lujo arruinan a los linajes y a los pueblos”.	" Iglesiapas, moralidadpas ninku: ""viciowan lujowanqa lineamientokunata, llaqtakunata ima thuñichin""."
Mi razón restaurada dice: “cuando un pueblo se arruina, cae en la degeneración fisiológica y se originan el vicio y el lujo (esto es, la necesidad de estímulos cada vez más fuertes y más frecuentes, como la conoce todo ser agotado).	 Restaurasqa razonniymi nin: “huk llaqta waqllichisqa kaqtinqa, degeneración fisiológica nisqamanmi urmapun, viciopas lujopas paqarimun (chayqa, aswan kallpasapa, aswan sapa kuti estímulos nisqakuna necesitakun, sapa sayk’usqa runaq yachasqan hina).
El joven se debilita prematuramente.	Chay waynaqa manaraq tiemponpi pisi kallpayapun.
Sus amigos afirman que la culpa la tiene tal enfermedad.	 Amistadninkunam ninku chay unquyqa huchayoq kasqanmanta.
Yo afirmo que el hecho de que ese joven haya enfermado, no haya resistido a la enfermedad, es la consecuencia de una vida empobrecida, de un agotamiento congénito.	 Afirmani kay wayna unqusqan, mana unquyta hark’akusqan, wakcha kawsaypa consecuencian, agotamiento congénito nisqamanta.
El lector de diarios dice que tal partido labra su propia ruina por tal error.	 Periódico leeq runan nin, chhayna partidoqa chhayna pantasqanwanmi kikinpa thuñikuyninta ruwan.
Mi política superior, en cambio, dice que un partido que comete tal error está arruinado; que ha perdido la seguridad de sus instintos.	 Política superiorniymi ichaqa nin, chhayna pantaq partidoqa waqllipunmi; instintonpa seguridadninta chinkachisqanmanta.
Todo error, en todo sentido, es la consecuencia de degeneración de los instintos, de disgregación de la voluntad; lo malo queda así indefinido.	 Sapa pantaymi, tukuy imapi, instintokunaq degeneracionninpa, munaypa ch’usaqyayninpa consecuencianmi; mana allinqa chhaynapin mana tukukuq.
Todo lo bueno es instinto y, por ende, fácil, necesario, libre.	 Tukuy allinqa instinto, chayraykutaq, facil, necesario, libre.
El esfuerzo es una objeción, el dios es típicamente distinto del héroe (dicho en mi propio lenguaje: los pies alados son el atributo primordial de la divinidad).	 Chay kallpachakuyqa huk hark’akuymi, diosqa típicamente hukniraymi heroemanta (kikiypa rimayniypi nisqa: raprayuq chakikunaqa divinidadpa atributon primordialmi).
Error de una falsa causalidad. - En todos los tiempos se ha creído saber qué cosa es una causa; pero ¿de dónde derivábamos nuestro saber, más exactamente, nuestra creencia de que sabíamos?	Pantasqa huk llulla causalidad nisqamanta. - Tukuy pachakunapim iñikun ima causa kasqanmanta yachanapaq; ichaqa, ¿maymantataq yachayninchikta hurqurqanchik, utaq aswan allinta rimaspaqa, yachasqanchikpi iñiyninchikta?
Del reino de los famosos “hechos interiores”, ninguno de los cuales ha sido aún corroborado.	" Riqsisqa ""ukhupi chiqap kaqkunapa"" suyunmanta, manaraqmi mayqinpas chiqapchasqachu."
Nos atribuíamos en el acto volitivo un carácter causal; creíamos sorprender por lo menos in flagranti la causalidad.	 Noqayku kikiykumanmi atribuikurqayku huk carácter causal nisqa acto volicional nisqapi; piensarqayku causalidadta puka makillatapas hap’isqaykumanta.
Asimismo, no se dudaba de que todos los antecedentes de un acto, sus causas, habían de buscarse en la conciencia y que en ésta se lo sencontraba si en ella se los buscaba, como “motivos”; o si no, se habría estado en libertad de cometerlo, no se habría sido responsable por él.	" Chaynallataqmi mana iskayrayarqachu, huk ruwaypa llapa ñawpaq kaqninkunata, imarayku kasqanmanta, concienciapi maskana kasqanmanta, chaypi maskasqa kaptinqa chaypi tarikusqanmanta, ""motivos"" hina; otaq mana chayqa, libren kanman karqan chayta ruwananpaq, manan chaymantaqa responsablechu kanman karqan."
Por último, ¿quién iba a negar que el pensamiento fuera el efecto de una causa?	 Tukuchanapaq, ¿pitaq neganman chay yuyayqa huk causapa efecton kasqanmanta?
¿Que el yo causara el pensamiento. ?	 Chay the I causado el pensamiento. ?
De estos tres “hechos interiores”, que parecían garantizar la causalidad, el primordial y más convincente es el de la voluntad como causa; la concepción de una conciencia (“espíritu' como causa v, más tarde, la del yo (“sujeto”) como causa son tan sólo concepciones derivadas, una vez que se consideraba dada, como empiria, la causalidad de la voluntad.  Desde entonces hemos meditado en forma más honda y penetrante.	"Kay kimsa ""hechos interiores"" nisqamanta, causalidadta garantizaq hina, primordial hinaspa aswan convenceqmi, munay causa hina; huk concienciamanta (“espíritu” causa hina hamut’ayqa, qhepamantaq, kikinmanta (“sujeto”) causa hina yuyaykuyqa, derivado nisqa yuyaykuyllan, huk kutinmi munaypa causalidad nisqa qosqa qhawarisqa karqan, empírico hina. Chaymantapachan aswanta yuyaymanarqayku ukhumanta, ukhuman yaykuyta ima."
Ya no creemos una palabra de todo esto.	 Manañan tukuy kaykunamanta huk simitapas creeykuchu.
El “mundo interior” está plagado de espejismos y fuegos fatuos; uno de ellos es la voluntad.	" ""Ukhu pacha"" hunt'a espejokunawan, munay-o'-the-wispswan ima; hukninmi munay."
Ésta ya no acciona nada y, por ende, ya no explica nada; no es más que un fenómeno concomitante que puede faltar.	 Manañam imatapas activanchu, chaymi manaña imatapas sut’inchanñachu; manan imapaschu aswanpas huk fenómeno concomitante nisqallan, chaymi faltanman.
Otro error es el llamado “motivo”, que es un mero fenómeno accidental de la conciencia, un corolario del acto que no tanto representa sus antecedentes como los oculta.	" Huk pantaytaqmi ""motivo"" nisqa, chaymi concienciapa accidental fenómenollan, chay ruwaypa corolario nisqa, chaymi mana anchatachu representan antecedentes nisqakunata, aswanpas pakan."
iY no se diga el yo!	 Hinaspa ama niychu chay I!
Éste se ha convertido en fábula, ficción, juego de palabras; ¡ha cesado por completo de pensar, de sentir y de querer!	Kayqa willakuymanmi tukupun, cuentoman, simikunamanta pukllayman; ¡payqa manañan yuyaykuyta, sienteyta, munayta imañachu!
.  ¿Qué se deduce 'de esto?	 . ¿Imataq kaymanta lluqsimun?
¡No hay causas mentales!	 ¡Manan kanchu yuyaypi causakuna!
¡Toda la presunta empiria al respecto se ha reducido a la nada!	 ¡Tukuy chaymanta presunto empírico nisqakunam pisiyachisqaña kachkan!
¡He aquí lo que se sigue de esto!	 ¡Kaypim kaymanta lluqsimun!
Y, sin embargo, habíamos abusado a más no poder de esta “empiria”; en base a ella habíamos construido el mundo como un mundo de causas, de voliciones, de espíritus.	" Hinaspa, chaywanpas, kay ""empírico"" nisqamanta aswanta abusarqayku; chaypi sayarispan kay pachata hatarichirqayku huk pacha hina causakuna, munayninku, espiritukuna hina."
Trabajaba en esto la más antigua y más larga sicología, que en definitiva no hacía otra cosa; para ella, todo acaecer era un hacer y todo hacer la consecuencia de una volición.	 Aswan ñawpaq, aswan unay psicología nisqa kaypi llamk’achkasqa, qhipaman mana imatapas ruwarqachu; paypaqqa sapa sucedesqanqa ruwaymi karqan, sapa ruwaytaqmi munayninpa consecuencian karqan.
El mundo se le aparecía como una multitud de agentes y todo acaecer como determinado por un agente (un “sujeto”).	 Kay pachaqa paymanmi rikhurimurqan askha agentekuna hina hinallataq tukuy imapas pasasqanpas huk agentepa (huk “sujeto”) determinasqanman hina.
El hombre ha proyectado fuera de sí sus tres “hechos interiores”, aquello en que más firmemente creía: la voluntad, el espíritu y el yo; desarrolló del concepto “yo” el concepto “Ser” y concibió las “cosas” a su imagen como algo que “es”, de acuerdo con su concepto del yo como causa.	"Runaqa hawamanmi proyectasqa kinsa “hechos interiores” nisqakunata, chaypin aswan allinta iñirqan: munayta, espirituta, kikintapas; payqa ""ñuqa"" hamut'aymanta ""Kaymanta"" hamut'ayta wiñachirqan, rikch'ayninpi ""imakunatapas"" imapas ""kasqa"" hina yuyaykurqan, kikinmanta causa hina hamut'asqanman hina."
No es de extrañar, así, que luego haya vuelto a encontrar en las cosas lo que en ellas había introducido.	 Chayrayku, mana admirakunapaqchu, qhipaman imakunapichus yaykuchisqanmanta wakmanta tarisqanqa.
La cosa, el concepto “cosa”, lo repito, no es sino un reflejo de la creencia en el yo como causa.  Y aun en su átomo, señores mecanicistas y físicos, i cuánto error, cuánta sicología rudimentaria subsiste aún en su átomo!	" Chay imapas, ""imapas"" nisqa hamutay, yapamanta nini, manan imapaschu aswanpas kikinpi iñiypa rikuchiyninmi, huk causa hina. Hinaspa átomoykipipas, mecanistakunapi, físicokunapipas, ¡mayna pantay, hayka psicología rudimentaria nisqataq átomoykipi kawsachkanraq!"
¡Y no se diga la “cosa en sí”, el horrendem pudendum de los metafísicos!	" Hinaspa ama rimaychu ""imapas kikinpi"" nisqamanta, metafísicos nisqakunaq horrendem pudendum nisqamanta!"
¡El error del espíritu como causa confundido con la realidad!	 ¡Espirituq pantasqan huk causa hina confundisqa cheqaq kaqwan!
¡Y erigido en criterio de la realidad!	 Hinaspa sayarichisqa criterio de realidad hina!
¡Y llamado Dios!	 Hinaspa Diosta waqyarqan!
Error de las causas imaginarias. - Hay que partir del sueno: a una determinada sensación, por ejemplo a raíz de un cañonazo lejano, y ver que se le inventa a posteriori una causa (con frecuencia toda una pequeña novela donde el soñador es el protagonista).	Imaginaria causas nisqamanta pantay. - Musquymanta qallarinayki tiyan: huk sensacionta, ejemplopaq karu cañonpa disparasqanpa rurun hina, hinaspa qawanayki huk causa inventasqa kasqanmanta a posteriori (sapa kutim huk entero uchuy novela maypichus musquq runa protagonista).
Entre tanto, la sensación subsiste, en una especie de resonancia, esperando en cierto modo a que el impulso causal le permita pasar a primer plano, más como fenómeno contingente que como “sentido”.	" Chaykamataq, chay sensaciónqa kawsan, huk laya resonanciapi, suyaspa huk cierta hina impulso causal nisqa ñawpaqman hamunanta saqinanpaq, aswanta huk fenómeno contingente hina, manan ""sentido"" hinachu."
El cañonazo aparece en forma causal, en una aparente inversión del tiempo.	 Chay cañonpa disparasqanqa causal hinam rikurin, tiempopa tikrakuyninman hina.
Lo posterior, la motivación, es experimentado primero, muchas veces con cien detalles que van desfilando de una manera fulminante; el cañonazo sigue.  ¿Qué ha pasado?	 Qhepa kaq, kallpachay, ñawpaqta experimentakun, askha kutita pachak detallekunawan, chaykunan qonqayllamanta desfilashan; chay cañonadaqa hinallam kachkan. Imataq karun?
Las representaciones mentales originadas por una determinada sensación han sido entendidas equivocadamente como causa de la misma.	 Huk sensacionpa paqarimusqan yuyaypi representacionkunaqa pantasqa entiendesqam kachkan chaypa causan kasqanmanta.
Lo cierto es que en el estado de vigilia procedemos igual.	 Chiqapqa rikchariypiqa kaqllatam purinchik.
La mayor parte de nuestras sensaciones generales - toda clase de inhibición, presión, tensión y explosión en el juego y contrajuego de los órganos, en particular el estado del nervus sympathicus - excitan nuestro impulso causal: buscamos un motivo para sentirnos tal como nos sentimos, para sentirnos mal o bien.	Yaqa llapan sensaciones generalesniyku - tukuy laya inhibición, presión, tension chaymanta explosión pukllaypi chaymanta contrajuego kaqpi órganos kaqpi, en particular estado nervio simpático kaqpi - impulso causal impulsonchikta: maskanchik huk razonta imayna ruwasqanchikta sientenapaq , mana allin otaq allin sientekuy.
Nunca nos contentamos con comprobar simplemente el hecho de que nos sentimos tal como nos sentimos; sólo admitimos este hecho, llegamos a tener conciencia de él, si le hemos dado una especie de motivación.	 Manan hayk’aqpas contentakunchischu imayna sientekusqanchista cheqaqchaspalla; kay chiqaptaqa riqsikunchik, chaymantaqa musyakunchik, sichus ima kallpanchakuytapas qurqanchik chayqa.
El recuerdo, que en tal caso entra en actividad a pesar nuestro, evoca estados anteriores de la misma índole y las interpretaciones causales a ellos ligadas; no su causalidad.	 Yuyariyqa, chayna kaptinqa ñuqanchikwanpas ruwayman yaykuspanmi, ñawpaq kaq estadokunata, chaykunawan tinkisqa interpretacion causalkunatapas evocan; manataqmi causacionninmantachu.
Por cierto que el recuerdo evoca también la creencia de que las representaciones mentales, los fenómenos concomitantes registrados en la esfera de la conciencia, han sido las causas.	 Chiqamanta yuyariyqa, yuyaypi rikuchiykuna, concomitante fenómenos registrados esfera de conciencia nisqapi, chaykuna kasqankumanta iñiyta rikhurichillantaq.
Tiene lugar así la habituación a una determinada interpretación causal, que en realidad dificulta, y aun impide, la indagación de la causa.	Chayhinam, habituación huk cierta interpretación causal nisqaman ruwakun, chaymi chiqaptaqa sasachan, hinaspapas harkanraqmi, chay causamanta investigacionta.
Explicación sicológica de lo antedicho. - Reducir algo desconocido a algo conocido alivia, reconforta, satisface y proporciona una sensación de poder.	 Kay patamanta psicológica sut’inchaynin. - Mana riqsisqa imatapas riqsisqaman pisiyachiyqa thasnuchin, sunquchachin, kusichin, atiyniyuq kayta qun.
Lo desconocido involucra peligro, inquietud y zozobra; aplícase el instinto primordialmente a eliminar estos estados penosos.	 Mana riqsisqaqa peligro, mana samay hinaspa llakikuymi; chay instinto nisqataqa ñawpaqtaqa kay nanay estadokunata chinkachinapaqmi churakun.
Primer principio: cualquier explicación es preferible a ninguna explicación.	 Ñawpaq kaq kamachikuy: ima sut’inchaypas aswan allinmi mana sut’inchanamantaqa.
Como en definitiva se trata tan sólo de un afán de librarse de representaciones penosas, se echa mano de cualquier medio que se ofrece con tal de quitárselas de encima, sin discriminar mayormente; cualquier representación mental en virtud de la cual lo desconocido se dé por conocido resulta tan reconfortante que se la “cree cierta”.	 Imaraykuchus qhipaman nanay rikuchiykunamanta t’aqakuyta munaylla kachkan, chayraykutaq ima ruway qusqamanpas recurrinku chaykunata chinkachinankupaq, mana anchata sapaqchaspa; ima yuyaypi rikuchiypas mana reqsisqa kaqta mana allinpaq qhawarisqa kaqtinqa, ancha sonqochakuqmi, chaymi “cheqaq kasqanpi iñikun”.
Es la prueba del placer (“de la fuerza”) como criterio de la verdad.	" Chayqa kusikuypa pruebanmi (""fuerzamanta"") chiqappa criterion hina."
El impulso causal está, pues, determinado y excitado por el temor.	Chayhinam chay causal impulso nisqa manchakuywan determinasqa hinaspa kusichisqa.
El “¿por qué?” debe dar en lo posible no la causa por la causa misma, sino determinado tipo de causa: una causa que tranquilice, redima, alivie.	" ¿Imaraykutaq?"" atisqanman hinaqa manan kikin causaraykuchu causata qonan, aswanpas huk clase causatan qonan: huk causa, chaymi thasnuchin, kacharichin, pisiyachin."
El que algo ya conocido, experimentado, grabado en la memoria, sea establecido como causa es la primera consecuencia de esta necesidad íntimamente sentida.	 Imapas riqsisqaña, experimentasqa, yuyariypi qillqasqa, causa hina takyachisqa kasqanmi, kay necesidad íntimamente sientesqapa punta kaq consecuencian.
Lo nuevo, no experimentado, extraño, queda excluido como causa.	 Musuq, mana experienciayuq, mana riqsisqa, huk causa hina qarqusqa.
De modo que se busca como causa no un tipo de explicaciones, sino un tipo escogido y preferido de explicaciones, aquel que con más rapidez y frecuencia haya eliminado la sensación de lo extraño, nuevo, jamás experimentado las explicaciones más corrientes.	 Chaynapim causataqa maskanku mana huk laya sut’inchaykunaraykuchu, aswanqa akllasqa hinaspa aswan munasqa sut’inchaykunarayku, chaymi aswan utqaylla hinaspa sapa kutilla chinkachirqa chay mana riqsisqa, musuq, mana haykapipas aswan riqsisqa sut’inchaykunawan rikusqapa sensacionta.
