español	quechua
El silogismo obliga a partir de una proposición establecida, de la cual no sabemos nunca si podremos concluir la que queremos demostrar, a menos de conocer de antemano la verdad que necesita demostración.	 Silogismoqa huk takyasqa proposicionmantan mañakun, chaymantaqa manan hayk’aqpas yachanchischu sichus rikuchiyta munasqanchistaqa tukusunmanchu icha manachus chayta, manachus ñawpaqmantaraq yachasunmanchu chay cheqaq kaqta, chaytan necesitanchis rikuchiyta.
Pero, si ya de antemano sabemos la conclusión, entonces se ve bien claro que el silogismo sirve más para exponer o defender verdades, que para hallarlas.	 Ichaqa, sichus ñawpaqtaraq yachanchisña tukukuyta chayqa, sut’inmi silogismoqa aswanta servin cheqaq kaqkunata sut’inchananpaq otaq defiendenanpaq, manan tarinanpaqchu.
El análisis es, pues, el primer momento del método.	 Hinaptinqa, anlisismi chay métodopa punta kaq momenton.
Dada una dificultad, planteado un problema, es preciso ante todo considerarlo en bloque y dividirlo en tantas partes como se pueda (segunda regla del método.	Sasachakuy qusqa, sasachakuy churasqa kaptinqa, ñawpaqtaqa bloque hinam qawana, hinaspa achka partekunapi rakina (iskay kaq kamachikuy métodomanta.
Discurso).	 Rimay).
Pero ¿en cuantas partes dividirlo?	 Ichaqa, ¿hayka partekunamantaq rakina?
¿Hasta dónde ha de llegar el fraccionamiento de la dificultad?	 ¿Haykakamataq chay sasachakuypa fraccionamienton rina?
¿Dónde deberá detenerse la división?	 ¿Maypitaq chay rakinakuy sayanan?
La división deberá detenerse cuando nos hallemos en presencia de elementos del problema, que puedan ser conocidos inmediatamente como verdaderos y de cuya verdad no pueda caber duda alguna.	 Rakinakuyqa sayarinanmi sasachakuypa elementonkunapa qayllanpi tarikuptinchik, chaykunataqa chayllam riqsichwan chiqap kasqanmanta, chiqap kasqanmantaqa manam iskayrayanachu.
Los tales elementos simples son las ideas claras y distintas.	 Chayna sasa elementokunaqa sutilla hinaspa sapaq yuyaykunam.
(Final de la primera regla; véase Discurso del Método).	 (Ñawpaq kaq kamachiypa tukukuynin; qhaway Método Discurso).
Al llegar aquí es imposible seguir exponiendo el método de Descartes, sin indicar algunos principios de su teoría del conocimiento y su metafísica.	 Kayman chayaspaqa manan atikunmanchu Descartespa ruwayninta sut’inchaspallapuni puriyta, mana yachaymanta teoría nisqamanta, metafísica nisqamanta wakin kamachikuykunata rikuchispaqa.
En la primera regla del Discurso están resumidas, más aún, comprimidas algunas de las más esenciales teorías de la filosofía cartesiana.	 Discurso nisqap ñawpaq kamachiyninpiqa wakin aswan chaniyuq teorías de filosofía cartesiana nisqakunam pisillapi churasqa kachkan, chiqapmi, ñit'isqa.
Las enumeraremos brevemente.	 Chaykunataqa pisillapim listasunchik.
En primer lugar, la regla propone la evidencia, como criterio de la verdad.	Ñawpaqtaqa, kamachikuymi pruebakunata propone, criterio de verdad hina.
Lo verdadero es lo evidente y lo evidente es a su vez definido por dos notas esenciales: la claridad y la distinción.	 Chiqapqa sut’i kaqmi, sut’i kaqtaq kutinpi iskay nota esencialkunawan sut’inchakun: sut’i kaywan, t’aqakuywan.
Clara es una idea cuando está separada y conocida separadamente de las demás ideas.	 Claraqa huk yuyaymi huk yuyaykunamanta t’aqasqa, sapaqchasqa kaqtin.
Distinta es una idea cuando sus partes o componentes son separados unos de otros y conocidos con interior claridad.	 Hukniraq nisqaqa huk yuyaymi, rakinkuna icha k'itikuna t'aqasqa kaptin, ukhu sut'iwan riqsisqa kaptin.
Nótese, pues, que la verdad o falsedad de una idea no consiste, para Descartes, como para los escolásticos, en la adecuación o conformidad con la cosa.	 Hinaptinqa, reparay, huk yuyaypa chiqap utaq llulla kayninqa manam Descartespaqqa, escolastickunapaq hinachu, chay kaqwan allin kayninpi utaq tupayninpichu kachkan.
En efecto, las cosas existentes no nos son dadas en sí mismas, sino como ideas o representaciones a las cuales suponemos que corresponden realidades fuera del yo.	 Chiqapmi, kaqkunataqa manam kikinchikpichu quwanchik, aswanqa yuyay hina utaq representacion hina, chaykunamanmi suyanchik hawa kikinmanta chiqap kaqkuna tupasqanmanta.
Pero el material del conocimiento no es nunca otro que ideas  - de diferentes clases - , y, por tanto, el criterio de la verdad de las ideas no puede ser extrínseco, sino que debe ser interior a las ideas mismas.	 Ichaqa yachaypa materialninqa manan hayk’aqpas hukchu yuyaykunamanta -huk layamanta- chaymi, chayraykun yuyaykunaq cheqaq kayninpa criterionqa manan hawamantachu kanman, aswanpas kikin yuyaykuna ukhupin kanan.
La filosofía moderna debuta, con Descartes, en idealismo.	Kunan pacha yachay yachayqa qallarikun, Descarteswan, idealismo nisqapi.
Incluye el mundo en el sujeto; transforma las cosas en ideas, tanto que un problema fundamental de la filosofía cartesiana será el de salir del yo y dar el paso de las ideas a las cosas.	 Chayqa kay pachatan chay temapi churan; imakunatapas yuyaykunamanmi tikran, chaymi cartesiano filosofía nisqapa huk fundamental sasachakuyninqa kanqa kikinmanta lluqsispa yuyaykunamanta imakunaman tikrayta ruway.
(Véasela sexta meditación metafísica.)	 (Qaway soqta kaq metafísica yuyaymanayta).
En las Regulæ ad directionem ingenii, llama a las ideas claras y distintas, naturalezas simples (nature simplices).	 Regulæ ad directionem ingenii nisqapiqa sut’i, sapaq yuyaykunatan sutichan naturalezas simples (naturaleza simplices) nispa.
El acto del espíritu que aprehende y conoce las naturalezas simples es la intuición o conocimiento inmediato, o, como dice también en las Meditaciones (meditación segunda), una inspección del espíritu.	 Sasa naturalezakunata hap’iq, yachaq espirituq ruwayninqa, intuición otaq chaylla yachaymi, otaq, Meditacionkunapipas nisqanman hina (iskay kaq yuyaymanay), espirituta qhawaymi.
Esta operación de conocer lo evidente o intuir la naturaleza simple, es la primera y fundamental del conocimiento.	 Kay llamk’ayqa sut’i kaqta riqsispa utaq intuición naturalezata, yachaypa ñawpaq kaq, fundamentalnin ima.
Los procedimientos del método comenzarán pues por proponerse llegar a esta intuición de lo simple, de lo claro y distinto.	 Chayraykum qallarinqa chay métodopa ruwayninkunaqa kay intuición nisqaman chayanapaq proponespa, chaymi chay simple, de los claro y distinto.
Las dos primeras reglas están destinadas a ello.	 Ñawpaq iskay kamachikuykunaqa chaypaqmi ruwasqa kachkan.
Las dos segundas se refieren en cambio a la concatenación o enlace de las intuiciones, a lo que, en las Regulæ, llama Descartes deducción.	Iskay kaq iskaytaqmi aswanqa riman intuicionkunapa concatenación utaq vinculación nisqamanta, chaytam, Reulæ nisqapi, Descartespa deducción nispa sutichan.
Es la deducción, para Descartes, una enumeración o sucesión de intuiciones, por medio de la cual, vamos pasando de una a otra verdad evidente, hasta llegar a la que queremos demostrar.	 Chayqa deducciónmi, Descartespaqqa, huk enumeración otaq sucesión de intuiciones, chaywanmi huk sut’i cheqaq kaqmanta huk cheqaq kaqman rinchis, rikuchiyta munasqanchisman chayananchiskama.
Aquí tiene aplicación el complemento y como definitiva forma del análisis.	 Kaypiqa complementoqa aplicación nisqayuqmi hinaspapas forma definitiva de análisis hina.
El análisis deshizo la compleja dificultad en elementos o naturalezas simples.	 Chay anlisismi chay compleja dificultad nisqataqa elementos simples nisqaman utaq naturalezas nisqaman rakirqa.
Ahora, recorriendo estos elementos y su composición, volvemos, de evidencia en evidencia, a la dificultad primera en toda su complejidad; pero ahora volvemos conociendo, es decir, intuyendo una por una las ideas claras, garantía última de la verdad del todo.	 Kunanqa, kay elementokunata, composiciónnintapas pasaspa, kutiyku, pruebamanta pruebaman, ñawpaq sasachakuyman tukuy complejidadninpi; ichaqa kunan kutimunchis yachaspa, chaymi sut’i yuyaykunata hukmanta hukmanta intuispa, llapanpa cheqaq kayninpa tukukuy garantianta.
«Conocer es aprehender por intuición infalible las naturalezas simples y las relaciones entre ellas, que son, a su vez, naturalezas simples».	 «Yachayqa mana pantaq intuicionwan hap’iymi chay naturalezas simples nisqakunata, chaykuna ukhupi relaciones nisqakunatapas, chaykunan kanku, a su vez, naturalezas simples».
La Metafísica	 metafísica nisqamanta yachay
La noción del método, la teoría del conocimiento y la metafísica se hallan íntimamente enlazadas y como fundidas en la filosofía de Descartes.	Método nisqa yuyay, yachaymanta teoría, metafísica nisqakunaqa allintan t’inkisqa kashanku, Descartespa filosofía nisqawanpas hukllachasqa hina.
El cartesiano Espinosa pudo conseguir exponer la filosofía de Descartes en una serie geométrica de axiomas, definiciones y teoremas (Renati Descartes Principiorum philosophiæ pars.	 Cartesiano Espinosaqa Descartespa yuyayninta sut'inchayta atirqan, huk geométrica serie axiomas, definiciones, teoremas (Renati Descartes Principorum philosophiæ pars).
I et II, more geometrico demonstratæ.)	 I et II, aswan geometrico demonstratæ.)
El punto de partida es la duda metódica.	 Qallariypiqa iskayrayaymi metódico nisqa.
La duda cartesiana no es escepticismo, sino un procedimiento dialéctico de investigación, encaminado a desprender y aislar la primera verdad evidente, la primera idea clara y distinta, la primera naturaleza simple.	 Cartesiano iskayrayayqa manan iskayrayaychu, aswanpas investigación dialéctica nisqa ruwaymi, ñawpaq kaq sut’i cheqaq kaqta, ñawpaq sut’i, sapaq yuyayta, ñawpaq kaq sasan naturalezata t’aqayta, t’aqayta ima.
La duda, en suma, es la aplicación al problema del conocimiento del método del análisis, que hemos descrito.	Iskayrayay, pisi rimayllapi, chay aplicacionmi chay método de análisis nisqamanta yachay sasachakuyman, chaytam willakurqanchik.
El residuo de ese análisis es la verdad fundamental que sirve de base a todas las demás: «Yo soy una cosa o sustancia pensante.»	" Chay anlisispa puchuqninqa chiqap kaq fundamentalmi, chaymi llapa wakinkunapa sapin hina: ""Ñuqaqa yuyaymanaqmi utaq sustanciam kani""."
Entre las dificultades que plantea la duda metódica, nos detendremos en una tan sólo, en la famosa hipótesis del genio o espíritu maligno (Meditaciones).	 Chay iskayrayay metódico nisqapa sasachakuyninkunamantaqa hukllapim yachasun, chaymi riqsisqa hipótesis genio utaq millay espiritumanta (Meditaciones).
Después de haber examinado las diferentes razones para dudar de todo, quedan todavía en pie las verdades matemáticas, tan simples, claras y evidentes, que parece que la duda no puede hacer mella en ellas.	 Tukuy imamanta iskayrayanapaq imaymana razonkunata qhawarisqa qhepamanpas, matemáticas nisqapi cheqaq kaqkunaqa sayashanraqmi, ancha facil, sut’i, sut’i rikukuq, chaymi iskayrayayqa mana chaykunapi huk dent ruwayta atinmanchu hina.
Pero Descartes también las rechaza fundándose en la consideración de que acaso maneje el mundo un Dios omnipotente, pero lleno de tal malignidad y astucia, que se complace en engañarme y burlarme a cada paso, aun en las cosas que más evidentes me parecen.	 Ichaqa Descartesqataqmi chaykunata wikch’upun, ichapas tukuy atiyniyoq Dios kay pachata kamachin, ichaqa hunt’a millay kaywan, q’otuywan ima, chaymi sapa llank’aypi q’otuwaspa, burlakuwaspa ima, aswan sut’i rikukuq hina kaqkunapipas, kusikun.
En realidad, la hipótesis del genio maligno ni es un juego ni un círculo de hierro, sino un movimiento dialéctico, muy importante en el curso del pensamiento cartesiano.	 Chiqaptaqa, millay genio hipótesisqa manam pukllaychu nitaq fierro muyuchu, aswanqa dialéctico kuyuymi, ancha chaniyuq cartesiano yuyaypa puriyninpi.
Repárese en que la hipótesis del genio maligno, necesita, para ser destruida, la demostración de la existencia de Dios.	 Reparay, millay genio hipótesis necesitan, chinkachisqa kananpaq, Diospa kayninta rikuchiyta.
Sólo cuando sabemos que Dios existe y que Dios es incapaz de engañarnos, sólo entonces queda deshecha la última y poderosa razón que Descartes adelanta para justificar la duda.	 Dios kasqanmanta yachaspallanchis, Diospas mana engañayta atiwasqanchista, chayraqmi qhepa kaq atiyniyoq razon Descartespa ñawpaqman puririsqan iskayrayayta chaninchananpaq.
¿Qué significa esto?	 ¿Ima ninantaq kayqa?
Significa el planteamiento y solución de un grave problema lógico, que luego ocupará hondamente a Kant: el problema de la racionalidad o cognoscibilidad de lo real.	Niyta munan, huk hatun lógico sasachakuypa asuykuyninta, allichaynintapas, chaymi qhipaman Kant-ta ukhumanta hap'inqa: racionalidadpa sasachakuynin utaq chiqap kaqpa yachayninpa sasachakuynin.
El genio maligno y sus artes de engaño simbolizan la duda profunda de si en general la ciencia es posible.	 Millay geniopas, engañaq artenkunapas, ciencia llapanpi atikunmanchu icha manachu chaymanta sinchi iskayrayaytan rikuchin.
¿Es lo real cognoscible, racional?	 ¿Cheqaq kaqchu yachay atiy, racional?
¿No será acaso el universo algo totalmente inaprensible por la razón humana, algo esencialmente absurdo, irracional, incognoscible?	 ¿Manachu universoqa runaq razonninwan mana entiendey atina imapas, esencialmente mana yuyayniyoq, mana yuyayniyoq, mana yachay atina?
Esta interrogación es la que Descartes se hace bajo el ropaje dialéctico de la hipótesis del genio maligno.	 Kay tapukuyqa Descartespa tapukunmi, millay genio hipótesis nisqapa dialéctico nisqawan.
Y las demostraciones de la existencia y veracidad de Dios no hacen sino contestar, afirmando la racionalidad del conocimiento, la posibilidad del conocimiento, la confianza postrera que hemos de tener en nuestra razón y en la capacidad de los objetos para ser aprehendidos por ella.	 Hinaspapas Diospa kayninmanta, cheqaq kayninmanta rikuchiykunaqa manan imatapas ruwankuchu, aswanpas kutichinku, yachaypa racionalidadninta, yachay atikuyninta, qhepa kaq confianzata, chaytan hap’inanchis razonninchispi, chaywan hap’isqa kanapaq objetokunaq atiyninpipas.
La base primera de la filosofía cartesiana es el cogito ergo sum: pienso, luego soy.	 Cartesiano filosofía nisqap ñawpaq kaq saphinqa cogito ergo suma nisqa: Yuyaykuni, chayraykum kani.
Dos observaciones sobre este primer eslabón de la cadena.	Iskay qhawariykuna kay ñawpaq t’inkimanta cadena nisqapi.
Primera: no es el cogito un razonamiento, sino una intuición, la intuición del yo como primera realidad y como realidad pensante.	 Ñawpaq kaq: cogitoqa manan razonamientochu, aswanpas intuicionmi, kikinpa intuicionninmi primera realidad hina hinallataq yuyay realidad hina.
El yo es la naturaleza simple que, antes que ninguna, se presenta a mi conocimiento; y el acto por el cual el espíritu conoce las naturalezas simples es, como ya hemos dicho, una intuición.	 Ñuqaqa, mana imamanta ñawpaqtaraq, yachayniyman rikuchikuq, sasan naturaleza; hinaspapas espirituq sasan naturalezakunata reqsisqan ruwayqa, nisqanchis hina, intuición nisqallan.
Se yerra, pues, cuando se considera el cogito como un silogismo, v.	 Hinaptinqa, hukqa pantanmi, cogito nisqa simita silogismo hina qhawarispan, v.
gr., el siguiente: todo lo que piensa existe; yo pienso, luego yo existo.	 gr., kay qatiq: tukuy ima yuyaqqa kan; Yuyaykuni, chayraykun kashani.
Segunda: al poner Descartes el fundamento de su filosofía en el yo, acude a dar satisfacción a la esencial tendencia del nuevo sentido filosófico que se manifiesta con el Renacimiento.	 Iskay kaq: Descartesqa filosofíanpa teqsinta kikinpi churaptinqa, Renacimientowan rikuriq musuq sentido filosófico nisqapa tendencia esencialninmanmi satisfacción qunanpaq rin.
Trátase de explicar racionalmente el universo, es decir, de explicarlo en función del hombre, en función del yo.	 Chayqa universo nisqamanta racionalmente sut’inchanapaqmi, chaymi runaq rimayninpi, kikinmanta sut’inchanapaq.
Era, pues, preciso empezar definiendo el hombre, el yo, y definiéndolo de suerte que en él se hallaran los elementos bastantes para edificar un sistema del mundo.	Chayraykun qallarina karqan runata, kikinmanta, chayta sut’inchaspa, chaypi suficiente elementokuna tarikunanpaq, kay pachaq sisteman hatarichinapaq.
La filosofía moderna, con Descartes, entra en su fase idealista y racionalista.	 Kunan pacha filosofía, Descarteswan kuska, idealista, racionalista fasenman yaykun.
Los sucesores de nuestro filósofo se ocuparán fundamentalmente en desenvolver estos gérmenes del idealismo; es decir, de definir la razón como el conjunto de principios y axiomas lógicos necesarios y suficientes para dar cuenta de la experiencia.	 Filósofonchispa qatiqninkunaqa ñawpaqtaqa kay idealismo muhukunata wiñachiymantan qhawarinqaku; chaymi, razonta defininapaq, chay conjunto de principios lógicos y axiomas nisqakuna necesario hinaspa suficientekuna experienciamanta cuenta qunapaq.
Habiendo hallado la primera verdad, Descartes se apresura a sacar de ella todo el provecho posible.	 Ñawpaq kaq cheqaq kaqta tarispanmi, Descartesqa usqhaylla chayta allinta aprovechan.
El cogito es, por una parte, la primera existencia o sustancia conocida, la primera naturaleza simple; por otra parte, es también la primera intuición, el primer acto del conocer verdadero.	 Cogito nisqaqa, huk ladumanta, ñawpaq riqsisqa kaynin utaq sustancia, ñawpaq kaq sanu naturaleza; huk ladumantaq, ñawpaq kaq intuición nisqapas, cheqaq yachaypa ñawpaq kaq ruwayninpas.
Del cogito puede, pues, desprenderse el criterio de toda verdad, a saber: toda intuición de naturaleza simple es verdadera, o, en otros términos, toda idea clara y distinta es verdadera.	 Cogitomantan horqokunman llapa cheqaq kaqpa criterion, chaymi: sapa intuición de una naturaleza simple nisqa cheqaqmi, otaq, huk rimaypiqa, sapa sut’i, sapaq yuyayqa cheqaqmi.
Con este escaso bagaje emprende en seguida Descartes el problema sumo de la metafísica, la existencia de Dios.	Kay huch’uy equipajewanmi Descartesqa chaylla metafísica nisqa hatun sasachakuyninta hap’in, Diospa kayninta.
De las tres pruebas que da (dos en la tercera y una en la quinta meditación) nos fijaremos sólo en la tercera, dada en la quinta meditación.	 Kimsa pruebakuna qusqanmantaqa (iskay kimsa kaqpi, huktaq pichqa kaqpi) kimsa kaqpilla rimasunchik, pichqa kaq yuyaymanaypi qusqa.
Es el famosísimo argumento ontológico.	 Chayqa riqsisqa ontológico argumento nisqa.
El esquema de la demostración es el siguiente: la existencia es una perfección; Dios tiene todas las perfecciones; luego Dios tiene la existencia.	 Chay rikuchiypa esquemanqa kaymi: kayninqa hunt’asqa kaymi; Diosqa llapan hunt’asqa kaqkunayoqmi; chayraykun Diosqa kan.
Como se ve, Descartes considera la existencia de Dios tan segura y evidentemente demostrada como la propiedad del triángulo de tener tres ángulos.	 Rikusqanchis hina, Descartesqa Diospa kaynintan qhawarin seguro hinallataq sut’ita rikuchisqa kinsa kuchuq kinsa kuchuyoq kananpaq propiedadnin hina.
Tras él va toda la metafísica del siglo XVII y XVIII, la cual, hipnotizada por la geometría, querrá construirse more geométrico, y se apoyará más o menos encubiertamente en el argumento cartesiano.	 Paypa qhepantan rin chunka qanchisniyoq, chunka pusaqniyoq siglokunapi llapa metafísica nisqakuna, chaykunan geometría nisqawan hipnotizasqa, aswan geométrico nisqa ruwayta munanqa, hinaspan aswan pisi pakallapi cartesiano nisqa argumentoman k’askakunqa.
Así como la existencia del yo ha sido, en el cogito, establecida por una intuición intelectual, también la existencia de Dios queda establecida en el argumento ontológico por medio de una deducción (que para Descartes es una serie de intuiciones intelectuales).	Imaynan kikinpa kaynin, cogito nisqapi, huk yuyaysapa intuición nisqawan takyachisqa karqan, chay hinallataqmi Diospa kayninpas takyachisqa kan ontológico argumento nisqapi huk deducción nisqawan (chayqa Descartespaqqa huk serie intuición intelectualmi).
La metafísica del cartesianismo y filosofías subsiguientes tienden, por modo inevitable, a demostrar las existencias, mediante actos intelectuales subjetivos.	 Cartesiano nisqap metafísica nisqapas, chaymanta qatiq filosofía nisqapas mana hark'asqallam kaqkunata rikuchiyta munanku, subjetivo intelectual ruwaykunawan.
Para conocer una existencia precisará una intuición no intelectual, sino sensible.	 Huk existenciata yachanaykipaqqa necesitankin huk intuición nisqa mana yuyaysapachu, aswanpas sensitiva.
El cogito y el argumento ontológico podrán servir para instituir ideas, pero no cosas existentes.	 Cogitowan ontológico nisqa argumentowanqa yuyaykunata takyachinapaqmi servinman, ichaqa manan kaqkunatachu.
La Física	 Física nisqa yachay
De la existencia de Dios y sus propiedades, deriva ya Descartes fácilmente la realidad de las naturalezas simples en general, y, por tanto, de los objetos matemáticos, espacio, figura, número, duración, movimiento.	 Diospa kayninmanta, propiedadesninmanta ima, Descartesqa facil-llatam hurqun realidad de naturalezas simples en general, hinallataq, chayrayku, objetos matemáticos nisqamanta, espaciomanta, figuramanta, yupaymanta, unayniyuqmanta, kuyuymanta.
La metafísica le conduce sin tropiezo a la física.	 Metafísica nisqa yachayqa sumaqllatam pusasunki fisica nisqaman.
Esta debuta en realidad con la distinción esencial del alma y del cuerpo.	 Kayqa chiqaptam debutkun almapa hinaspa cuerpopa distinción esencial nisqawan.
El alma se define por el pensamiento.	 Almaqa yuyaywanmi sut’inchasqa.
El cuerpo se define por la extensión.	 Kurkuqa mast'arisqawanmi sut'inchasqa.
Y todo lo que en el cuerpo sucede, como cuerpo, puede y debe explicarse con los únicos elementos simples de la extensión, figura y movimiento.	Hinaspapas tukuy ima cuerpopi pasasqan, cuerpo hina, sut’inchakunmanmi, sut’inchakunantaqmi chay elementokunallawan, chaykunan kanku extensión, figura, movimiento nisqakunawan.
Hay, pues, que considerar dos partes en la física cartesiana.	 Chay hinaqa, iskay rakikunam kan cartesiano fisikapi qhawarinapaq.
Una, en donde se trata de los sucesos en los cuerpos (mecánica), y otra, en donde se trata de definir la sustancia misma de los cuerpos (teoría de la materia).	 Huknin, maypichus kurkukunapi sucedesqanmanta riman (mecánica), huknintaq, maypichus kurkukunap kikin sustancianta riqsichiyta munan (teoría de materia).
La física de Descartes es, como todo el mundo sabe, mecanicista; Descartes no quiere más elementos, para explicar los fenómenos y sus relaciones, que la materia y el movimiento.	 Descartespa fisikanqa, llapa runaq yachasqan hina, mecánico nisqa; Descartesqa manan munanchu aswan elementokunata, fenómenos nisqakunata, relaciones nisqakunata sut’inchananpaq, materiamanta, kuyuymantawan.
Todo en el mundo es mecanismo y, en la mecánica misma, todo es geométrico.	 Kay pachapi tukuy imapas mecanismom, kikin mecánica nisqapipas tukuy imapas geométrico nisqa.
Así lo exigía el principio fundamental de las ideas claras, que excluye naturalmente toda consideración más o menos misteriosa de entidades o cualidades.	 Chaytaqa mañakurqanmi sut’i yuyaykuypa fundamental nisqa kamachikuynin, chaymi naturalmente mana ima aswan pisi misterioso qhawariytapas entidadkunata otaq cualidades nisqakunataqa mana churanchu.
La física de Descartes es una mecánica de la cantidad pura.	 Descartespa fisika nisqaqa ch'uya achka kayninpa mekaniku.
La causa del movimiento es doble.	 Chay kuyuypa kausayninqa iskaymi.
Una causa primera que, en general, lo ha creado e introducido en la materia, y esta causa es Dios.	 Huk ñawpaq kaq causa, chaymi, en general, kamarqan, materiamanpas churarqan, kay causataq Dios.
Una vez introducido el movimiento en la materia, Dios no interviene más, si no es para continuar manteniendo la materia en su ser; de aquí resulta que la cantidad de movimiento que existe en el sistema del mundo es invariable y constante.	 Materiaman kuyuy churasqaña kaqtinqa, manañan Diosqa chaymanqa haykunchu, aswanpas materiata kayninpi waqaychaspallapunin; Kaymantam qawarikun, kay pacha sistemapi maykama kuyuy kasqanqa mana tikrakuq, mana tikrakuq kasqanmanta.
Pero de cada movimiento en particular hay una causa particular, que no es sino un caso de las leyes del movimiento.	 Ichaqa sapa movimiento particularpaqmi kan huk causa particular, chayqa manan imapaschu aswanpas huk cason leyes de movimiento nisqamanta.
Estas leyes son tres: la primera, es la ley de inercia, hermoso descubrimiento de Descartes que, aunque no hubiese hecho otros, bastaría para colocarlo entre los fundadores de la ciencia moderna.	 Kay kamachikuykunaqa kimsam: punta kaqmi inercia nisqa kamachikuy, Descartespa sumaq tarisqan, mana hukkunata ruwaptinpas, kunan pacha yachaypa kamaqninkunapa chawpinpi churananpaqmi suficiente kanman.
La segunda, es la de la dirección del movimiento: un cuerpo en movimiento tiende a continuarlo en línea recta, según la tangente o la curva que descubra el móvil.	Iskay kaqtaq kuyuypa chiqan kayninmanta: kuyukuq kurkuqa chiqan chirupi hinalla puriyta munan, kuyuchina tarisqan tangente icha kurva nisqaman hina.
La tercera ley, es la ley del choque, que Descartes especifica en otras leyes especiales.	 Kimsa kaq kamachikuyqa ch’aqway kamachikuymi, chaytam Descartesqa huk especial kamachikuykunapipas sut’inchan.
Todas ellas son falsas.	 Llapallankum llulla.
