español	quechua
La mecánica cartesiana, tan profunda y exacta en sus dos primeros principios, se desvía y falsea en el último, precisamente por el exceso de geometrismo, con que concibe la materia y el movimiento.	 Mecánica cartesiana, ancha ukhu, chiqap iskay ñawpaq kamachiyninkunapi, qhipa kaqpiqa karunchakun, waqllichin ima, chiqap geometrismo nisqap yapakusqanrayku, chaywanmi materiata, kuyuytapas yuyaykun.
Es bien conocida la corrección fundamental que Leibnitz hace a la física de Descartes: no es la cantidad de movimiento lo que se conserva constante en la naturaleza, sino la fuerza viva, la energía.	 Leibnitzpa Descartespa fisica nisqapi fundamental corrección ruwasqanqa allin riqsisqam: manam kuyuypa achkanchu naturalezapi mana chiriyaspa qipan, aswanqa kawsaq kallpam, kallpam.
Pero Descartes, en su afán de no admitir nociones oscuras, considera las nociones de energía o fuerza como incomprensibles, porque no son geométricamente representables, y las desecha para limitarse a concebir en la materia la pura extensión geométrica.	 Ichaqa Descartesqa, mana sut’i yuyaykunata chaskiyta munaspanmi, kallpamanta otaq kallpamanta yuyaykunata mana entiendenapaq hina qhawarin, mana geométricamente representable kasqankurayku, hinaspan wikch’un materiapi ch’uya extensión geométrica nisqa yuyayman limitakunanpaq.
Llegamos, pues, a la segunda parte de la física, a la teoría de la materia.	Hinaptinqa, hamunchikmi física nisqapa iskay kaq rakinman, materiamanta teoría nisqaman.
Aquí domina el mismo espíritu que en la mecánica.	 Kaypiqa mecánica nisqapi hina espiritullan kamachikun.
La materia no es otra cosa que el espacio, la extensión pura, el objeto mismo de la geometría.	 Materiaqa manam hukchu, aswanpas espacio, ch'uya mast'ariy, kikin geometría nisqap imayayninmi.
Las cualidades secundarias que percibimos en los objetos sensibles son intelectualmente inconcebibles, y, por tanto, no pertenecen a la realidad: color, sabor, olor, etc.	 Sensible objetokunapi reparasqanchis secundaria cualidades nisqakunaqa manan yuyaypi yuyaykuy atinachu, chaymi mana cheqaq kaqman pertenecenchu: color, gusto, asnay, hukkunapas.
La materia se reduce a la extensión en longitud, latitud y profundidad, con sus modos, que son las figuras o límites de una extensión por otra.	 Materiaqa longitudpi, latitudpi, ukhunpi mast'ariyman pisiyachisqa, modokunawan, chaykunaqa huk mast'ariypa huk mast'ariypa siqikuna icha limitekuna.
La Psicología	 psicología nisqamanta
El hombre está compuesto de un cuerpo al cual está íntimamente unida el alma, sustancia pensante.	 Runaqa huk cuerpomantan ruwasqa kashan, chaywanmi alma, yuyayniyoq sustancia, allinta hukllachasqa kashan.
Esta unión, a la par que distinción entre el cuerpo y el alma, domina todas las tesis psicológicas.	 Kay huñunakuymi, cuerpowan almawan t’aqanakuywan kuska, llapa tesis psicológicas nisqakunata kamachin.
Tendremos por un lado que considerar el alma en sí misma, y luego en cuanto que está unida al cuerpo.	 Huk ladumantataqmi qhawarinanchis almata kikinpi, chaymantataq cuerpowan hukllachasqa kasqanman hina.
En sí misma, el alma es inteligencia, facultad de pensar, de verificar intuiciones intelectuales; en este punto, la psicología se confunde con la metafísica o la lógica.	Kikinpiqa almaqa yuyaymi, yuyaymanay atiymi, yuyaysapa intuicionkunata cheqaqchaymi; kaypiqa psicología nisqa metafísica nisqawan utaq lógica nisqawan pantasqa kachkan.
Por otra parte, entre las ideas del alma están sus voluntades.	 Huk ladumantaq, almaq yuyaykunan ukhupin kashan munaynin.
La voluntad o libertad la sitúa, empero, Descartes en el mismo plano que las demás intuiciones intelectuales; la voluntad es la facultad, totalmente formal, de afirmar o negar.	 Munay utaq kacharichiymi ichaqa, Descartespa huk yuyaysapa intuicionkunawan kuska planollapi churan; voluntadqa facultadmi, totalmente formal, afirmar otaq neganapaq.
(Véase la primera regla del Método en la parte segunda del Discurso.)	 (Qaway Discursopa iskay kaq partenpi Métodopa punta kaq kamachikuyninta).
Réstanos considerar el alma como unida al cuerpo.	 Almataqa cuerpowan hukllachasqata hina qhawarinanchismi qhepan.
En este sentido, el alma es, ante todo, consciencia, es decir, que conoce lo que al cuerpo ocurre, y se da cuenta de este conocimiento.	Kay yuyaypiqa, almaqa, llapanmanta aswantaqa, conciencian, chaymi yachan imachus cuerpowan pasashasqanmanta, chay yachaymantataqmi reparan.
Mas, siendo el cuerpo un mecanismo, si no hay alma no habrá consciencia, ni voluntad, ni razón.	 Ichaqa, cuerpoqa mecanismo kasqanraykun, mana alma kaqtinqa manan conciencia, munay, razonpas kanqachu.
Así los animales son puros autómatas, máquinas maravillosamente ensambladas, pero carentes en absoluto de todo lo que de cerca o de lejos pueda llamarse espíritu.	 Chhaynapin animalkunaqa ch’uya automatakuna, admirakuypaq huñusqa maquinakuna, ichaqa manapunin imapas kanchu qayllamanta otaq karumanta espiritu nispa sutichanapaq.
En el hombre, en cambio, porque hay un alma inteligente y razonable, hay pasiones; es decir, los movimientos del cuerpo se reflejan en el alma; y a este reflejo es precisamente lo que llamamos pasión, que no es sino un estado especial del alma, consecuencia de movimientos del cuerpo.	 Runapiqa, yuyaysapa, yuyaysapa alma kasqanraykum, pasiones nisqakuna kan; chaymi, cuerpoq kuyuyninkuna almapi rikuchikun; hinaspa kay yuyaymanayqa precisamente pasión nisqanchismi, chayqa manan imapaschu aswanpas almaq estado especialninmi, cuerpoq kuyuyninkunaq consecuencianmi.
Pero lo característico de estos estados especiales del alma es que, siendo causados, en realidad, por movimientos del cuerpo, sin embargo el alma los refiere a sí misma; ignorante de la causa de sus pasiones, el alma las cree nacidas y alimentadas en su propio seno.	 Ichaqa imachus kay almaq estados especiales nisqakunaq característican, cheqaqtapuni cuerpoq kuyuyninkunawan ruwasqa kasqanraykun, almaqa chaywanpas kikinman chaykunataqa riqsichin; mana yachaspa imarayku pasionninkuna kasqanmanta, almaqa creenmi nacesqankuta, uywasqa kasqankutapas, kikin sinqanpi.
Hay seis pasiones fundamentales.	 Soqta fundamental pasiones nisqakunan kan.
La primera, la admiración, es apenas pasión, y señala el tránsito entre la pura intuición intelectual y la pasión propiamente; es, en suma, la emoción intelectual.	Ñawpaq kaq, admiración, pisilla pasión, hinaspan marcan transición chuya intuición intelectualwan kikin pasiónwan; chaymi, pisi rimayllapi, yuyaysapa sientekuynin.
De ella nacen el amor, el odio, el deseo, la alegría, la tristeza.	 Paymantan paqarin munakuy, cheqnikuy, munay, kusikuy, llakikuy.
De estas seis pasiones fundamentales, derívanse otras muchas: el aprecio, el desprecio, la conmiseración, etc.	 Kay suqta pasiones fundamentales nisqamanta, askha hukkunata horqoy: chaninchakuy, pisichay, khuyapayakuy, hukkunapas.
El estudio de las pasiones, ya que éstas provienen de los movimientos del cuerpo, conduce a Descartes a un gran número de interesantes y finas observaciones psico - fisiológicas.	 Pasiones nisqamanta yachayqa, cuerpoq kuyuyninmanta hamusqanrayku, Descartesta pusamun askha sumaq, allin psico-fisiológico qhawariykunaman.
Manuel G. Morente.	 Manuel G. Morente sutiyuq runa.
Discurso del Método	 Método Discurso nisqa
Para bien dirigir la razón y buscar la verdad en las ciencias	 Allinpaq razonta diriginanpaq hinaspa cienciapi cheqaq kaqta maskhananpaq
Primera parte	 Ñawpaq kaq t’aqa
El buen sentido es lo que mejor repartido está entre todo el mundo, pues cada cual piensa que posee tan buena provisión de él, que aun los más descontentadizos respecto a cualquier otra cosa, no suelen apetecer más del que ya tienen.	Allin yuyaymi aswan allinta llapa runaq chawpinpi rakisqa, sapankanku yuyaykunku chay hina allin suministroyoq kasqankuta, chaymi aswan mana contento kaqkunapas imamantapas respetaspa, mana aswantaqa munankuchu aswanta imachus kapusqanmantaqa.
No basta, en efecto, tener el ingenio bueno; lo principal es aplicarlo bien.	 Chiqaptaqa manam allin yuyayniyuq kayqa suficientechu; aswan allinqa allinta churaymi.
Las almas más grandes son capaces de los mayores vicios, como de las mayores virtudes; y los que andan muy despacio pueden llegar mucho más lejos, si van siempre por el camino recto, que los que corren, pero se apartan de él.	Aswan hatun almakunaqa atiqmi kanku aswan hatun millay ruwaykunaman, aswan hatun allin ruwaykunaman hina; ancha pisilla puriqkunapas aswan karumanmi riyta atinku, sichus chiqan ñanta purinkupuni chayqa, phawaqkunamanta ichaqa karunchakuqkunamantaqa.
Por mi parte, nunca he presumido de poseer un ingenio más perfecto que los ingenios comunes; hasta he deseado muchas veces tener el pensamiento tan rápido, o la imaginación tan clara y distinta, o la memoria tan amplia y presente como algunos otros.	 Ñoqamantaqa manan hayk’aqpas presumirqanichu común ingeniokunamanta aswan perfecto ingenioyoq kasqayta; Achka kutitaraqmi munarqani chayna utqaylla yuyaymanayniyuq kayta, utaq chayna chuya hinaspa sapaq yuyayniyuq kayta, utaq wakinkuna hina hatun hinaspa kunan pacha yuyariyniyuq kayta.
Puede ser, no obstante, que me engañe; y acaso lo que me parece oro puro y diamante fino, no sea sino un poco de cobre y de vidrio.	 Ichaqa, q’otusqa kasqaypas kanmanmi; hinaspapas yaqapaschá ch’uya qoriman, sumaq diamanteman rikch’akusqayqa mana imapaschu, aswanpas huk chhikan cobremanta, vidriomantawan.
Sé cuán expuestos estamos a equivocar nos, cuando de nosotros mismos se trata, y cuán sospechosos deben sernos también los juicios de los amigos, que se pronuncian en nuestro favor.	Yachanin imayna pantanapaq sut’inchasqa kasqanchista, noqanchismanta rimaspa, hinallataq imayna sospechoso amigokunaq taripayninpas, paykunan favorninchispi rimanku, ñoqanchispaqpas kanan.
Mi propósito, pues, no es el de enseñar aquí el método que cada cual ha de seguir para dirigir bien su razón, sino sólo exponer el modo como yo he procurado conducir la mía.	 Hinaptinqa, propósitoyqa manam kaypi yachachinaypaqchu sapakamapa qatipakunan métodota allinta diriginanpaq, aswanqa qawachinaypaqmi imaynatam ñuqapa yuyayniyta purichiyta munarqani.
Los que se meten a dar preceptos deben de estimarse más hábiles que aquellos a quienes los dan, y son muy censurables, si faltan en la cosa más mínima.	 Kamachiykunata qoyta munaqkunaqa aswan yachaysapapaqmi qhawarikunanku, chay kamachikuykunata qosqakunamantaqa, pisillatapas faltaqtinkuqa sinchitan huchachasqa kanku.
Desde la niñez, fui criado en el estudio de las letras y, como me aseguraban que por medio de ellas se podía adquirir un conocimiento claro y seguro de todo cuanto es útil para la vida, sentía yo un vivísimo deseo de aprenderlas.	 Warma kasqaymantapacham cartakuna estudiaypi uywasqa karqani, chaykunawanmi tukuy ima kawsaypaq allin kaqkunamanta sut’i, seguro yachayta tariyta atisqankuta niwasqankuman hina, chaykunata yachayta anchata munarqani.
Y, sin embargo, estaba en una de las más famosas escuelas de Europa, en donde pensaba yo que debía haber hombres sabios, si los hay en algún lugar de la tierra.	Hinaspapas chaywanpas Europapi huknin aswan reqsisqa escuelapin karqani, chaypin yuyaykurqani yachaysapa runakuna kananta, kay pachapi maypipas kanman chayqa.
Allí había aprendido todo lo que los demás aprendían; y no contento aún con las ciencias que nos enseñaban, recorrí cuantos libros pudieron caer en mis manos, referentes a las ciencias que se consideran como las más curiosas y raras.	 Chaypim wakinkunapa tukuy yachasqanta yacharurqa; hinaspapas manaraq yachachiwasqanku cienciakunawan contentakuspaymi, makiyman hina achka librokunata pasarqani, chaypim rimarqani aswan curioso hinaspa mana ancha rikusqa hina qawasqa cienciakunamanta.
Conocía, además, los juicios que se hacían de mi persona, y no veía que se me estimase en menos que a mis condiscípulos, entre los cuales algunos había ya destinados a ocupar los puestos que dejaran vacantes nuestros maestros.	 Hinallataqmi yacharqani runaymanta juicio ruwasqankuta, manataqmi rikurqanichu estudiantemasiykunamanta aswan pisipaq qhawarisqa kasqayta, paykuna ukhupin wakinqa destinasqaña kasharqanku yachachiqninchiskunaq ch’usaq saqesqan cargokunata hunt’anankupaq.
Por último, parecíame nuestro siglo tan floreciente y fértil en buenos ingenios, como haya sido cualquiera dé los precedentes.	 Tukuchanapaqtaq, pachak wataykuqa allin yuyaywan t’ikarimuq, puquqjina rikch’akuwarqa, mayqin ñawpaq watakunapijina.
Por todo lo cual, me tomaba la libertad de juzgar a los demás por mí mismo y de pensar que no había en el mundo doctrina alguna como la que se me había prometido anteriormente.	 Tukuy chaykunapaqmi libre kayta hap’irqani hukkunata sapallay juzganaypaq, yuyaykurqanitaqmi kay pachapiqa manan kanchu ñawpaqpi prometewasqanku yachachikuyqa.
No dejaba por eso de estimar en mucho los ejercicios que se hacen en las escuelas.	Chay raykun mana saqerqanchu escuelakunapi ejerciciokuna ruwasqankuta estimananpaq.
Pero creía también que ya había dedicado bastante tiempo a las lenguas e incluso a la lectura de los libros antiguos y a sus historias y a sus fábulas.	Ichaqa creellarqantaqmi simikunawan allintaña tiempota pasasqanmanta, ñawpaq librokunata, willakuyninkunata, cuentokunatapas leespapas.
Pues es casi lo mismo conversar con gentes de otros siglos, que viajar por extrañas tierras.	 Bueno, yaqa kaqllam huk pachak watakunamanta runakunawan rimay, mana riqsisqa suyukunata puriymantaqa.
Bueno es saber algo de las costumbres de otros pueblos, para juzgar las del propio con mejor acierto, y no creer que todo lo que sea contrario a nuestras modas es ridículo y opuesto a la razón, como suelen hacer los que no han visto nada.	 Allinmi huk llaqtakunaq costumbrenkunamanta imallatapas yachay, qanpa costumbreykikunata aswan allinta juzganaykipaq, manataqmi creenachu tukuy imapas modanchiskunaq contranpi kaqkuna asikunapaq hina kasqanpi, razonpa contranpi kasqanpi, imaynan mana imatapas rikuqkunapas munanku hinata ruway.
Pero el que emplea demasiado tiempo en viajar, acaba por tornarse extranjero en su propio país; y al que estudia con demasiada curiosidad lo que se hacía en los siglos pretéritos, ocúrrele de ordinario que permanece ignorante de lo que se practica en el presente.	 Ichaqa llumpay tiempota viajaq runaqa, llaqtanpi huk llaqtayoqmanmi tukupun; hinaspapas llumpay yachay munaspa estudiaqkunapaqqa, ñawpaq pachak watakunapi imakuna ruwasqa kasqanmanta, yaqa llapanpim pasakun kunan tiempopi ima ruwasqankumanta mana yachaqlla kasqanku.
Estimaba en mucho la elocuencia y era un enamorado de la poesía; pero pensaba que una y otra son dotes del ingenio más que frutos del estudio.	 Payqa ancha chaninchaqmi rimay yachayta, harawitapas munakuqmi; ichaqa yuyaykurqanin hukninwan hukninwanqa yachaypa qosqan kasqankuta, manan estudiaypa rurunkunachu.
Profesaba una gran reverencia por nuestra teología y, como cualquier otro, pretendía yo ganar el cielo.	 Payqa teologíanchista anchata respetasqanmantan willakurqan, llapa runakuna hinataqmi hanaq pachata ganayta yuyaykurqani.
Y siempre sentía un deseo extremado de aprender a distinguir lo verdadero de lo falso, para ver claro en mis actos y andar seguro por esta vida.	 Hinaspapas sapa kutinmi sinchi munayta sienteq kani cheqaq kaqta llullamanta t’aqayta yachanaypaq, ruwasqaypi sut’ita rikuspa kay kawsaypi mana imamanta manchakuspa purinaypaq.
Es cierto que, mientras me limitaba a considerar las costumbres de los otros hombres, apenas hallaba cosa segura y firme, y advertía casi tanta diversidad como antes en las opiniones de los filósofos.	 Chiqapmi, huk qarikunapa costumbrenkunata qawariyllapiña kachkaptiy, yaqapaschá mana imatapas seguro hinaspa takyasqa tarirqanichu, hinaspam qawarqani yaqa ñawpaq hina filósofokunapa piensasqankupi imaymana kasqankuta.
Segunda parte	 Iskay kaq t’aqa
Entre los cuales, fue uno de los primeros el ocurrírseme considerar que muchas veces sucede que no hay tanta perfección en las obras compuestas de varios trozos y hechas por las manos de muchos maestros, como en aquellas en que uno solo ha trabajado.	 Chaykuna ukhupin yuyayniyman hamurqan qhawarinaypaq, sapa kutinmi pasakun askha piezakunamanta ruwasqa, askha maestrokunaq makinwan ruwasqa llank’aykunapi mana ancha hunt’asqa kay, huklla llank’asqankupi hina.
Así vemos que los edificios, que un solo arquitecto ha comenzado y rematado, suelen ser más hermosos y mejor ordenados que aquellos otros, que varios han tratado de componer y arreglar, utilizando antiguos muros, construidos para otros fines.	 Chaynapim qawanchik chay wasikuna, huk arquitectolla qallarisqan hinaspa tukusqan, aswantaqa aswan sumaq hinaspa aswan allin ordenasqa chay wakinkunamantaqa, chaykunatam achka runakuna ruwayta munarqaku hinaspa allichayta munarqaku, mawka pirqakunawan, huk ruwaykunapaq ruwasqa.
Y si se considera que, sin embargo, siempre ha habido unos oficiales encargados de cuidar de que los edificios de los particulares sirvan al ornato público, bien se reconocerá cuán difícil es hacer cumplidamente las cosas cuando se trabaja sobre lo hecho por otros.	 Hinaspapas sichus qhawarikunman ichaqa, sapa kutinmi karqan oficialkuna encargadokuna wasikuna privado adorno público nisqaman servinankupaq chayqa, allintan reqsikunqa imayna sasa kasqanmanta allinta ruway hukkunaq ruwasqankupi llank’aspa.
Como también es muy cierto, que el estado de la verdadera religión, cuyas ordenanzas Dios solo ha instituido, debe estar incomparablemente mejor arreglado que todos los demás.	 Imaynan ancha cheqaqtaqmi, cheqaq religionpa estadon, Diosllan ordenanzankunata churarqan, mana tupachiy atina aswan allinta churasqa kanan llapa wakinkunamantaqa.
Y también pensaba yo que, como hemos sido todos nosotros niños antes de ser hombres y hemos tenido que dejarnos regir durante mucho tiempo por nuestros apetitos y nuestros preceptores, que muchas veces eran contrarios unos a otros, y ni unos ni otros nos	 Hinaspapas yuyaykurqanin chayta, llapanchis manaraq qhari kashaspanchis wawa kasqanchisrayku, unayñataqmi saqekunanchis karqan mikhuy munasqanchiswan, yachachiqninchiskunawan kamachisqa kananchispaq, paykunaqa sapa kutillanmi contrario karqanku, manataqmi hukninpas nitaq hukninpas
aconsejaban acaso siempre lo mejor, es casi imposible que sean nuestros juicios tan puros y tan sólidos como lo fueran si, desde el momento de nacer, tuviéramos el uso pleno de nuestra razón y no hubiéramos sido nunca dirigidos más que por ésta.	 Ichapas paykunaqa allin kaqta yuyaychaqkupuni, yaqapaschá mana atikunmanchu juicionchiskuna ch’uya, allin takyasqa kananta, sichus, nacesqanchis ratomantapacha, razonninchista allinta utilizasunman, manataqmi hayk’aqpas hukwan dirigiwasunmanchu karqan chayqa .
Y tuve firmemente por cierto que, por este medio, conseguiría dirigir mi vida mucho mejor que si me contentase con edificar sobre cimientos viejos y me apoyase solamente en los principios que había aprendido siendo joven, sin haber examinado nunca si eran o no verdaderos.	Hinaspapas allintan seguro sientekurqani kaywanqa aswan allinta kawsayniyta kamachiyta atiyman, ñawpaq cimientokunapi sayarispa contento kaspa, wayna kashaspa yachasqay principiokunallapi confiaspay, mana hayk’aqpas qhawarispaychu icha manachu chayta chiqaq.
Pues si bien en esta empresa veía varias dificultades, no eran, empero, de las que no tienen remedio; ni pueden compararse con las que hay en la reforma de las menores cosas que atañen a lo público.	 Bueno, kay llamkaypi achka sasachakuykunata qawaptinpas, ichaqa manam mana hampiyuq kaqkunamantachu karqa; nitaqmi tupachiyta atikunmanchu llaqta runakunata llakichiq huch’uy ruwaykunata allichaypi kaqkunawan.
Estos grandes cuerpos políticos, es muy difícil levantarlos, una vez que han sido derribados, o aun sostenerlos en pie cuando se tambalean, y sus caídas son necesariamente muy duras.	 Kay hatun cuerpokuna político, ancha sasa uyway, huk kuti urmachisqa kaptinku, utaq hapiypas kuyuriptinku, urmayninkupas necesariamente ancha sinchi.
Mis designios no han sido nunca otros que tratar de reformar mis propios pensamientos y edificar sobre un terreno que me pertenece a mí solo.	 Diseñoykunaqa manan hayk’aqpas hukchu karqan, aswanpas kikiypa yuyaykusqayta mosoqyachiyta munaspa, sapallaypa hallp’api hatarichiyta munaspa.
Si, habiéndome gustado bastante mi obra, os enseño aquí el modelo, no significa esto que quiera yo aconsejar a nadie que me imite.	 Sichus, llamkayniy allinta gustaruspa, kaypi modelota qawachiyki, kayqa manam niyta munanchu pitapas yuyaychayta munani qatipawananpaq.
Los que hayan recibido de Dios mejores y más abundantes mercedes, tendrán, sin duda, más levantados propósitos; pero mucho me temo que éste mío no sea ya demasiado audaz para algunas personas.	 Diosmanta aswan allin, aswan askha favorkunata chaskiqkunan mana iskayrayaspa aswan hatun propósitoyoq kanqaku; ichaqa anchatan manchakuni kay ñoqaq wakin runakunapaqqa manaña ancha atrevidochu kasqanmanta.
Ya la mera resolución de deshacerse de todas las opiniones recibidas anteriormente no es un ejemplo que todos deban seguir.	Ñawpaqpi llapa chaskisqa yuyaykuykunata chinkachinapaq decidikuyllaqa manañan llapa runakunaq qatikunankupaq ejemplochu.
Y yo hubiera sido, sin duda, de esta última especie de ingenios, si no hubiese tenido en mi vida más que un solo maestro o no hubiese sabido cuán diferentes han sido, en todo tiempo, las opiniones de los más doctos.	Hinaspapas, mana iskayrayaspa, kay qhepa kaq clase ingeniomanta hukninmi kayman karqan, sichus mana aswan huk yachachiqniyoqchu kayman karqan kawsayniypi otaq mana yachaymanchu karqan imayna hukniray kasqanmanta aswan yachaysapakunaq yuyaykusqanku tukuy tiempopi.
Pero como hombre que tiene que andar solo y en la oscuridad, resolví ir tan despacio y emplear tanta circunspección en todo, que, a trueque de adelantar poco, me guardaría al menos muy bien de tropezar y caer.	Ichaqa sapallay, tutayaqpi purinay runa kaspaymi, tantearurqani ancha pisi-pisimanta rinaypaq hinaspa tukuy imapipas anchata cuidakunaypaq, chaymi pisillata ñawpaqman rispay, al menos ancha allinta cuidakunay mana urmanaypaq hinaspa mana urmanaypaq.
Había estudiado un poco, cuando era más joven, de las partes de la filosofía, la lógica, y de las matemáticas, el análisis de los geómetras y el álgebra, tres artes o ciencias que debían, al parecer, contribuir algo a mi propósito.	 Asllatan estudiarqani, sullk’a kashaspay, filosofía, lógica, matemáticas nisqakunaq partenkunamanta, geómetros nisqakunaq t’aqwiyninmanta, algebra nisqamantawan, kinsa artekunata otaq cienciakunata, chaykunan, rikch’akurqan, imallatapas yanapawanan propósitoyman.
Y si bien contiene, en verdad, muchos, muy buenos y verdaderos preceptos, hay, sin embargo, mezclados con ellos, tantos otros nocivos o superfluos, que separarlos es casi tan difícil como sacar una Diana o una Minerva de un bloque de mármol sin desbastar.	 Hinaspapas, cheqaqpiqa askha ancha allin cheqaq kamachikuykunataña hap’in chaypas, kanmi, chaywanpas, chaykunawan chaqrusqa, askha huk mana allin otaq mana imapaq valeq kamachikuykuna, chaymi t’aqayqa yaqa sasa hina huk Diana otaq huk Minerva huk bloquemanta horqoy hina mármol mana q’arayuq.
Por todo lo cual, pensé que había que buscar algún otro método que juntase las ventajas de esos tres, excluyendo sus defectos.	 Tukuy chaykunapaqmi yuyaykurqani huk métodota maskhananchista, chaymi kay kinsantinpa allinninkunata huñun, manataqmi defectonkutachu.
El segundo, dividir cada una de las dificultades, que examinare, en cuantas partes fuere posible y en cuantas requiriese su mejor solución.	 Iskay kaqtaq sapanka sasachakuykunata t’aqay, chaykunatan qhawarisaq, askha t’aqakunapi, aswan allin allichaypaq necesitasqankuman hina.
El tercero, conducir ordenadamente mis pensamientos, empezando por los objetos más simples y más fáciles de conocer, para ir ascendiendo poco a poco, gradualmente, hasta el conocimiento de los más compuestos, e incluso suponiendo un orden entre los que no se preceden naturalmente.	Kimsa kaqtaqmi yuyayniykunata ordenpi diriginaypaq, aswan sasan hinaspa aswan facil yachaykunamanta qallarispa, pisi pisimanta wicharinaypaq, pisi pisimanta, aswan sasachakuyniyuq kaqkunapa yachayninkama, mana yachaqkuna ukhupipas ordenta hapinaypaq naturalmente ñawpaqtaraqmi hukkuna hukkunawan.
Y el último, hacer en todo unos recuentos tan integrales y unas revisiones tan generales, que llegase a estar seguro de no omitir nada.	 Hinaspa qhipa kaqtaq, tukuy imamanta chayjina tukuy imamanta yupaykunata, tukuy imamanta tukuy imamanta tukuy imamanta revisiones generales ruwananpaq, mana imatapas saqinanpaq.
Pero lo que más contento me daba en este método era que, con él, tenía la seguridad de emplear mi razón en todo, si no perfectamente, por lo menos lo mejor que fuera en mi poder.	 Ichaqa imachus aswan kusichiwarqan kay métodopi, chaywan kuska, seguridadniy karqan razonniyta tukuy imapi utilizanaypaq, mana perfectamentechu, al menos atisqayman hina.
Tercera parte	Kimsa kaq raki
Porque habiendo comenzado ya a no contar para nada con las mías propias, puesto que pensaba someterlas todas a un nuevo examen, estaba seguro de que no podía hacer nada mejor que seguir las de los más sensatos.	 Imaraykuchus manaña imamantapas yupayta qallarisqayrayku, llapankuta musuq examenman churayta yuyaykusqayrayku, seguro karqani mana aswan allinta ruwayta atiymanchu aswan allin yuyayniyuq runakunata qatiymantaqa.
