español	quechua
Sin embargo, transcurrieron esos nueve años sin que tomara yo decisión alguna tocante a las dificultades de que suelen disputar los doctos, y sin haber comenzado a buscar los cimientos de una filosofía más cierta que la vulgar.	Ichaqa chay isqon watakunan pasarqan mana imatapas decidispay yachaysapakunaq ch’aqwasqanku sasachakuykunamanta, manataqmi maskhayta qallarirqanichu aswan cheqaq filosofíaq teqsinkunata maskhayta vulgar nisqamantaqa.
Cuarta parte	 Tawa kaq raki
No sé si debo hablaros de las primeras meditaciones que hice allí, pues son tan metafísicas y tan fuera de lo común, que quizá no gusten a todo el mundo.	Mana yachanichu chaypi ruwasqaymanta ñawpaq yuyaymanaykunamanta willanaychu icha manachu, imaraykuchus ancha metafísico, ancha mana ordinario kasqanrayku, ichapas mana llapa runaman gustanqachu.
Sin embargo, para que se pueda apreciar si los fundamentos que he tomado son bastante firmes, me veo en cierta manera obligado a decir algo de esas reflexiones.	 Ichaqa, chaynapi chaninchasqa kananpaq sichus chay cimientokuna hapisqay allin takyasqa kaptinqa, obligasqa hinam tarikuni kay yuyaymanaykunamanta imatapas ninaypaq.
Después de esto, consideré, en general, lo que se requiere en una proposición para que sea verdadera y cierta; pues ya que acababa de hallar una que sabía que lo era, pensé que debía saber también en qué consiste esa certeza.	Kay qhepamanmi qhawarirqani, en general, imakunatan necesitakun huk proposicionpi cheqaq, seguro kananpaq; Bueno, chayllaraq hukninta tarisqayraykum yacharqani, chaymi piensarqani chay seguridad imamanta kasqanmanta yachanaytapas.
Además, tenía yo ideas de varias cosas sensibles y corporales; pues aun suponiendo que soñaba y que todo cuanto veía e imaginaba era falso, no podía negar, sin embargo, que esas ideas estuvieran verdaderamente en mi pensamiento.	 Chaymantapas, imaymana yuyayniyoq, cuerpoyoq imakunamantapas yuyayniyoqmi karqani; imaraykuchus musqukusqayta, tukuy rikusqaypas, yuyaykusqaypas llulla kasqanmanta yuyaykuspapas, manan negayta atiymanchu ichaqa, chay yuyaykuykuna cheqaqtapuni yuyayniypi kashasqanmanta.
Pues ¿cómo sabremos que los pensamientos que se nos ocurren durante el sueño son falsos, y que no lo son los que tenemos despiertos, si muchas veces sucede que aquéllos no son menos vivos y expresos que éstos?	 Bueno, ¿imaynatataq yachasunman puñushaspa yuyaykusqanchis llulla kashasqanmanta, rikch’arisqanchistaq mana llulla kasqanmanta, sichus sapa kutilla pasanman ñawpaq kaq mana pisichu kawsaq, manataqmi aswan sut’itachu rikuchin qhepa kaqmantaqa?
Y por mucho que estudien los mejores ingenios, no creo que puedan dar ninguna razón bastante a levantar esa duda, como no presupongan la existencia de Dios.	Hinaspapas maynataña aswan allin yuyaysapakuna estudianku chaypas, manan piensanichu suficiente razonta qoyta atisqankuta chay iskayrayayta hatarichinankupaq, mana chayqa ñawpaqmantaraqmi suyankuman Diospa kayninta.
De suerte que si tenemos con bastante frecuencia ideas que encierran falsedad, es porque hay en ellas algo confuso y oscuro, y en este respecto participan de la nada; es decir, que si están así confusas en nosotros, es porque no somos totalmente perfectos.	 Chaymi sichus sapa kutilla llullakuyniyoq yuyayniyoq kanchis chayqa, chaykunapi imapas pantasqa, tutayaq kasqanraykun, kaypitaq mana imapipas participasqankurayku; chaymi niyta munan, sichus chhaynata ñoqanchispi pantasqa kashanku chayqa, mana llapanpi hunt’asqa kasqanchisraykun.
Y es evidente que no hay menos repugnancia en admitir que la falsedad o imperfección proceda como tal de Dios mismo, que en admitir que la verdad o la perfección procede de la nada.	Hinaspapas sut’inmi rikukun llullakuy otaq mana hunt’asqa kayqa kikin Diosmanta hamusqanmanta reqsikuyqa, cheqaq otaq hunt’asqa kayqa mana imamanta hamusqanmanta reqsikuymantaqa.
Mas si no supiéramos que todo cuanto en nosotros es real y verdadero proviene de un ser perfecto e infinito, entonces, por claras y distintas que nuestras ideas fuesen, no habría razón alguna que nos asegurase que tienen la perfección de ser verdaderas.	 Ichaqa sichus mana yachasunmanchu tukuy imapas cheqaq, cheqaq noqanchispi kaqpas hunt’asqa mana tukukuq kayninmanta hamusqanmanta chayqa, hinaqa, may sut’iña, sapaqña yuyaykusqanchisña kanman chaypas, manan kanmanchu imaraykupas segurawananchispaq hunt’asqa kayniyoq kasqankuta chiqaq.
Así, pues, habiéndonos el conocimiento de Dios y del alma testimoniado la certeza de esa regla, resulta bien fácil conocer que los ensueños, que imaginamos dormidos, no deben, en manera alguna, hacernos dudar de la verdad de los pensamientos que tenemos despiertos.	 Chhaynaqa, Diosmanta, almamanta yachay kay kamachikuypa cheqaq kasqanmanta testigo kaspaqa, ancha facilmi yachay, puñushaspa yuyaykusqanchis mosqoykuna, manan imapipas, yuyaykusqanchis cheqaq kasqanmanta iskayrayachiwananchischu rikcharisqanchikta.
Pues, en último término, despiertos o dormidos, no debemos dejarnos persuadir nunca sino por la evidencia de la razón.	 Bueno, qhepaman, rikch’asqaña otaq puñushaspapas, manan hayk’aqpas saqenanchischu convencesqa kananchista, aswanpas razonpa pruebankunawanllan.
Quinta parte	Pichqa kaq raki
Considerando luego la serie de esas leyes, me parece que he descubierto varias verdades más útiles y más importantes que todo lo que anteriormente había aprendido o incluso esperado aprender.	 Hinaptinqa chay kamachikuykunapa qatiqninpi yuyaymanaspaqa, ñuqapaqqa achka chiqap kaqkunata tarisqayman hinam, aswan allin hinaspa aswan allin kaqta, ñawpaq yachasqaymanta utaq yachayta suyasqaymantapas.
Mas habiendo procurado explicar las principales de entre ellas en un tratado que, por algunas consideraciones, no puedo publicar, lo mejor será, para darlas a conocer, que diga aquí sumariamente lo que ese tratado contiene.	Ichaqa paykuna ukhupi aswan hatun kaqkunata huk tratadopi sut’inchayta munaspaymi, wakin razonkunarayku mana publicayta atiymanchu, aswan allinqa kanqa, chaykunata reqsichinaypaq, kaypi pisillapi nisaq imakunatan chay tratadopi kashan chayta.
Propúseme poner en él todo cuando yo creía saber, antes de escribirlo, acerca de la naturaleza de las cosas materiales.	 Proponerqanim chaypi churanaypaq tukuy ima yachasqayta, manaraq qillqachkaspay, materialkunapa imayna kasqanmanta.
Y aquí, extendiéndome sobre el tema de la luz, expliqué por lo menudo cuál era la que debía haber en el sol y en las estrellas y cómo desde allí atravesaba en un instante los espacios inmensos de los cielos y cómo se reflejaba desde los planetas y los cometas hacia la tierra.	 Hinaspa kaypi, k’anchaymanta rimaspa, sapa kuti sut’inchaq kani ima k’anchaytaq kanan intipi, ch’askakunapipas, imaynatas chaymanta hanaq pachaq hatun espacionkunata huk ratullapi purirqan, imaynatas planetakunamanta, cometakunamantawan qhawarikurqan chayta kay pachaman.
Sin embargo, de todas esas cosas no quería yo inferir que este mundo nuestro haya sido creado de la manera que yo explicaba, porque es mucho más verosímil que, desde el comienzo, Dios lo puso tal y como debía ser.	 Ichaqa, tukuy kaykunamantaqa manan inferir munarqanichu kay pachanchisqa imayna sut’inchasqayman hina kamasqa kasqanmanta, imaraykuchus aswan askharaqmi kanman, qallariymantapacha, Diosqa imayna kananman hina churarqan.
De la descripción de los cuerpos inanimados y de las plantas, pasé a la de los animales y particularmente a la de los hombres.	 Mana kawsaq cuerpokunamanta, plantakunamantawan willakuymantaqa, animalkunamanta, astawanqa runakunamantawan.
Pero para que pueda verse el modo como estaba tratada esta materia, voy a poner aquí la explicación del movimiento del corazón y de las arterias que, siendo el primero y más general que se observa en los animales, servirá para que se juzgue luego fácilmente lo que deba pensarse de todos los demás.	Ichaqa kay asunto imayna tratasqa kasqanmanta qawanaykipaqmi kayman churasaq sunqupa hinaspa arteriakunapa kuyuyninmanta explicacionta, chaykunam, animalkunapi qawasqa punta kaq hinaspa aswan general kasqanrayku, servinqa mana sasachakuspalla taripanapaq ima Imakunatataq llapa runamanta yuyana.
Y del número de estos pellejos no hay que buscar otra razón sino que el orificio de la arteria venosa, siendo ovalado, a causa del sitio en donde se halla, puede cerrarse cómodamente con dos, mientras que los otros, siendo circulares, pueden cerrarse mejor con tres.	Hinaspapas kay qarakuna hayk’a kasqanmantaqa manan imaraykupas hukta maskhanapaqqa kanchu, aswanpas chay orificio arteria venosa nisqa, oval kasqanrayku, maypichus tarikun chaypi kasqanrayku, iskaywan facil-llata wisq’akunman, wakintaq, muyu kasqanrayku aswan allin wichqasqa kay.kimsawan.
Y porque la sangre, antes de entrar en el corazón, pasa por esas dos bolsas, llamadas orejas, de ahí viene que el movimiento de éstas sea contrario al de aquél, y que éstas se desinflen cuando aquél se infla.	Hinaspa yawar, manaraq sonqoman haykushaspa, kay iskay bolsakunata pasasqanrayku, ninri sutichasqa, chaymi qhepa kaqpa kuyuyninqa ñawpaq kaqpa kuyuriyninpa contranpi, qhepa kaqtaq ñawpaq kaq phukuqtinmi phukurkun.
¿Y qué es lo que los médicos pueden averiguar, al tomar el pulso, si no es que, según que la sangre cambie de naturaleza, puede el calor del corazón distenderla con más o menos fuerza y más o menos velocidad?	 Hinaspa, ¿imataq doctorkuna tarinkuman, pulsota hap’ispa, mana chayqa, yawarpa imayna kasqanman hina, sonqoq ruphaynin aswan pisi kallpawan aswan pisi kallpawantaq mast’ariyta atinman?
Además, ¿cómo podría hacerse la cocción de los alimentos en el estómago, si el corazón no enviase calor a esta víscera por medio de las arterias, añadiéndole algunas de las más suaves partes de la sangre, que ayudan a disolver las viandas?	Chaymantapas, ¿imaynatataq wiksa ukupi mikhunata yanukunman karqa, sichus sunqu mana kay viscera nisqaman ruphaytaqa apachinmanchu arterias nisqawan, yawarpa wakin llampu partenkunata yapaspa, chaykunam yanapan viands nisqakunata chullunanpaq?
Y la acción que convierte en sangre el jugo de esas viandas, ¿no es fácil de conocer, si se considera que, al pasar una y otra vez por el corazón, se destila quizá más de cien o doscientas veces cada día?	 Hinaspa chay viands nisqakunaq jugonta yawarman tukuchiq ruway, ¿manachu facil yachay, yuyaykuspa, sonqota yapamanta yapamanta pasasqanman hina, sapa p’unchay ichapas pachak otaq iskay pachak kutita aswanta destilakun?
Había yo explicado, con bastante detenimiento, todas estas cosas en el tratado que tuve el propósito de publicar.	Sut’incharqanin, allintapuni, tukuy kaykunata, chay tratadopi, chaytan horqoyta yuyaykurqani.
Sexta parte	 soqta kaq parte
Y tales son esas razones, de una y de otra parte, que no sólo me interesa a mí decirlas aquí, sino que acaso también interese al público conocerlas.	 Hinaspa chayna kanku chay razonkuna, iskaynin ladomanta, chaymi mana kaypi niyllachu interesniypi, aswanqa ichapas llaqtapa interesninpipas kanman chaykunamanta yachanapaq.
En consecuencia, hube de repasar en mi espíritu todos los objetos que se habían presentado ya a mis sentidos, y no vacilo en afirmar que nada vi en ellos que no pueda explicarse, con bastante comodidad, por medio de los principios hallados por mí.	 Chay raykun yuyayniypi qhawarinay karqan llapa imakunatapas, chaykunatan sienteykunaman presentasqaña kasharqan, manataqmi iskayrayanichu chaykunapi mana imatapas rikusqayta, chaytaqa manan sut’inchayta atikunmanchu, suficiente consuelowan, tarisqa principiokunawan ñuqa.
En cuanto a la utilidad que sacaran los demás de la comunicación de mis pensamientos, tampoco podría ser muy grande, ya que aun no los he desenvuelto hasta tal punto, que no sea preciso añadirles mucho, antes de ponerlos en práctica.	 Yuyayniykunata willanakuymanta hukkunaq allin kayninmanta rimaspaqa, manan ancha hatunpas kanmanchu, manaraqmi chaykunataqa wiñachirqaniraqchu, chaymi manaraq ruwayman churashaspaqa mana anchatachu yapana.
Y, en suma, si hay en el mundo una labor que no pueda nadie rematar tan bien como el que la empezó, es ciertamente la que me ocupa.	 Hinaspa, pisi rimayllapi, sichus kay pachapi kan huk ruway mana pipas tukunanpaq hina allintachu qallariq hina, chayqa cheqaqtapunin ocupawashan.
Todas estas consideraciones juntas fueron causa de que no quise, hace tres años, divulgar el tratado que tenía entre manos, y aun resolví no publicar durante mi vida ningún otro de índole tan general, que por él pudieran entenderse los fundamentos de mi física.	Tukuy kay qhawariykuna kuskan karqan, chaymi mana munarqanichu, kinsa wata ñawpaqta, makiypi kaq tratadota willayta, hinallataqmi decidikurqanipas kawsayniypi mana hukta horqonaypaq, chay hina general naturalezayoq, chaymi físicaypa cimientonkuna chaymantan entiendekunman karqan.
a mis designios.	 diseñoykunaman
Y he pensado que era fácil elegir algunas materias que, sin provocar grandes controversias, ni obligarme a declarar mis principios más detenidamente de lo que deseo, no dejaran de mostrar con bastante claridad lo que soy o no soy capaz de hacer en las ciencias.	 Hinaspa yuyaykurqanin facil kasqanmanta huk iskay kinsa temakunata akllay, chaykunan, mana hatun ch’aqwayta hatarichispa, nitaq obligawaspachu aswan hunt’asqata kamachikuyniykunata rimanaypaq, manan mana allintachu rikuchirqan imapichus kasqayta otaq mana atiyniyoq kasqayta chay ciencias nisqakuna.
