español	quechua
Pero si se pregunta cómo la sangre de las venas no se acaba, al entrar así continuamente en el corazón, y cómo las arterias no se llenan demasiadamente, puesto que toda la que pasa por el corazón viene a ellas, no necesito contestar otra cosa que lo que ya ha escrito un médico de Inglaterra, a quien hay que reconocer el mérito de haber abierto brecha en este punto y de ser el primero que ha enseñado que hay en las extremidades de las arterias varios pequeños corredores, por donde la sangre que llega del corazón pasa a las ramillas extremas de las venas y de aquí vuelve luego al corazón; de suerte que el curso de la sangre es una circulación perpetua.	Ichaqa sichus tapunki imaynatas venaskunapi yawar mana tukukunchu, sapa kutilla sonqoman chhaynata haykuspa, imaynatas arteriakuna mana nishutachu hunt’akun, sonqopi tukuy imapas paykunaman hamusqanrayku chayqa, manan ñoqachu necesitanku kutichiyta ima huktapas mana mayqinmantachus qillqasqaña kachkan huk inglés hampiqwan, pimanchus kay puntopi ch’usaq kaqta kicharisqanmanta yupaychasqa kanan tiyan chanta ñawpaq kaq yachachisqanmanta kay arteriakunap tukukuyninpi askha juch’uy pasillokuna kasqanmanta, chayninta chaytaq sonqomanta chayamuq yawarqa venakunaq sinchi k’allmankunamanmi pasapun chaymantataq sonqoman kutipun; chaymi yawarpa puriyninqa wiñaypaq purin.
Y esto lo prueba muy bien por medio de la experiencia ordinaria de los cirujanos, quienes, habiendo atado el brazo con mediana fuerza por encima del sitio en donde abren la vena, hacen que la sangre salga más abundante que si no hubiesen atado el brazo; y ocurriría todo lo contrario si lo ataran más abajo, entre la mano y la herida, o si lo ataran con mucha fuerza por encima.	Hinaspa chaytaqa allintan pruebakun cirujanokunaq ordinario experiencian, paykunan venata kicharisqanku cheqasmanta aswan hatun kallpawan makinta wataspanku aswan askhata yawarta purichinku, maki mana watasqa kaqtinqa; contranpitaqmi pasanman urayman wataqtinku, makiwan k’iriwan chawpipi otaq hanaqpi ancha kallpawan wataqtinku.
Porque es claro que la atadura hecha con mediana fuerza puede impedir que la sangre que hay en el brazo vuelva al corazón por las venas, pero no que acuda nueva sangre por las arterias, porque éstas van por debajo de las venas, y siendo sus pellejos más duros, son menos fáciles de oprimir; y también porque la sangre que viene del corazón tiende con más fuerza a pasar por las arterias hacia la mano, que no a volver de la mano hacia el corazón por las venas; y puesto que la sangre sale del brazo, por el corte que se ha hecho en una de las venas, es necesario que haya algunos pasos por la parte debajo de la atadura, es decir, hacia las extremidades del brazo, por donde la sangre pueda venir de las arterias.	Imaraykuchus sut’i rikukun chawpi kallpawan watasqa kayninqa hark’anman makipi kaq yawarta venasninta sunquman kutimunanpaq, ichaqa mana musuq yawar arteriasninta hamunchu, imaraykuchus kaykunaqa venas uraman rin, qarankutaq aswan sasa, mana ancha facilchu sarunchanapaq; hinallataq sonqomanta hamuq yawar aswan kallpawan arteriakunata makiman pasayta munasqanrayku, makimanta venasninta sonqoman kutinanmantaqa; hinaspapas yawarqa makimanta lloqsimusqanraykun, huknin venapi ruwasqa kuchusqawan, chaymi necesario kanman wakin pasajekuna watasqa urapi, chaymi makiq puntankunaman, chaynintan yawarqa atin arteriakunamanta hamunku.
También prueba muy satisfactoriamente lo que dice del curso de la sangre, por la existencia de ciertos pellejos que están de tal modo dispuestos en diferentes lugares, a lo largo de las venas, que no permiten que la sangre vaya desde el centro del cuerpo a las extremidades y sí sólo que vuelva de las extremidades al centro; y además, la experiencia demuestra que toda la sangre que hay en el cuerpo puede salir en poco tiempo por una sola arteria que se haya cortado, aun cuando, habiéndose atado la arteria muy cerca del corazón, se haya hecho el corte entre éste y la atadura, de tal suerte que no haya ocasión de imaginar que la sangre vertida pueda venir de otra parte.	Hinallataqmi ancha kusichiq hina pruebakun yawarpa purisqanmanta rimasqankunata, wakin qarakuna kasqanrayku, chaykunaqa hukniray cheqaskunapi, venakunaq ladonpi churasqa kashan, chaymi mana saqenchu yawarqa chawpimanta rinanpaq cuerpota tukukuykunaman hinallataq arí tukukuykunamanta chawpiman kutinallapaq; hinaspapas, experiencian rikuchin cuerpopi llapa yawar pisi tiempollapi lloqsiyta atinman huk arteriallata, chay arteriaqa kuchusqañan kashan, chay arteria sonqoman ancha qayllallapi watasqaña kashaqtinpas, chay arteriawan kuskan kuchusqa kashan sunqu.watasqa, chaynapi mana imapas piensanapaq hina chay hich’asqa yawar huklawmanta hamunman nispa.
Pero hay otras muchas cosas que dan fe de que la verdadera causa de ese movimiento de la sangre es la que he dicho, como son primeramente la diferencia que se nota entre la que sale de las venas y la que sale de las arterias, diferencia que no puede venir sino de que, habiéndose rarificado y como destilado la sangre, al pasar por el corazón, es más sutil y más viva y más caliente en saliendo de este, es decir, estando en las arterias, que no poco antes de entrar, o sea estando en las venas.	Ichaqa kanmi askha huk imakuna, chaykunan testifikachin cheqaq causan kay yawar kuyuypa kasqanmanta, chaytan rimarqani, ahinataq, ñawpaqtaqa, venakunamanta lloqsimuqwan lloqsimuqwan hukniray kasqankuta chay arterias, huk diferencia chay Chayqa hamunmanlla kay yawar, rarefiado hinallataq destilasqa kasqanrayku sonqonta pasasqanman hina, aswan sutil hinallataq kawsaq hinallataq aswan q’oñi sonqomanta lloqsispa, chaymi arteriakunapi kasqanmanta, aswan mana manaraq yaykuchkaspallachu.chayqa venaspi kay.
Y si bien se mira, se verá que esa diferencia no aparece del todo sino cerca del corazón y no tanto en los lugares más lejanos; además, la dureza del pellejo de que están hechas la vena arteriosa y la gran arteria, es buena prueba de que la sangre las golpea con más fuerza que a las venas.	 Hinaspa allinta qhawarinki chayqa, reparankin kay t’aqanakuyqa manan hunt’asqatachu rikhurin aswanpas sonqoman qayllallapin manataqmi anchatachu aswan karu cheqaskunapi; Chaymantapas, arterial vena hinaspa hatun arteria ruwasqa qaranpa rumi kayninmi allin prueba yawar venasmanta aswan kallpawan tupasqanmanta.
Y ¿cómo explicar que la concavidad izquierda del corazón y la gran arteria sean más amplias y anchas que la concavidad derecha y la vena arteriosa, sino porque la sangre de la arteria venosa, que antes de pasar por el corazón no ha estado más que en los pulmones, es más sutil y se expande mejor y más fácilmente que la que viene inmediatamente de la vena cava?	Hinaspa imaynatataq sut’inchasunman sonqoq lloq’e k’aspichanpas hatun arteriapas aswan ancho, aswan ancho kasqankuta, paña k’uchumanta, arterial venamantawan, ichaqa venosa arteriamanta yawar, manaraq sonqonta pasashaspa pulmonllapi kasqanrayku , ¿aswan sutilchu hinaspa aswan allin hinaspa aswan facil mastarikun chay vena cavamanta chaylla hamuqmantaqa?
¿Y qué es lo que los médicos pueden averiguar, al tomar el pulso, si no es que, según que la sangre cambie de naturaleza, puede el calor del corazón distenderla con más o menos fuerza y más o menos velocidad?	 Hinaspa, ¿imataq doctorkuna tarinkuman, pulsota hap’ispa, mana chayqa, yawarpa imayna kasqanman hina, sonqoq ruphaynin aswan pisi kallpawan aswan pisi kallpawantaq mast’ariyta atinman?
Y si inquirimos cómo este calor se comunica a los demás miembros, habremos de convenir en que es por medio de la sangre, que, al pasar por el corazón, se calienta y se reparte luego por todo el cuerpo, de donde sucede que, si quitamos sangre de una parte, quitámosle asimismo el calor; y aun cuando el corazón estuviese ardiendo, como un hierro candente, no bastaría a calentar los pies y las manos, como lo hace, si no les enviase de continuo sangre nueva.	Hinaspa tapukusun imaynatas kay ruphay huk miembrokunaman willakun chayqa, rimanakunanchismi yawarwan kasqanmanta, chaymi sonqonta pasaspa ruphaykun, chaymantataq lliw cuerpoman rakikun, chaymantan pasakun chay, sichus noqanchis huk chikanmanta yawarta hurqusun, ruphaytapas hurqusun; sonqo ninapiña kashaqtinpas, q’oñi fierro hina, manan aypanmanchu karqan chakikunata, makikunatapas q’oñichinanpaq, imaynan ruwan hinata, mana sapa kutichu mosoq yawarta apachinman chayqa.
También por esto se conoce que el uso verdadero de la respiración es introducir en el pulmón aire fresco bastante a conseguir que la sangre, que viene de la concavidad derecha del corazón, en donde ha sido dilatada y como cambiada en vapores, se espese y se convierta de nuevo en sangre, antes de volver a la concavidad izquierda, sin lo cual no pudiera ser apta a servir de alimento al fuego que hay en la dicha concavidad; y una confirmación de esto es que vemos que los animales que no tienen pulmones, poseen una sola concavidad en el corazón, y que los niños que estando en el seno materno no pueden usar de los pulmones, tienen un orificio por donde pasa sangre de la vena cava a la concavidad izquierda del corazón, y un conducto por donde va de la vena arteriosa a la gran arteria, sin pasar por el pulmón.	Kaymantapas yachakunmi chiqap samaypa llamkayninqa pulmonkunaman suficiente sumaq wayrata yaykuchinapaq, chaymi yawar, sunqupa paña concavidadninmanta hamun, maypichus dilatasqa hinaspa vaporkunaman tikrasqa hina, rakhuyananpaq hinaspa rakhuyay.yapamanta yawarman tukun, manaraq lluq’i k’uchuman kutispa, mana chaywanqa manan chay k’uyupi kaq ninapaq mikhuy hina kayta atinmanchu; chaymanta huk takyachiyqa rikunchismi mana pulmonniyoq uywakuna sonqonkupi huklla concavidad nisqayoq kasqankuta, wiksa ukhupi kaq wawakunapas manan pulmonninkuta utilizayta atinkuchu, huk orificioyoqmi kanku, chaynintan yawar mamanmanta pasashan vena cava sunqup lluq'i k'uchunman, chaymanta huk conducto mayqinnintachus venan arterialmanta hatun arteriaman rin, mana pulmónninta pasaspa.
Además, ¿cómo podría hacerse la cocción de los alimentos en el estómago, si el corazón no enviase calor a esta víscera por medio de las arterias, añadiéndole algunas de las más suaves partes de la sangre, que ayudan a disolver las viandas?	Chaymantapas, ¿imaynatataq wiksa ukupi mikhunata yanukunman karqa, sichus sunqu mana kay viscera nisqaman ruphaytaqa apachinmanchu arterias nisqawan, yawarpa wakin llampu partenkunata yapaspa, chaykunam yanapan viands nisqakunata chullunanpaq?
Y la acción que convierte en sangre el jugo de esas viandas, ¿no es fácil de conocer, si se considera que, al pasar una y otra vez por el corazón, se destila quizá más de cien o doscientas veces cada día?	 Hinaspa chay viands nisqakunaq jugonta yawarman tukuchiq ruway, ¿manachu facil yachay, yuyaykuspa, sonqota yapamanta yapamanta pasasqanman hina, sapa p’unchay ichapas pachak otaq iskay pachak kutita aswanta destilakun?
Y para explicar la nutrición y la producción de los varios humores que hay en el cuerpo, ¿qué necesidad hay de otra cosa, sino decir que la fuerza con que la sangre, al dilatarse, pasa del corazón a las extremidades de las arterias, es causa de que algunas de sus partes se detienen entre las partes de los miembros en donde se hallan, tomando el lugar de otras que expulsan, y que, según la situación o la figura o la pequeñez de los poros que encuentran, van unas a alojarse en ciertos lugares y otras en ciertos otros, del mismo modo como hacen las cribas que, por estar agujereadas de diferente modo, sirven para separar unos de otros los granos de varios tamaños.	Hinaspapas sut’inchanapaqmi, cuerpopi kaq imaymana asichikuykunaq mikhuyninmanta, ruwayninmantawan, ima necesidadtaq kanman, manataqmi nisunmanchu, chay kallpawanmi yawar, dilatasqa kaqtin, sonqomanta arteriakunaq tukukuyninkama pasashan, chaymi wakin partenkuna maypichus kasqankupi miembrokunaq partenkuna chawpipi sayananpaq, hukkunaq rantinpi hap’ispa, chaykunatan qarqonku, hinallataq, ima situacionman hina otaq tarisqanku poros nisqakunaq rikch’ayninman hina otaq huch’uy kayninman hina, wakinqa qhepakunankupaq rinku wakin cheqaskunapi wakintaq wakin cheqaskunapi, imaynan tamizkunapas ruwanku hinata, chaykunaqa hukniray t’oqyachisqa kasqanraykun imaymana sayayniyoq granukunata t’aqanakunku.
Y, por último, lo que hay de más notable en todo esto, es la generación de los espíritus animales, que son como un sutilísimo viento, o más bien como una purísima y vivísima llama, la cual asciende de continuo muy abundante desde el corazón al cerebro y se corre luego por los nervios a los músculos y pone en movimiento todos los miembros; y para explicar cómo las partes de la sangre más agitadas y penetrantes van hacia el cerebro, más bien que a otro lugar cualquiera, no es necesario imaginar otra causa sino que las arterias que las conducen son las que salen del corazón en línea más recta, y, según las reglas mecánicas, que son las mismas que las de la naturaleza, cuando varias cosas tienden juntas a moverse hacia un mismo lado, sin que haya espacio bastante para recibirlas todas, como ocurre a las partes de la sangre que salen de la concavidad izquierda del corazón y tienden todas hacia el cerebro, las más fuertes deben dar de lado a las más endebles y menos agitadas y, por lo tanto, ser las únicas que lleguen.	Hinaspa tukunanpaq, tukuy kaykunapi aswan reparanapaqqa uywa espiritukunaq mirayninmi, chaykunaqa aswan sut’i wayra hinan, otaq aswan allinta nisunman, aswan ch’uya, kawsaq nina rawray hina, chaymi wicharin sapa kutilla, askhata, sonqomanta.cerebroman chaymantataq nerviosninta aychakunaman phawan, llapa miembrokunatataq kuyuchin; hinaspapas sut’inchanapaqmi imaynatas yawarpa aswan ch’aqwasqa, haykuq partenkuna umaman rinku, manan huk cheqasmanchu, manan huk causata yuyaykunachu, aswanpas chaykunata purichiq arteriakuna sonqota aswan chiqan chirupi saqeqkunan , hinallataq, mecánica nisqa kamachikuykunaman hina, chaykunaqa kaqllataqmi naturalezaq kaqninwan, askha imakuna huk ladollapi kuska purinankupaq, mana llapanta chaskinankupaq suficiente espacio kashaqtin, imaynan hamuq yawarpa partenkunamanpas pasakun . sonqoq lloq’e k’uchunmanta lloqsispa llapankutaq umaman tendenciayoq kanku, aswan kallpasapakunan aswan pisi kallpayoqman, pisi ch’aqwasqakunamanpas ñanta qonanku, chaymi sapallanku chayananku.
Había yo explicado, con bastante detenimiento, todas estas cosas en el tratado que tuve el propósito de publicar.	Sut’incharqanin, allintapuni, tukuy kaykunata, chay tratadopi, chaytan horqoyta yuyaykurqani.
Y después había mostrado cuál debe ser la fábrica de los nervios y de los músculos del cuerpo humano, para conseguir que los espíritus animales, estando dentro, tengan fuerza bastante a mover los miembros, como vemos que las cabezas, poco después de cortadas, aun se mueven y muerden la tierra, sin embargo de que ya no están animadas; cuáles cambios deben verificarse en el cerebro para causar la vigilia, el sueño y los ensueños; cómo la luz, los sonidos, los olores, los sabores, el calor y demás cualidades de los objetos exteriores pueden imprimir en el cerebro varias ideas, por medio de los sentidos; cómo también pueden enviar allí las suyas el hambre, la sed y otras pasiones interiores; qué deba entenderse por el sentido común, en el cual son recibidas esas ideas; qué por la memoria, que las conserva y qué por la fantasía, que puede cambiarlas diversamente y componer otras nuevas y también puede, por idéntica manera, distribuir los espíritus animales en los músculos y poner en movimiento los miembros del cuerpo, acomodándolos a los objetos que se presentan a los sentidos y a las pasiones interiores, en tantos varios modos cuantos movimientos puede hacer nuestro cuerpo sin que la voluntad los guíe; lo cual no parecerá de ninguna manera extraño a los que, sabiendo cuántos autómatas o máquinas semovientes puede construir la industria humana, sin emplear sino poquísimas piezas, en comparación de la gran muchedumbre de huesos, músculos, nervios, arterias, venas y demás partes que hay en el cuerpo de un animal, consideren este cuerpo como una máquina que, por ser hecha de manos de Dios, está incomparablemente mejor ordenada y posee movimientos más admirables que ninguna otra de las que puedan inventar los hombres.	Hinaspa chaymantaqa rikuchisqañan imayna kananta runaq cuerponpa nervionkunaq, aychakunaq estructuran, chayman chayananpaq uywa espiritukuna, ukhupi kashaspa, suficiente kallpayoq kanankupaq, miembrokunata kuyuchinankupaq, rikusqanchis hina umakuna, kasqankumanta pisi tiempollamanta kuchusqa, paykunapas kuyurispa allpata kaninku, manaña kawsaqña kaptinkupas; ima tikrakuykunam umanchikpi kanan rikchariy, puñuy, musquy ima kananpaq; imaynatas hawa kaqkunamanta k’anchay, t’oqyaykuna, q’apaykuna, malliykuna, ruphay, huk sumaq kayninkunapas umanchispi imaymana yuyaykunata qelqankuman, sientekunaq chawpinta; imaynatas yarqay, ch’akiy, huk ukhu munakuypas chayman paykunaq kaqta apachinman; imakunatan hamut’ana allin yuyaywan, chaypin kay yuyaykuna chaskikun; imataq yuyariywan, imataq waqaychan, imataq fantasía nisqawan, chaytaq imaymanata t’ikrayta atin, mosoq espiritukunatapas ruwayta atin, hinallataq, kaqllatataq, aychakunapi uywa espiritukunata rakiyta atin, cuerpoq k’akinkunatapas kuyuchiyta atin, chayman acomodaspa objetokuna, chaykunatan rikuchinku sentidokunaman, ukhu pasioneskunamanpas, askha imaymana ruwaykunapi cuerponchis kuyuykunata ruwayta atisqanman hina mana munaynin pusaspa; Kayqa manan imapipas admirakuypaqchu rikch’akunqa pikunachus, yachaspa hayk’a automata otaq kikinmanta puriq maquinakunata industria runaq ruwayninta atinman, ancha pisi partekunallata utilizaspa, askha tullukunawan, aychakunawan, nerviokunawan, arteriakunawan, venakunawan huk partekunawanpas tupachisqa uywaq cuerponpi kasqanmanta, kay cuerpota qhawariy huk maquinata hina, Diospa makinwan ruwasqa kasqanrayku, mana tupachiy atina aswan allin ordenasqa, aswan admirable kuyuyniyoq ima, runakunaq inventasqanmantaqa.
Y aquí me extendí particularmente, haciendo ver que si hubiese máquinas tales que tuviesen los órganos y figura exterior de un mono o de otro cualquiera animal, desprovisto de razón, no habría medio alguno que nos permitiera conocer que no son en todo de igual naturaleza que esos animales; mientras que si las hubiera que semejasen a nuestros cuerpos e imitasen nuestras acciones, cuanto fuere moralmente posible, siempre tendríamos dos medios muy ciertos para reconocer que no por eso son hombres verdaderos; y es el primero, que nunca podrían hacer uso de palabras ni otros signos, componiéndolos, como hacemos nosotros, para declarar nuestros pensamientos a los demás, pues si bien se puede concebir que una máquina esté de tal modo hecha, que profiera palabras, y hasta que las profiera a propósito de acciones corporales que causen alguna alteración en sus órganos, como, verbi gratia, si se la toca en una parte, que pregunte lo que se quiere decirle, y si en otra, que grite que se le hace daño, y otras cosas por el mismo estilo, sin embargo, no se concibe que ordene en varios modos las palabras para contestar al sentido de todo lo que en su presencia se diga, como pueden hacerlo aun los más estúpidos de entre los hombres; y es el segundo que, aun cuando hicieran varias cosas tan bien y acaso mejor que ninguno de nosotros, no dejarían de fallar en otras, por donde se descubriría que no obran por conocimiento, sino sólo por la disposición de sus órganos, pues mientras que la razón es un instrumento universal, que puede servir en todas las coyunturas, esos órganos, en cambio, necesitan una particular disposición para cada acción particular; por donde sucede que es moralmente imposible que haya tantas y tan varias disposiciones en una máquina, que puedan hacerla obrar en todas las ocurrencias de la vida de la manera como la razón nos hace obrar a nosotros.	Hinaspa kaypi astawanqa mastarirqani, señalaspay, sichus kanman chayna maquinakuna monopa utaq ima animalpa órganonwan hawa figuranwan, mana razonniyuq, mana kanmanchu mediokuna yachananchikpaq mana llapanpichu kasqankuta chay uywakuna hina kikin naturaleza; ichaqa sichus kanman cuerponchisman rikch’akuq, ruwasqanchista qatipakuq, moralmente atisqanchisman hina, sapa kutinmi iskay ancha seguro mediokunayoq kasunman mana chayraykuchu cheqaq qhari kasqankuta reparananchispaq; hinaspapas ñawpaq kaqmi, manan hayk’aqpas simikunata otaq huk señalkunatapas utilizayta atirqankuchu, chaykunata ruwaspa, ñoqanchis hina, yuyayninchiskunata hukkunaman willanankupaq, imaraykuchus atikunmanña yuyaykuyta huk makina chhayna ruwasqa kasqanmanta, chay simikunatan riman, chaykunata rimanankamataq cuerponpa ruwayninkunamanta, chaykunan órganos nisqapi ima cambiotapas apamun, ahinataq, verbi gratia, huk partepi llamiykuqtinqa tapuy ima niyta munasqanmanta, huk partepi kaqtintaq chayta qapariy payqa k’irisqa , hinallataq huk kaqlla estiloyoq kaqkunapas, ichaqa manan yuyaykunapaq hinachu, imaymanamanta simikunata kamachin, ñawpaqenpi tukuy ima nisqanpa ima niy munayninta kutichinanpaq, imaynan aswan sonso runakunapas ruwayta atinkuman hina; iskay kaqtaqmi, askha ruwaykunata ruwashaspapas, ichapas mayqenninchismantapas aswan allinta ruwashaspapas, manan saqenkumanchu hukkunapi pantayta, chaypin tarikunman mana yachaywanchu ruwasqankuta, aswanpas disposiciónllanwan órganonku, imaraykuchus razonqa universal instrumento kashaqtinpas, chaytaqa llapa junturakunapin utilizakunman, ichaqa kay órganokunan ichaqa necesitanku sapa acción particularpaq huk disposición particularta; chaywanmi pasakun, moralmente mana atikuqmi huk makinapi askha askha disposicionkuna kananpaq, chaymi llapa kawsaypi sucedesqanpi llank’achiyta atinku, imaynan razonpas llank’achiwanchis hinata.
Ahora bien: por esos dos medios puede conocerse también la diferencia que hay entre los hombres y los brutos, pues es cosa muy de notar que no hay hombre, por estúpido y embobado que esté, sin exceptuar los locos, que no sea capaz de arreglar un conjunto de varias palabras y componer un discurso que dé a entender sus pensamientos; y, por el contrario, no hay animal, por perfecto y felizmente dotado que sea, que pueda hacer otro tanto.	Kunanqa, kay iskay ruwaywanmi yachakunmantaqmi runakunaq, brutokunaq mana kaqlla kasqankuta, ancha admirakuypaqmi, manan kanchu runa, may sonsoña, mana yuyayniyoqña kaqtinpas, mana loco runata saqespa, mana allichay atiq achka simikunata huñuspa yuyayninkunata willakuq rimayta qillqaspa; hinaspapas, aswanpas manan kanchu uywapas, mayña hunt’asqaña, kusisqaña dotasqaña kanman chaypas, chayta ruwayta atinman.
Lo cual no sucede porque a los animales les falten órganos, pues vemos que las urracas y los loros pueden proferir, como nosotros, palabras, y, sin embargo, no pueden, como nosotros, hablar, es decir, dar fe de que piensan lo que dicen; en cambio los hombres que, habiendo nacido sordos y mudos, están privados de los órganos, que a los otros sirven para hablar, suelen inventar por sí mismos unos signos, por donde se declaran a los que, viviendo con ellos, han conseguido aprender su lengua.	 Kayqa manam chaynachu, uywakunapa mana órganoyuq kasqankurayku, qawasqanchikraykum, urrachakunapas, lorokunapas, ñuqanchik hina, rimaykunata rimayta atisqankuta, chaywanpas manam ñuqanchik hinaqa rimayta atinkuchu, chaymi qawachinku piensasqankuta, imatataq ninku; en cambio los hombres que, habiendo nacido sordos y mudos, están privados de los órganos, que a los otros sirven para hablar, suelen inventar por sí mismos unos signos, por donde se declaran a los que, viviendo con ellos, han conseguido aprender su qallu.
Y esto no sólo prueba que las bestias tienen menos razón que los hombres, sino que no tienen ninguna; pues ya se ve que basta muy poca para saber hablar; y supuesto que se advierten desigualdades entre los animales de una misma especie, como entre los hombres, siendo unos más fáciles de adiestrar que otros, no es de creer que un mono o un loro, que fuese de los más perfectos en su especie, no igualara a un niño de los más estúpidos, o, por lo menos, a un niño cuyo cerebro estuviera turbado, si no fuera que su alma es de naturaleza totalmente diferente de la nuestra.	Hinaspapas kayqa manan prueballanchu animalkuna runakunamanta pisi razonniyoq kasqankuta, aswanpas mana yuyayniyoq kasqankutan; Bueno, qawakunñam ancha pisilla rimayta yachanapaq; Hinaspapas, huk rikchaq uywakunapura mana kaqlla kasqankuta qawarispa, qaripura hina, wakinqa wakinmanta aswan facil yachachiy kasqanrayku, manam creenachu huk mono utaq huk loro, hukninmi aswan huntasqa rikchaq uywakuna, chayta ruwananta manataqmi igualanmanchu aswan sonso wawawan, otaq al menos huk wawawan umallan sasachakuypi tarikuq, manachus almanqa hukniraypuni kanman noqanchismanta chayqa.
Y no deben confundirse las palabras con los movimientos naturales que delatan las pasiones, los cuales pueden ser imitados por las máquinas tan bien como por los animales, ni debe pensarse, como pensaron algunos antiguos, que las bestias hablan, aunque nosotros no comprendemos su lengua; pues si eso fuera verdad, puesto que poseen varios órganos parecidos a los nuestros, podrían darse a entender de nosotros como de sus semejantes.	Hinaspapas simikunataqa manan pantachinachu chay pasiones nisqakunata traicionaq natural movimientokunawan, chaykunataqa makinakunapas, uywakunapas qatipakunmanmi, nitaqmi yuyaykunachu, wakin ñawpa runakunaq yuyaykusqankuman hina, animalkuna rimasqankuta, manaña rimasqankuta entiendespapas. ; imaraykuchus chay cheqaq kanman chayqa, ñoqanchisman rikch’akuq askha órganoyoq kasqankuraykun noqanchismanta entiendekunman runamasinkumanta hina.
