español	quechua
Pero confieso que son precisos largos ejercicios y reiteradas meditaciones para acostumbrarse a mirar todas las cosas por ese ángulo; y creo que en esto consistía principalmente el secreto de aquellos filósofos, que pudieron antaño sustraerse al imperio de la fortuna, y a pesar de los sufrimientos y la pobreza, entrar en competencia de ventura con los propios dioses.	Ichaqa confesani, unay ejerciciokuna, sapa kutilla yuyaymanaykuna ima, chay ángulomanta tukuy imata qhawayman yachasqa kanapaq; hinaspapas creenin kaypi aswantaqa chay filósofokunaq pakasqa kasqanpi, paykunan ñawpaqpiqa fortuna imperiomanta ayqekuyta atirqanku, ñak’ariypi wakcha kashaspapas, kikin dioskunawan kusisqa atipanakuyman haykunku.
Pues, ocupados sin descanso en considerar los límites prescritos por la naturaleza, persuadíanse tan perfectamente de que nada tenían en su poder sino sus propios pensamientos, que esto sólo era bastante a impedirles sentir afecto hacia otras cosas; y disponían de esos pensamientos tan absolutamente, que tenían en esto cierta razón de estimarse más ricos y poderosos y más libres y bienaventurados que ningunos otros hombres, los cuales, no teniendo esta filosofía, no pueden, por mucho que les hayan favorecido la naturaleza y la fortuna, disponer nunca, como aquellos filósofos, de todo cuanto quieren.	 Imaraykuchus, mana samaspa ocupasqa kaspanku, naturalezaq kamachisqan limitekunata qhawarispa, ancha allinta convencisqa karqanku mana imapas atiyninkupi kasqanmanta, aswanpas kikin yuyayninkumanta, chaymi kaylla suficiente karqan huk imakunatapas munakuyta hark’anankupaq; hinaspataq kay yuyaykunata ancha hunt’asqata wikch’urqanku, chaymi kay cheqaq razonpi aswan qhapaq, aswan atiyniyoq, aswan libre, aswan saminchasqa qhawarikunankupaq huk runakunamanta, mana kay filosofíayoq kaspa, manan atinkuchu, may chhika favorecesqaña karqanku chaypas naturalezawan hinallataq Fortunawanqa manan hayk’aqpas disponenchu, chay filósofokuna hina, tukuy munasqankuta.
En fin, como conclusión de esta moral, ocurrióseme considerar, una por una, las diferentes ocupaciones a que los hombres dedican su vida, para procurar elegir la mejor; y sin querer decir nada de las de los demás, pensé que no podía hacer nada mejor que seguir en la misma que tenía; es decir, aplicar mi vida entera al cultivo de mi razón y adelantar cuanto pudiera en el conocimiento de la verdad, según el método que me había prescrito.	Tukuchanapaqtaq, kay moralidadpa tukukuynin hina, yuyayniyman hamurqa, hukmanta hukmanta, qharikuna kawsayninkuta qusqanku imaymana llamkaykunata, aswan allin kaqta akllanankupaq kallpanchakunaypaq; hukkunaq kaqninkunamanta mana imatapas niyta munaspaymi yuyaykurqani, manan aswan allintaqa ruwayta atiymanchu, chay kikin kaqniypi hinalla purinaymantaqa; chaymi niyta munan, tukuy kawsayniyta churanaypaq yuyayniy tarpunaypaq, hinallataq cheqaq yachaypi atisqallayman hina ñawpaqman purinaypaq, ñoqapaq kamachisqa métodoman hina.
Tan extremado contento había sentido ya desde que empecé a servirme de ese método, que no creía que pudiera recibirse otro más suave e inocente en esta vida; y descubriendo cada día, con su ayuda, algunas verdades que me parecían bastante importantes y generalmente ignoradas de los otros hombres, la satisfacción que experimentaba llenaba tan cumplidamente mi espíritu, que todo lo restante me era indiferente.	 Kay métodota llamk’ayta qallarisqaymantapachan sinchi kusisqaña sientekurqani, chaymi mana creerqanichu huk aswan llamp’u sonqo mana huchayoq kay kawsaypi chaskisqa kananta; hinaspa sapa p’unchay, yanapayninwan, wakin cheqaq kaqkunata tarispa, chaykunatan ñoqapaqqa ancha importante hina rikch’akurqan, huk qharikunaq mana qhawarisqantaqmi karqan, chay satisfacción experimentasqaymi espirituyta hunt’aykuchirqan, chaymi tukuy imapas mana interesakuwarqanchu.
Además, las tres máximas anteriores fundábanse sólo en el propósito, que yo abrigaba, de continuar instruyéndome; pues habiendo dado Dios a cada hombre alguna luz con que discernir lo verdadero de lo falso, no hubiera yo creído un solo momento que debía contentarme con las opiniones ajenas, de no haberme propuesto usar de mi propio juicio para examinarlas cuando fuera tiempo; y no hubiera podido librarme de escrúpulos, al seguirlas, si no hubiese esperado aprovechar todas las ocasiones para encontrar otras mejores, dado caso que las hubiese; y, por último, no habría sabido limitar mis deseos y estar contento, si no hubiese seguido un camino por donde, al mismo tiempo que asegurarme la adquisición de todos los conocimientos que yo pudiera, pensaba también por el mismo modo llegar a conocer todos los verdaderos bienes que estuviesen en mi poder; pues no determinándose nuestra voluntad a seguir o a evitar cosa alguna, sino porque nuestro entendimiento se la representa como buena o mala, basta juzgar bien, para obrar bien, y juzgar lo mejor que se pueda, para obrar también lo mejor que se pueda; es decir, para adquirir todas las virtudes y con ellas cuantos bienes puedan lograrse; y cuando uno tiene la certidumbre de que ello es así, no puede por menos de estar contento.	Hinaspapas, ñawpaq kinsa máximas nisqakunaqa, chay propósitollapin sayarirqan, chaytan waqaycharqani, educacionta hinalla purinaypaq; Dios sapa runaman huk k’anchayta qosqanrayku, chaywanmi cheqaq kaqta llulla kaqtapas reparayman karqan, manan huk ratollapas creeymanchu karqan hukkunaq yuyaykusqankuwan contentakunaypaq, manachus yuyaykuyman karqan chaykunata t’aqwinaypaq kikiypa yuyaykusqaywan pacha puqusqaña kaptin; manataqmi iskrúpulokunamanta kacharikuyta atiymanchu karqan, chaykunata qatispa, manachus suyakuyman karqan sapa oportunidadta aprovechayta aswan allinkunata tarinaypaq, sichus kanman karqan chayqa; hinaspa tukupaypi, manan yachaymanchu karqan imaynatas munasqaykunata limitayta, contento kayta ima, sichus mana huk ñanta qatiymanchu karqan, chaywan kuska, llapa yachaykunata atisqayta hap’iyta qhawarispa, hinallataq yuyaykurqani llapa cheqaq kaqniyoq kaqkunata reqsinaypaq, chaykunan ñoqaq kasharqan; Munayninchis mana imatapas qatipanapaq otaq karunchakunapaq decidisqa kasqanrayku, aswanpas entiendesqanchis allin otaq mana allin kananpaq representasqanraykun, allinta juzgaspa, allinta ruwaspa, atisqanchisman hina juzgaspapas, aswan allinta ruwasunmanpas; chaymi, llapa allin kaqkunata, chaykunawantaq llapa allin kaqkunata tarinapaq; chayna kasqanmanta seguro kaspanqa manam mana kusisqa kayta atinchu.
Habiéndome, pues, afirmado en estas máximas, las cuales puse aparte juntamente con las verdades de la fe, que siempre han sido las primeras en mi creencia, pensé que de todas mis otras opiniones podía libremente empezar a deshacerme; y como esperaba conseguirlo mejor conversando con los hombres que permaneciendo por más tiempo encerrado en el cuarto en donde había meditado todos esos pensamientos, proseguí mi viaje antes de que el invierno estuviera del todo terminado.	Hinaptinqa, kay máximas nisqakunapi takyachikuspaymi, iñiypa chiqap kayninwan kuska sapaqchasqayrayku, chaykunaqa iñiyniypi punta kaqmi karqa, chaymi piensarqani llapa huk yuyayniykunata mana manchakuspa qichuyta qallaykunaypaq; hinaspapas qharikunawan rimaspa aswan allinta aypayta suyakusqayman hina, llapan kay yuyaykusqayta yuyaymanasqay cuartopi aswan unayta wisq’asqa qhepakuymantaqa, manaraq chiri tiempo tukukushaqtinmi purisqayta hinalla ruwarqani.
Y en los nueve años siguientes, no hice otra cosa sino andar de acá para allá, por el mundo, procurando ser más bien espectador que actor en las comedias que en él se representan, e instituyendo particulares reflexiones en toda materia sobre aquello que pudiera hacerla sospechosa y dar ocasión a equivocarnos, llegué a arrancar de mi espíritu, en todo ese tiempo, cuantos errores pudieron deslizarse anteriormente.	 Hinaspa qatiqnin isqun watakunapi, manam imatapas ruwarqanichu, aswanqa kaymanta chayman purirqani, pachantinpi, chaypi representasqa comediakunapi aswan qhawaq kanaypaq, aswan actor kanaypaq, hinaspa tukuy imamanta reflexionkunata particularta institucionarqani imakuna atisqanmanta sospechoso ruway hinaspa pantanaykupaq oportunidadta qowaspayku, espirituymanta llik’inaypaq hamurqani, tukuy chay tiempopi, hayk’a pantaykunan ñawpaqta llimp’ikunman.
Y no es que imitara a los escépticos, que dudan por sólo dudar y se las dan siempre de irresolutos; por el contrario, mi propósito no era otro que afianzarme en la verdad, apartando la tierra movediza y la arena, para dar con la roca viva o la arcilla.	Hinaspapas manan iskayrayaq runakunata qatipakusqanraykuchu, paykunaqa iskayrayasqankuraykun iskayrayanku, sapa kutitaqmi mana decidisqa hina ruwanku; aswanpas, yuyaykusqayqa manan hukchu karqan, aswanpas cheqaqpi takyanaypaqmi, kawsaq rit’ita rit’itawan t’aqaspa, kawsaq qaqata otaq t’uruta tarinaypaq.
Lo cual, a mi parecer, conseguía bastante bien, tanto que, tratando de descubrir la falsedad o la incertidumbre de las proposiciones que examinaba, no mediante endebles conjeturas, sino por razonamientos claros y seguros, no encontraba ninguna tan dudosa, que no pudiera sacar de ella alguna conclusión bastante cierta, aunque sólo fuese la de que no contenía nada cierto.	 Chaytaq, ñuqapaqqa allin allinta ruwarqan, chaymi, qhawarisqan proposicionkunaq llulla kayninta otaq mana seguro kayninta tariyta munaspa, manan mana pisi conjeturakunawanchu, aswanpas sut’i, seguro razonamientowan, manan tarirqanchu mayqentapas chay hina iskayrayanapaq hina manataqmi chaymantaqa allintachu nisunman, sichus mana ima seguropas chaypichu kashan chayqa.
Y así como al derribar una casa vieja suelen guardarse los materiales, que sirven para reconstruir la nueva, así también al destruir todas aquellas mis opiniones que juzgaba infundadas, hacía yo varias observaciones y adquiría experiencias que me han servido después para establecer otras más ciertas.	 Hinaspapas imaynan huk mawk’a wasi thunispaqa, mosoq wasita wakmanta hatarichinapaq materialkunata waqaychanku, chhaynallataqmi llapa yuyaykusqayta mana cheqaqpaq qhawarisqayta chinkachispa, imaymana qhawariykunata ruwarqani, experienciakunatapas adquirirqanin, chaykunan qhepaman yanapawarqan aswan wakinta sayarichinaypaq .
Y además seguía ejercitándome en el método que me había prescrito; pues sin contar con que cuidaba muy bien de conducir generalmente mis pensamientos, según las citadas reglas, dedicaba de cuando en cuando algunas horas a practicarlas particularmente en dificultades de matemáticas, o también en algunas otras que podía hacer casi semejantes a las de las matemáticas, desligándolas de los principios de las otras ciencias, que no me parecían bastante firmes; todo esto puede verse en varias cuestiones que van explicadas en este mismo volumen.	Hinaspapas, hinallataqmi ejerciciota ruwarqani chay método nisqanman hina; Mana rimanapaq, ancha allinta cuidarqani yuyayniykunata generalmente purichiyta, ñawpaq rimasqa kamachikuykunaman hina, sapa kuti huk iskay kinsa horakunata practicaq kani, particularmente matemáticas sasachakuykunapi, otaq wakin hukkunapipas yaqa rikch’akuq ruwayman matemáticas nisqamanta kaqkuna, huk cienciakunaq kamachikuyninkunamanta t’aqaspa, chaykunaqa manan allin takyasqa hinachu rikch’akurqan; Tukuy chaykunataqa rikusunmanmi imaymana revistakunapi, chaykunatan sut’inchakun kay kikin tomopi.
Y así, viviendo en apariencia como los que no tienen otra ocupación que la de pasar una vida suave e inocente y se ingenian en separar los placeres de los vicios y, para gozar de su ocio sin hastío, hacen uso de cuantas diversiones honestas están a su alcance, no dejaba yo de perseverar en mi propósito y de sacar provecho para el conocimiento de la verdad, más acaso que si me contentara con leer libros o frecuentar las tertulias literarias.	 Hinaspa chayna, kawsaspaqa, mana huk ocupacionniyuq runakuna hina, aswanqa llampu hinaspa mana huchayoq kawsayta purichiy hinaspa kusikuykunata viciokunamanta rakiyta hinaspa, mana aburrikuspa kusirikunankupaq, tukuy honrado kusirikuykunata aprovechanankupaq alcance nisqapiqa manan saqerqanichu propósitoypi mana saqespa, cheqaq kaqta yachaytapas aprovechaspay, aswantachá librokunata leespa otaq sapa kutilla literatura huñunakuykunaman rispa contento kani.
Sin embargo, transcurrieron esos nueve años sin que tomara yo decisión alguna tocante a las dificultades de que suelen disputar los doctos, y sin haber comenzado a buscar los cimientos de una filosofía más cierta que la vulgar.	Ichaqa chay isqon watakunan pasarqan mana imatapas decidispay yachaysapakunaq ch’aqwasqanku sasachakuykunamanta, manataqmi maskhayta qallarirqanichu aswan cheqaq filosofíaq teqsinkunata maskhayta vulgar nisqamantaqa.
Y el ejemplo de varios excelentes ingenios que han intentado hacerlo, sin, a mi parecer, conseguirlo, me llevaba a imaginar en ello tanta dificultad, que no me hubiera atrevido quizá a emprenderlo tan presto, si no hubiera visto que algunos propalaban el rumor de que lo había llevado a cabo.	 Hinaspapas askha allin geniokunaq ejemplon, paykunan chayta ruwayta munarqanku, mana, ñoqaman hina, allinta ruwaspa, pusawarqan chaypi chhayna sasachakuy kashaqta yuyaymananaypaq, ichapas mana atrevikuymanchu karqan chay hina usqhaylla chayta ruwayta, mana rikuspayqa wakinkuna chayta ruwasqanmanta rimayta mast’arisqankuta.
No me es posible decir qué fundamentos tendrían para emitir tal opinión, y si en algo he contribuido a ella, por mis dichos, debe de haber sido por haber confesado mi ignorancia, con más candor que suelen hacerlo los que han estudiado un poco, y acaso también por haber dado a conocer las razones que tenía para dudar de muchas cosas, que los demás consideran ciertas, mas no porque me haya preciado de poseer doctrina alguna.	 Manan atiymanchu niyta ima razonkunayoq kankuman chay hina yuyayta horqonankupaq, sichus imaynapipas chayman yanapakurqani chayqa, rimasqaywan chayqa, mana yachayniyta willakusqayraykuchá karqan, aswan sut’ita rimaspa pisillata estudiaqkunan chayta ruwanku, yaqapaschá askha imaymanakunamanta iskayrayanay kasqanmanta willasqayraykupas, chaykunatan hukkuna cheqaqpaq qhawarinku, ichaqa manan ima yachachikuyniyoq kasqaymanta alabakusqayraykuchu.
Pero como tengo el corazón bastante bien puesto para no querer que me tomen por otro distinto del que soy, pensé que era preciso procurar por todos los medios hacerme digno de la reputación que me daban; y hace ocho años precisamente, ese deseo me decidió a alejarme de todos los lugares en donde podía tener algunos conocimientos y retirarme aquí, en un país en donde la larga duración de la guerra ha sido causa de que se establezcan tales órdenes, que los ejércitos que se mantienen parecen no servir sino para que los hombres gocen de los frutos de la paz con tanta mayor seguridad, y en donde, en medio de la multitud de un gran pueblo muy activo, más atento a sus propios negocios que curioso de los ajenos, he podido, sin carecer de ninguna de las comodidades que hay en otras más frecuentadas ciudades, vivir tan solitario y retirado como en el más lejano desierto.	Ichaqa sonqoy allin churasqa kasqanraykun mana huk runaraykuchu hap’isqa kayta munani, manan imayna kasqayman hinachu, chaymi yuyaykurqani tukuy imapipas kallpachakunaypaq, paykunaq qowasqanku allin reqsisqa kanaypaq; hinallataq pusaq wata ñawpaqtaraq, chay munaymi decidiwarqan llapa cheqaskunamanta karunchakunaypaq, maypichus wakin yachayniyoq kayman karqan, kaypi jubilakunaypaq, huk suyupi maypichus awqanakuy unay watakuna kasqanmi chay hina kamachikuykunata churarqan, chay ejercitokuna chaykuna mantenidoqa servinkuman hinan runakuna aswan hatun seguridadwan thak kaypa rurunkunata kusikunankupaq, hinallataq maypichus, askha hatun ancha llank’aq runakunaq chawpinpi, aswanta qhawarinku kikinkupaq negocionkuta, hukkunaq ruwayninmanta yachayta munaspaqa , Atirqanim, mana imapas faltaspa huk aswan achka riq llaqtakunapi tarisqay sumaq kay, sapallay hinaspa karunchasqa kawsakuyta aswan karu chunniqpi hina.
Cuarta parte	 Tawa kaq raki
No sé si debo hablaros de las primeras meditaciones que hice allí, pues son tan metafísicas y tan fuera de lo común, que quizá no gusten a todo el mundo.	Mana yachanichu chaypi ruwasqaymanta ñawpaq yuyaymanaykunamanta willanaychu icha manachu, imaraykuchus ancha metafísico, ancha mana ordinario kasqanrayku, ichapas mana llapa runaman gustanqachu.
Sin embargo, para que se pueda apreciar si los fundamentos que he tomado son bastante firmes, me veo en cierta manera obligado a decir algo de esas reflexiones.	 Ichaqa, chaynapi chaninchasqa kananpaq sichus chay cimientokuna hapisqay allin takyasqa kaptinqa, obligasqa hinam tarikuni kay yuyaymanaykunamanta imatapas ninaypaq.
Tiempo ha que había advertido que, en lo tocante a las costumbres, es a veces necesario seguir opiniones que sabemos muy inciertas, como si fueran indudables, y esto se ha dicho ya en la parte anterior; pero, deseando yo en esta ocasión ocuparme tan sólo de indagar la verdad, pensé que debía hacer lo contrario y rechazar como absolutamente falso todo aquello en que pudiera imaginar la menor duda, con el fin de ver si, después de hecho esto, no quedaría en mi creencia algo que fuera enteramente indudable.	 Ñawpaqtaraqmi advertisqa karqani, costumbrekunamanta rimaspaqa, mayninpiqa ancha mana seguro kasqankuta yachasqanchik yuyaykunata qatipananchikmi, mana iskayrayanapaq hina, chaytaqa ñawpaq partepiqa nisqañam; ichaqa, kay kutipi cheqaq kaqta yachayllapi ocupakuyta munaspay, yuyaykurqani contrariota ruwanaypaq, hinaspataq tukuy imapi pisi iskayrayaytapas yuyaykuyman hina absolutamente llulla hina wikch’unaypaq, chayta ruwaspa, chayta ruwaspa, chayta ruwanaypaq mana qhipakunkuchu.iñisqaypi imapas mana iskayrayanapaq kaq.
Así, puesto que los sentidos nos engañan, a las veces, quise suponer que no hay cosa alguna que sea tal y como ellos nos la presentan en la imaginación; y puesto que hay hombres que yerran al razonar, aun acerca de los más simples asuntos de geometría, y cometen paralogismos, juzgué que yo estaba tan expuesto al error como otro cualquiera, y rechacé como falsas todas las razones que anteriormente había tenido por demostrativas; y, en fin, considerando que todos los pensamientos que nos vienen estando despiertos pueden también ocurrírsenos durante el sueño, sin que ninguno entonces sea verdadero, resolví fingir que todas las cosas, que hasta entonces habían entrado en mi espíritu, no eran más verdaderas que las ilusiones de mis sueños.	Chay hinaqa, wakin kutipiqa sentidokuna engañawasqanchisraykun, yuyaykuyta munarqani, manan imapas kanmanchu imaynan imaginacionpi presentawanchis hina; hinaspapas kanmi runakuna pantaqkuna razonamientopi, geometríamanta aswan sasa asuntokunamantapas, hinaspa paralogismokunata ruwaqkuna, chaymi juzgarqani huk runa hina pantanaypaq hina kasqayta, hinaspapas llullapaqmi rechazarqani llapa razonkunata, chaykunatam ñawpaqpi hapirqani rikuchiq; Hinaspa tukunanpaq, qhawarispa, llapa yuyaykuna rikch’asqa kashaspa hamuwanchis, puñuypipas hamuwasunman, mana mayqenpas chaymanta cheqaq kashaqtin, yuyaykurqani chaykama yuyayniyman haykuq llapa imakuna mana aswan cheqaqchu kasqanman hina ruwanaypaq paykunaqa karqanku.musquyniypa ilusionesnin
Pero advertí luego que, queriendo yo pensar, de esa suerte, que todo es falso, era necesario que yo, que lo pensaba, fuese alguna cosa; y observando que esta verdad: «yo pienso, luego soy», era tan firme y segura que las más extravagantes suposiciones de los escépticos no son capaces de conmoverla, juzgué que podía recibirla sin escrúpulo, como el primer principio de la filosofía que andaba buscando.	"Ichaqa qhepamanmi repararqani, yuyaykuyta munaspa, kay hinata, tukuy imapas llulla kasqanmanta, necesario karqan ñoqa, chayta yuyaykuq, imapas kasqay; hinaspa kay cheqaq kaq: ""Piensani, chayraykun kani"" ancha takyasqa, seguro kasqanmanta, iskeptikokunaq aswan extravagante suposicionninkuna mana chhaphchiyta atisqankuta qhawarispa, juzgarqani mana escrúpuloyoq chaskiyta atisqayta, filosofíaq ñawpaq kaq kamachikuynin hina chayta maskhasqayta."
Examiné después atentamente lo que yo era, y viendo que podía fingir que no tenía cuerpo alguno y que no había mundo ni lugar alguno en el que yo me encontrase, pero que no podía fingir por ello que yo no fuese, sino al contrario, por lo mismo que pensaba en dudar de la verdad de las otras cosas, se seguía muy cierta y evidentemente que yo era, mientras que, con sólo dejar de pensar, aunque todo lo demás que había imaginado fuese verdad, no tenía ya razón alguna para creer que yo era, conocí por ello que yo era una sustancia cuya esencia y naturaleza toda es pensar, y que no necesita, para ser, de lugar alguno, ni depende de cosa alguna material; de suerte que este yo, es decir, el alma, por la cual yo soy lo que soy, es enteramente distinta del cuerpo y hasta más fácil de conocer que éste y, aunque el cuerpo no fuese, el alma no dejaría de ser cuanto es.	Hinaptinmi allinta qawarqani ima kasqayta, hinaspa qawarqani mana cuerpoyniyuq hina ruwayta atisqayta hinaspa mana ima pachapas nitaq maypi tarikusqaytapas, ichaqa manam chayraykuchu mana kasqayta ruwayta atirqanichu, aswanqa chaypi kasqayta contrario, imaraykuchus Imaynan hukkunaq cheqaq kasqanmanta iskayrayanaypaq yuyaykurqani, chay hinatan qatiparqan ancha seguro, sut’i rikukuq hina kasqayta, ichaqa, sichus yuyaykusqayta saqepuqtiyqa, tukuy ima yuyaykusqay cheqaqña kanman chaypas, manañan ima razonpas karqanchu creey., kasqayta, kaywan yacharqanin huk sustancia kasqayta, llapan esencianpas, naturalezanqa yuyaymanaymi, manataqmi necesitanchu, kananpaq, ima cheqastapas, nitaqmi ima materialmantapas dependenchu; chaymi kay ñoqa, chaymi alma, chaywantaq imachus kasqay, cuerpomanta llapanpi hukniray, aswan facilraqmi yachay qhepa kaqmantaqa, cuerpo manaña kanmanchu chaypas, almaqa manan saqenmanchu imachus kayta chaymi.
Después de esto, consideré, en general, lo que se requiere en una proposición para que sea verdadera y cierta; pues ya que acababa de hallar una que sabía que lo era, pensé que debía saber también en qué consiste esa certeza.	Kay qhepamanmi qhawarirqani, en general, imakunatan necesitakun huk proposicionpi cheqaq, seguro kananpaq; Bueno, chayllaraq hukninta tarisqayraykum yacharqani, chaymi piensarqani chay seguridad imamanta kasqanmanta yachanaytapas.
Y habiendo notado que en la proposición: «yo pienso, luego soy», no hay nada que me asegure que digo verdad, sino que veo muy claramente que para pensar es preciso ser, juzgué que podía admitir esta regla general: que las cosas que concebimos muy clara y distintamente son todas verdaderas; pero que sólo hay alguna dificultad en notar cuáles son las que concebimos distintamente.	" Hinaspa chayta reparaspa kay proposicionpi: ""Piensani, chayraykun kani"", manan imapas kanchu cheqaqta rimasqayta segurawananpaq, aswanpas ancha sut'ita rikusqayta, chayta yuyaykunaypaq necesario kananpaq, chayta juzgarqani Kay kamachiy generalta riqsikuyman: ancha sut’ita, sut’ita ima yuyaykusqanchiskunaqa llapanmi cheqaq kasqanmanta; ichaqa mayqenkunatachus huknirayta yuyaykunchis chayta reparanapaqqa wakin sasachakuylla kasqanmanta."
Después de lo cual, hube de reflexionar que, puesto que yo dudaba, no era mi ser enteramente perfecto, pues veía claramente que hay más perfección en conocer que en dudar; y se me ocurrió entonces indagar por dónde había yo aprendido a pensar en algo más perfecto que yo; y conocí evidentemente que debía de ser por alguna naturaleza que fuese efectivamente más perfecta.	 Chay qhepamanmi yuyaymananay karqan, iskayrayasqaymantapacha, kayniyqa manan llapanpichu hunt’asqa karqan, sut’ita rikusqayrayku, yachaypiqa aswan hunt’asqa kay kasqanmanta iskayrayaymantaqa; Hinaspa chaymanta yuyayniyman hamurqan maypi yachasqayta investiganaypaq, ñoqamanta aswan hunt’asqa kaqta yuyaykuyta; hinaspapas sut’itan yacharqani ima naturalezaraykuchá kanman, cheqaqpiqa aswan hunt’asqa.
En lo que se refiere a los pensamientos, que en mí estaban, de varias cosas exteriores a mí, como son el cielo, la tierra, la luz, el calor y otros muchos, no me preocupaba mucho el saber de dónde procedían, porque, no viendo en esas cosas nada que me pareciese hacerlas superiores a mí, podía creer que, si eran verdaderas, eran unas dependencias de mi naturaleza, en cuanto que ésta posee alguna perfección, y si no lo eran, procedían de la nada, es decir, estaban en mí, porque hay en mí algún defecto.	Yuyaykunamanta rimaspaqa, ñoqapi kashaq, imaymana hawaypi kaqkunamanta, hanaq pachamanta, pachamanta, k’anchaymanta, ruphaymanta, askha hukkunamantawan, manan anchatachu llakikurqani maymanta hamusqankuta yachaymanta, imaraykuchus, Kaykunapi mana imatapas rikuspa imakunachus ñoqamanta aswan allinman tukuchiq hina, creeyta atiyman karqan, cheqaq kaqtinqa, naturalezaymanta dependenciakuna kasqankuta, chaymi ima perfecciontapas hap’in, mana hina kaqtintaq mana imamanta hamusqankuta, chaymi niyta munan. , ñoqapi kasharqanku, ima defectopas ñoqapi kasqanrayku.
